And in fact,  most  methods that people now use  were  originally tried with something that was not their absolute  best system at  some  level.	0
But of course, sometimes it doesn't,	0
uh, port. So I think that's - that's an interesting question. If we're getting  three percent error on, uh,	0
u- uh, English, uh, nati- native speakers,	0
um, using the Aurora system, and we do some  improvements  and bring it from three to  two,	0
do those same improvements bring, uh, th- you know, [MASK] from one point three to - you know, to	0
point eight? Well.  You know, so that's - that's something we can  test.	0
I think we've -  we've covered that one up extremely well.	0
Yeah. So tha- so we'll - you know, maybe you guys'll have - have one. Uh, you - you and, uh - and Dan have - have a paper that -	1
that's going in. You know, that's - that's pretty solid, on [MASK]	1
Yeah. I will send you the - the final version, which is not -	0
And [MASK] here will - will definitely get something in	1
Actually this - this, um - So, there's another paper. It's a Eurospeech paper but not related to meetings.	0
But it's on  digits.  So,	0
uh, a colleague at [MASK] developed a improved version	0
And he tested it mostly on digits because it's sort of a - you know, it doesn't take weeks to train it.	0
And got some very impressive results, um,	0
with, you know, discriminative, uh, [MASK]	0
Um, you know, like, um,	0
error rates  go from - I don't know, in very  noisy  environment, like from,	0
I for- now I - O_K, now I have the order of magnit- I'm not sure about the order of magnitude. Was it like from ten percent to	0
e- e- you know, point -	0
you know, from one percent to point eight percent? I mean, it's a -	0
H- i- it got - it got better. Yeah, yeah.	0
It got  better.  That's the important thing. Yeah. But it's -	0
Hey, that's the same percent relative, so -	0
Yeah. Right. It's, uh, something in - Right.	0
Um,  let's see. I think the only thing we had left was - unless somebody else - Well,	0
there's a  couple  things. Uh, one is  anything that, um,	0
anybody has to say about Saturday? Anything we should do in prep for Saturday?	0
I guess everybody knows about -	0
I mean, u- um, Mari was asking - was trying to come up with something like an agenda and we're sort of fitting around people's times a bit.	0
clearly when we actually get here we'll  move things around this, as we need to, but -	0
so you can't  absolutely  count on it. But - but, uh -	0
Are we meeting in  here   probably  or - ? O_K.	0
That was my thought. I think this is -	0
We won't have enough microphones, but -	0
u- No. I - I  hadn't  in- intended to. We won- we wanna - I mean, they're -	0
there's gonna be, uh, Jeff, Katrin, Mari and two students. So there's five  from there.	0
And Brian's coming, so that's  six.	0
And plus all of us.	0
Can use the Oprah mike.	0
Depends how fast you can  throw it. It's just -	0
It seems like too many - too much coming and going.	0
We don't even have enough  channel  -	0
Because it would be a different kind of meeting, that's what I'm -	0
I hadn't  really thought of it, but -	0
Maybe just - maybe not the whole day but just, you know, maybe some - I mean, part of it?	0
That's their initiation into our	0
Into our - our - our cult.	0
Yeah, our - Yeah, our -	0
Maybe the sections that are not right afte- you know, after lunch when everybody's still munching and -	0
So can you send out a schedule once you know it, jus- ?	0
O_K. Yeah. I guess I sent it around a little bit. But -	0
Is - is there a r- ? There's a res-	0
Is it  changed  now, or - ?	0
I hadn't heard back from Mari after I - I u- u-	0
uh, brought up the point abou- about Andreas's schedule. So,	0
um, maybe when I get back there'll be  some - some mail from her.	0
I'm looking forward to seeing your representation. That'd be, uh -	0
So, I'll make a -	0
And w- we should get  the two meetings from y- I mean, I know about the first meeting, um,	0
I'd like to see that. Yeah.	0
but the other one that you did, the N_S_A one, which we  hadn't done cuz we weren't [MASK] because the non-native speaker -	0
there were  five  non-native speakers.	0
But, it would be useful for the -	0
to  see  what we get  with that one. So.	0
Which N_S_A meeting was that?	0
Great. O_K. It's, uh, two thousand eleven twenty-one one thousand.	0
Oh, we did - That was the  last  one I gave you.	0
Yeah,  three.  Right. So -	0
Great. I sent email when I finished the -	0
that one. That was sort of son-	0
N_S_ A  three, I think.	0
Yeah, that's right. That's right. That's much simpler.	0
I don't know what they said but I know the number.	0
Th- that part's  definitely  gonna confuse somebody who looks at these later. I mean, this is - we- we're recording secret N_S_A meetings? I mean, it's -	0
I remember the  date.  So.	0
Um.  Not the -  Yeah.	0
Uh. The - th- the -	0
It's network services and applications.	0
They  are  hard to understand.  They're very, uh, out there. I have no idea what they're talking about.	0
th- the  other  good thing about [MASK] is that, um, it's not always the  machine's  fault if it doesn't work.  So, you can actually find, um,	1
It's the person's fault.  It's Morgan's fault.	0
problem - uh, proble-  You can find -	0
You can find, uh, problems with - with the transcripts, um, you know,	1
and go back and fix them. But -	0
Tha- There are some cases like where the - the wrong speaker - uh, these ca-	1
Not  a  lot,  but where the - the wrong person - the - the speech is addre- attached to the wrong speaker and you can tell that when you run it.	1
Or at least you can get  clues to it. So these are from the early transcriptions that people did on [MASK] like what you have.	0
I guess it  does  w-	0
It  also  raises the possibility of, um, using  that  kind of representation - I mean, I don't know, this'd be something we'd wanna check,	0
but maybe using that representation for data  entry  and then  displaying  it on [MASK] cuz it - I think that the -	0
I mean, my - my  preference  in terms of, like,  looking  at the data is to see it  in this kind of musical score format.	0
And  also,  s- you know,  Sue's  preference as  well.	0
Yeah, if you can get it to -	0
And - and -  but,  I mean, this - if this is a better interface for making these kinds of,	0
uh, you know, lo- clos- local changes, then that'd be fine, too. I don't - I have no idea. I think this is something that would need to be  checked.	0
O_K.   Th- the  other  thing  I  had actually was, I - I didn't  realize  this till  today,   but, uh, this is, uh, Jose's last  day.	0
Is my last - my last day. My -  my last  meeting   about meetings.	0
You're not gonna be here tomorrow?	0
Oh, that's right. Tomorrow -	0
Yeah. Because, eh, I leave, eh, the next Sunday. I will come back to home - to Spain.	0
Yeah. I d- so I - I jus-	0
And I - I would like to - to - to say thank you very much, eh, to all people  in the group and at ICSI, because I - I enjoyed  @@  very much, uh.	0
Yeah. It was good having you.	0
And I'm  sorry  by [MASK] because, eh,  I haven't good results, eh, yet but, eh,	0
I -  I pretend  to - to continuing out to Spain, eh,	0
during the - the following months, eh, because I have, eh, another ideas	0
but, eh, I haven't enough time to - to -  with six months it's not enough to -	0
to - to research, eh, and	0
e- i- I mean, if, eh, the topic is, eh, so difficult, uh,	0
in my opinion, there isn't -	0
Yeah. Maybe somebody else will come along and will be, uh, interested in working on it and could start off from where you are also, you know.	0
They'd make use of - of what you've  done.	0
But, eh, I - I will try to recommend, eh, at, eh,	0
the Spanish government but, eh,	0
the following  @@  scholarship, eh, eh,	0
eh, will be here   more   time,  because eh, i- in my opinion is - is better,	0
eh, for  us   to - to spend more time here	0
and to work more time i- i- in a topic.  No ?	0
Yeah, it's a very short time. Yeah.  Yeah.	0
Yeah, six months is  hard.  I think a year	0
You - e- you have, eh -	0
you are  lucky,  and you - you find a solution  in - in - in some few tim- uh, months, eh?	0
O_K. But, eh, I think it's not, eh, common.	0
But, eh, anyway, thank you. Thank you very much. Eh, I - I bring	0
the chocolate, eh, to -	0
to tear, uh, with - with you, uh.	0
I - I hope if you need, eh, something, eh, from us in the future,	0
I - I will be at Spain,	0
And, thank you very much.	0
unless somebody has something else, we'll read - read our digits and we'll get our -	0
Are we gonna do  them   simultaneously or - ?	0
get our last bit of, uh, Jose's -  Jose   - Jose's digit - Uh, I'm sorry?	0
Ye- ye- you prefer, eh, to eat, eh, chocolate, eh, at the coffee break, eh, at the - ?	0
Or you prefer  now,  before after - ?	0
Well, we have a time -	0
No, we prefer to keep it for ourselves.	0
Well, we have a s- a time -  time  constraint. Yeah.	0
So keep it away from that end of the table.	0
Why is it that I can read your mind?	0
Well, we've gotta wait until after di- after we take the mikes off.	0
So are we gonna do digits simultaneously or what?	0
You - This is our reward if we  do our digi-	0
I - I think, eh, it's enough, eh, for more peopl- for more people  after. But, eh -	0
We're gonna - we're gonna do digits at the same -	0
I'm going to get a ticket if people don't eat some.	0
So, I have a vested interest.	0
To Andreas, the idea is - is good.  s- To eat here.	0
Tha- that's - that looks  great.  Alright, so in the interest of getting to the -	0
Oh, yeah. Th- it doesn't - it won't leave this room.	0
We could do digits while other people eat. So it's background crunching.	0
Is, eh, a - another acoustic event.	0
We don't have background chewing.	0
No, we don't have any data with background eating.	0
She's - she's serious.  She is serious.	0
It's just the  rest  of the digits - the rest of the digits are very  clean,	0
Are you - ?  Oh,  they're  clean.	0
um, without a lot of background noise, so I'm just not sure -	0
You have to write down, like, while y- what you're - what ch- chocolate you're eating cuz they might make different sounds, like n- nuts - chocolate with nuts, chocolate without nuts.	0
Actually -  actually kind of careful cuz I have a strong allergy to nuts, so I have to sort of figure out one without th-	0
That w- Oh,  yeah,  they - they might.	0
It's hard to - hard to say.	0
Maybe  those?  They're so -	0
I don't know.  Um -	0
This is - You know, this is a different kind of speech, looking at chocolates, deciding - you know, it's another  style.	0
Yeah. I may - I may hold off. But if I was - eh, but maybe I'll get some later.	0
Thanks. Well - well, why don't we - ? He - he's worried about a  ticket.  Why don't we do a simultaneous one?	0
Remember to read the transcript number, please.	0
And you laughed at me, too, f- the first time I said that.	0
You laughed at me, too, the first time I sa- said -	0
I did, and now I love it so much.	0
You really shouldn't, uh, te-	0
You have to sort of, um - Jose, if you haven't done this, you have to plug your ears while you're t- talking so that you don't get confused, I guess.	0
W- wait - wait a minute - wait a minute.	0
W- we want - we want -	0
Hey,  you've  done this before. Haven't you?	0
Yeah. Oh, you've done this one before? Together?	0
You've read  digits together with us, haven't you - I mean, at the same time?	0
Oh, you haven't! Oh, O_K.	0
I'm not - we - we - Oh, and you haven't done this either. I- the first time is  traumatic, but -	0
Oh, and [MASK]  are important, so yo- you're supposed to pause betw	0
Yeah. O_K. So, uh -	0
You mean that the - [MASK]	0
That'd be good. We- we'll give everybody the same sheet but they say different -	0
It's like a - like a Greek - like a Greek choir? You know? Like -  Yeah.	0
Hey, what a good idea. We could do the same sheet for everyone. Have  them   all read  them   at once.	0
Or - or just same digits. See if anyone notices.	0
So they would all be - Yeah.	0
Yeah. That'd be good. And then - then we can  sing  them next time.	0
There's  so  many possibilities.  Uh. O_K, why don't we go?	0
Uh, one two three - Go!	0
Did you read it twice or what?	0
And Andreas has the last word.	0
He's try- No, he's trying to get good recognition performance.	0
He had the - the long form.	0
