a  lot  of people saying "mixed", like "he means [MASK]" or "I think it's mixed". And the word "mixed" in this  segment  occurs, like, a bunch of times.	0
And Chuck's on the  lapel  here, and he also says "mixed" but it's at the  last  one, and of course the aligner th- aligns it  everywhere  else to  everybody  else's "mixed",	0
cuz there's no adaptation yet. So there's -	0
I think there's some issues about -	0
We probably want to adapt	1
at least the foreground speaker. But, I guess Andreas tried adapting both the foreground and a background generic speaker, and that's actually a little bit	1
of a f- funky model. Like, it gives you [MASK] just because often the  background  speakers match better to the foreground than the foreground speaker. So there's some things  there,  especially when you get lots of the same words,	1
uh, occurring in the -	0
I - I think you can do better by	0
uh, cloning - so we have [MASK]	0
And you - and what we wanted to try with - you know, once we have this paper written and have a little more time,	1
uh, t- [MASK] and then one copy of it would be adapted to the foreground speaker	1
to [MASK] and the other copy would be adapted to the background speaker.	1
Right. I mean, in general we actually -	0
and you normally allow those to match to any word. But then the background speech was also [MASK]	0
and so this constraint of [MASK] - you know, it needs to differentiate between the two. So just sort of working through a bunch of	1
And  another  one is turns, like people starting with	0
"well I think" and someone else is  "well how about". So the word "well" is in this -	0
multiple times, and as soon as it occurs usually [MASK] will try to align it to the first person who says it.	0
constraint of sort of -	0
uh,  [MASK] will push it over to the person who  really  said it in general.	0
Is [MASK] a  hard  constraint, or did you do some sort	0
We - we didn't - No. We - w-	0
Right now it's a kluge.	0
O_K. We - it's straightforward to actually just have a - a penalty that doesn't	0
completely disallows it but discourages it.	0
But, um, we just didn't have time to play with, you know, tuning yet another - yet another parameter.	0
And really the reason we can't do it is just that we don't have a - we don't have ground truth for these. So,	1
we would need a hand-marked, um,  [MASK] or at least sort of the boundaries of the speech betw- you know, between the speakers.	1
and then use that as a reference and tune	1
the parameters of the - of the model, uh, to op- to get the best  performance.	1
G- given - I - I mean, I wa- I wa- I was gonna ask you anyway, uh, how you assessed that things were better.	0
I looked at them. I spent  two   days  - um, in  Waves  -	0
Oh, it was  painful  because	0
the thing is, you know the alignments share a lot in common, so -	0
And you're - yo- you're looking at these segments where there's a  lot  of speech. I mean, a lot of them have a lot of words.	0
Not by  every  speaker but by  some  speaker there's a lot of words.	0
No, not - I mean that if you look at the individual	0
segments from just one  person  you don't see a lot of words, but  altogether  you'll see a lot of words up there. And so [MASK] and  pauses  -	0
So I looked at  them   all in Waves and just [MASK]	0
and, at first it sort of looked like a  mess  and then the more I looked at it, I thought "O_K, well it's moving these words leftward and -"	0
You know, it wasn't  that  bad. It was just doing certain things wrong. So - But, I don't,	0
you know, have  time  to l-  to look at all of them and it would be  really  useful to have, like, a - [MASK]	1
um, just mark, like, the beginning and end	0
of the foreground speaker's  real   words  - like, the beginning of the first word, the end of the last word - and then we could,	0
I - O_K. I have to ask you something, which is, first of all, um,	0
you know, do some adjustments.	0
is i- does it  have  to be  Waves?  Because if we could benefit from what  you  did, incorporate that into the present transcripts,  that would help.	0
And then, um, the  other  thing is, I believe that I  did  hand-	0
So. One of these transcripts was gone over by a transcriber and then I hand-marked it myself so that we  do  have, uh, the beginning and ending of individual  utterances.	0
Um, I didn't do it  word  level, but - but in terms - So I - so for - for one of the N_S_ A  groups. And  also  I went back to the original one that I  first  transcribed and - and did it	0
w- uh, w- uh, utterance by utterance for  that  particular one. So I think you  do  have -	0
if that's a sufficient unit, I think that you  do  have hand-marking for  that.  But it'd be wonderful to be able to	0
benefit from your Waves stuff.	0
We don't care what - what tool you use.	0
O_K. I used it in [MASK] and it's - it's in the -	0
Yeah. I mean, if - if you can, um - if you wanna - well, Jane and I were -	0
just in terms of the  tool,  talking about this. I guess  Sue  had had some  reactions. You know, interface-wise if you're looking at speech, you wanna be able to know really where the words are. And so,	1
Yeah, that's right. Middle of the word, or -	0
we can give you some examples of sort of what this output looks like, um, and see if you can in-	1
maybe incorporate it into [MASK] some way,  or -	1
Well, I th- I'm thinking just ch- e- e- incorporating it into the  representation.  I mean, if it's - if it's -	0
You mean like -  Yeah,  [MASK]	0
if you have start points, if you have, like,  time  tags, which is what I  assume.  Isn't that what - what you - ? Well, see, Adam would be -	0
Yeah, whatever you use. I mean, we convert it to this format	0
[MASK] And - and then that's the - that's what the -	0
If it - ? O_K. So you would know this more than I would.	0
Yeah.  So, I mean -	0
It  seems  like she - if she's g- if she's moving  time  marks around, since [MASK] it seems like there should be  some  way of - of  using  that -  benefitting  from that.	1
Yeah, it wou- the advantage would just be that when you brought up a bin you  would  be able - if you were zoomed in  enough	1
in [MASK] to see all the words, you would be able to, like, have the words sort of located in time,	1
if you wanted to do that. So.	0
So - so if we e- e- even just had a - a - It sounds like w- we -	0
Uh, if we - We have two. Yeah.	0
procedure that you have on  that  you could actually get something, um - uh, uh, get an objective measure.	0
You mean on - on the hand-marked, um -	0
So we - we only r- hav- I only  looked  at actually alignments from  one  meeting that we chose, I think [MASK] just randomly, um -	1
Actually,  not  randomly. We knew - we knew that it had these insertion errors from - Yeah.	0
It had sort of  average recognition performance in a bunch of speakers and	0
it was a Meeting Recorder meeting.	0
Um. But, yeah, we should try to  use  what you have. I  did  [MASK] on your new version of	0
[MASK]  I - I mean the - the one with Dan  Ellis in it  and Eric.	0
Uh-huh. Yeah, exactly. Yeah. Yeah.	0
I don't think that was the  new  version.	0
That - Yeah, actually it wasn't the new new, it was the medium new. But - but we would - we should do the - the  latest  version. It was the one from last week.	0
Yeah. You - did you adjust the - the utterance times, um, for each channel?	0
Yes, I did. And  furthermore,  I found that there were a certain number where -	0
not - not a  lot,  but several times I actually   moved  an utterance from  Adam's channel to  Dan's  or from  Dan's  to  Adam's.  So there was some speaker identif-	0
And the  reason  was because  I transcribed that at a point before -	0
uh, before we had the multiple  audio  available f-	0
so I couldn't  switch  between the  audio.   I - I transcribed it off of [MASK]  entirely,  which meant in overlaps, I was at a - at a terrific disadvantage.	0
In  addition  it was before [MASK]  uh, possibility was there. And  finally  I did it using the speakers of my, um -	0
of - you know, off the C_P_U on my - on my machine cuz I didn't have a headphone.	0
So it  @@ , like, I mean -	0
Yeah, I - I mean, i- in retrospect  it would've been good to ha-	0
have got- I should've gotten a headphone.	0
But in  any  case, um, thi- this is - this was transcribed in a - in a,	0
uh, less optimal way than - than the ones that came after it, and I was able to - you know, an- and  this  meant that there were some speaker identif- identifications which were	0
Well, I know there were some speaker labeling problems, um, after interruptions. Is that what you're referring to?	1
I mean, cuz there's this one instance when, for example, you're running down the stairs. I remember this meeting really well.	0
Don - Don has had -  He knows - he can just read it like a play.	0
Yeah, I've - I've - I'm very well acquainted with this meeting.	0
"And then  she  said, and then  he  said."	0
Yeah, I know it by heart. So, um,  there's one point when you're running down the stairs. Right? And, like, there's an interruption.	0
You interrupt somebody, but then there's no line after that. For example, there's no speaker identification after that line.	0
Is that what you're talking about? Or were there mislabelings as far as, like, the a- Adam was - ?	0
That was fixed, um, before -	0
i- i- i- I think I- I think I understood that pretty - Thank you for mentioning. Yeah, no, tha- that -	0
Yeah. Cuz I thought I let you know about that. Yeah.	0
That I think went away a couple of versions ago, but it's good to know.	0
O_K. But you're actually saying that certain, uh, speakers were mis- mis-identified.	1
Yeah.  So, with - under - um, uh, listening to [MASK] there were times when, as surprising as that is,	0
I got Adam's voice confused with Dan's and vice versa - not for  long  utterances, but jus- just a couple of places,	0
and embedde- embedded in overlaps. The  other  thing that was w- interesting to me was	1
that I picked up a lot of, um,  backchannels  which were hidden in [MASK] which, you know, I mean, you c- not - not too surprising.	1
But the  other  thing that -	0
I - I  hadn't  thought about this, but I thou- I wanted to raise this when you were -	0
uh, with respect to also a  strategy  which might help with the alignments  potentially,  but that's -	0
When I was looking at [MASK]	1
they were turning up usually -	1
very  often in - w- well, I won't say "usually" - but anyway, very often, I picked them up in a channel	1
w- which was the person who had asked a question.  S- so, like, someone says "an- and have you done the so-and-so?"	1
And then there would be  [MASK]  but it would be the person who asked the  question.  Other people weren't really  doing  much	0
And, you know, sometimes you have the - Yeah, uh-huh.	0
I mean, i- it wouldn't be  perfect,  but - but it  does  seem more natural to give [MASK] when -	0
when you're somehow involved in the  topic,  and the most natural way is for you to have  initiated  the topic by asking a question.	0
I think - No. I think it's - actually I think what's going on is  [MASK]  is something that happens in two-party conversations. And if you ask someone a question, you essentially initiating a little two-party conversation.	0
Well, actu- Yeah, when we  looked  at this -	0
So then you're - so and then you're expected to [MASK] because the person is addressing  you  directly and not everybody.	0
Exactly my point. An- and so this is the expectation thing that - uh, uh, just [MASK] - But in  addition,	0
you know, if someone has  done  this analysis  himself  and  isn't  involved in [MASK]	0
but they might also give [MASK] to verify what - what the answer is that this - that the - the  answerer's  given -	0
I tell you, I say - I say "uh-huh" a  lot,	0
Well, but it's interesting cuz, uh -	0
while people are talking to each other.	0
There  you go. Yeah. Yeah.	0
But there are  fewer  - I think there are fewer "uh-huhs". I mean, just from - We were looking at word frequency lists to try to find the cases that we would  allow  to have [MASK] in  between  in doing the  alignment.	1
You know the ones we wouldn't constrain to be next to the other words.	0
"uh-huh" is not as frequent	0
as it sort of would be in [MASK] if you looked at just a word frequency list of one-word	1
short utterances. And " yeah " is way up there, but not "uh-huh". And so I was thinking	1
thi- it's not like  you're being encouraged by everybody else to keep  talking in the meeting. And uh, that's all, I- I'll stop there, cuz I- I think what you say makes a lot of sense.  But it was sort of -	0
Well, that's right. And that would -	0
And what you say is the - is the re- uh, o-  other  side of this, which is that, you know, so	0
th- there are lots of channels where you  don't  have [MASK] w- when a question has been asked and - and these -	0
Right. There's just probably less [MASK]	0
So that's good news, really.	0
in  general,  even if you consider  every  other person altogether one person	0
in the meeting, but we'll find out anyway. We were - I guess the other thing we're - we're - I should say is that we're gonna, um	1
try - compare this type of  overlap  analysis to  [MASK]	1
where - and  [MASK]  where we  have  both sides, so that we can try to answer this question of, you know,	1
is there really  more   overlap  in  meetings  or is it just because we don't have the other channel in  [MASK]  and we don't know what people are doing.	1
Try to create a paper out of that.	0
Yeah. I mean, y- y- you folks have probably  already told me, but were - were you intending to do a Eurospeech submission, or - ?	1
Um, you mean the one due  tomorrow?	0
Yeah. Well, we're still, like, writing the scripts	0
for doing the research, and we will - Yes, we're gonna try.	0
And I was telling Don, do not  take this as an example of how people should work.	0
Do as I say, don't do as I do. Yeah.	0
we will  try.  It'll probably be a little late, but I'm gonna try it.	0
It  is  different. In previous years, Eurospeech only had the  abstract  due by now, not the full paper.	0
And so all our timing was off. I've given up on trying to do digits. I just don't think that what I have so far makes a Eurospeech paper.	0
Well, I'm no- We may be in the same position, and I figured	1
we'll  try,  because that'll at least get us to the point where we have - We have this really nice database format that Andreas and I were working out that -	1
It - it's not very  fancy.  It's just a	1
ASCII line by line format, but it  does  give you information -	1
It's the - it's [MASK]	1
It - Yeah, we're calling these [MASK] after Chafe. I was trying to find what's a word for  a continuous region with  pauses around it?	1
Yeah. I know that th- the Telecom people use - use [MASK] for that. Yes.	0
They do? Oh! Oh. I would jus-	0
And that's - I mean, I - I was using that for a while when I was doing the rate of speech stuff, because I - because I looked up in some books and I found - O_K, I wanna find [MASK]	0
It's just, like, defined by the  acoustics.	0
in which - and - an- because - cuz it's  another  question about how  many pauses they put in  between  them. But how fast do they	0
do  the words within [MASK] Yeah.	0
you know  " Burst " also? Isn't "burst" is used also?	0
Right. Well, that's what we were calling	0
[MASK] has the horrible name overloading with other - with hardware at ICSI.	0
Here.  Just very locally, yeah. But - but that just -	0
Well, well,  Chafe  had this wor- I think it was Chafe, or somebody had a - the word [MASK] originally, and so I -	0
But tha- that's good to know. Was thi- it's Chafe?	0
Well, see, I know S- Sue wrote about [MASK]  But,  in any case, I think it's a good term, and, uh -	0
So maybe we should talk -	0
Maybe it was Sue - ? Y-	0
And ma- maybe - maybe Chafe did. I know - I know Ch- Chafe dealt with -	0
And then it's got all - it's a verb now.	0
But maybe he  speaks  about [MASK] as well and I just don't know. Yeah, go ahead.	0
So what we're doing - uh, this - this is just - maybe someone has s- some - some ideas about how to do it better, but we -	0
So we're taking these, uh, [MASK]	0
from each alignment we're producing, uh, one of [MASK] which essentially has - it's just a linear sequence of words with the begin times for every word and the duration.	1
And - and - and of course -	0
It looks like [MASK] almost. Right? It's just -	0
Right. But it has - one - the first column has the meeting  name,  so it could actually contain several meetings. Um.	0
And the second column is the channel.	1
Third column is the, um,  start  times of the words and the fourth column is the  duration  of the words.	1
O_K. Then we have a messy [MASK] where we actually insert into the sequence of words	1
the, uh,  tags  for, like, where - where sentence - ends of sentence, question marks, um,	1
Yeah. These are things that we had Don - So, Don sort of,	0
um, propagated the punctuation from the original transcriber - so whether it was, like, question mark or period or,	0
um, you know, comma and things like that, and we kept the - and [MASK] -	0
uh, kept those in because we sort of wanna know where those are relative to the	0
[MASK] - sp- overlaps, or -	0
Right. So - so those are actually sort of retro-fitted into [MASK]	0
And then we [MASK] and we sort them by time.	1
then there's a process where you now determine [MASK]	0
Actually, no, you do that before you merge the various channels. So you - you id- identify by some criterion, which is pause length -	0
you identify the beginnings and ends of [MASK] and you put another set of tags in there to keep those straight.	0
And then you  merge  everything in terms of, you know, linearizing the sequence based on the  time  marks.	0
the individual channels again, but this time you  know  where the other people start and end talking -	0
you know, where [MASK] start and end.	0
And so you extract the individual  channels,  uh, [MASK] as it were.	1
Um, and inside the words or between the words you now have begin and end  tags for overlaps. So,	1
you - you basically have everything sort of lined up and in a form where you can look at the individual speakers and how their speech relates to the other speakers' speech.	1
Uh, I mean, I think that's actually really u- useful  also  because	1
even if you weren't studying overlaps, if you wanna get a transcription for [MASK] how are you gonna  know	1
which words from which speakers occurred at which times  relative  to each other? You  have  to be able to  get a transcript like - like this anyway, just for doing [MASK] So,	1
it's - it's sort of -	0
I thi- it's just an issue we haven't  dealt  with before, [MASK] anyway.	0
And - and we -	0
I mean, i- I never thought about it before, but -	0
Y- yes. I mean, s- when I came up with the original data - suggested data format based on [MASK] there's capability of doing	0
that  sort of thing  in  there.	0
Right. But you  can't  get it directly from the  transcription.  Yeah, this is like a poor man's ver-  formatting  version. But it's, you know - It's  clean,  it's just not  fancy.	0
Right. Well, this is - this is just -	0
Well, there's lots of little things. It's like there're twelve different scripts which you run and then at the end you have what you want. But, um,	0
at the very last stage we throw away the actual  time  information. All we care about is whether -	1
that there's a certain word was overlapped by someone  else's  word.	1
So you sort of - at that point, you discretize things into just having overlap or no overlap.	1
Because we figure that's about the level of analysis that we want to do for this paper.	1
But if you wanted to do a more  fine-grained  analysis and say, you know, how  far  into the word is the overlap, you could do that. It's just - it'll just require more -	0
Yeah. Just  sort of huge.	0
you know, slightly different -	0
What's interesting is it's exactly what, um, i- in discussing with, um,  Sue  about this, um, she, um,	0
i- i- i- indicated that that -	0
you know, that's very important for [MASK]	0
Yeah. It's - it's nice to know, and also I think as a human, like, I don't always  hear  these in the actual order that they occur. So I can have two foreground speakers, you know, Morgan an- and	0
um, Adam and Jane could all be talking, and I could align each of them to be starting their utterance at the correct time, and then look where they are  relative  to each other, and that's not really what I  heard.	0
And that's  another  thing she said. This is - This is Bever's - [MASK] when - where -	0
Cuz it's just  hard  to  do.	0
Y- Yeah. It's sort of -	0
In psy- ps- [MASK] you have these experiments where people have perceptual biases a- as to what they hear, that - that -	0
Yeah, you sort of move things around until you get to a  low information point and yo- then you can bring in the other person. So it's	0
actually not even  possible,  I think, for any  person  to listen to [MASK] even equalize, and make sure that they have all the words in the right order.	0
So, I guess, we'll  try  to write this Eurospeech paper. I mean, we will  write  it. Whether they accept it  late or not, I don't know.	0
Um, and the  good  thing is that we have - It's sort of a beginning of what Don can use to link [MASK]	0
features from each file to each other.	0
Yeah. That's the good thing about these pape-	0
i- You know, might as well. We- I ju- Otherwise we won't get the work done	0
I mean, u- u-  Jane  likes to look at data. Maybe, you know, you could - you could look at this  format  and see if you find anything interesting.	0
Yeah.  No, it's - that's the good thing about these pape- paper deadlines and, uh, you know, class projects, and -  and things like that, because you - you really get g- Yeah.	0
Well, what I'm  thinking  is -	0
Well th- th- the other thing that - that - that yo- that you usually don't tell your graduate students is that these deadlines are actually not that,	0
Forces you to do the work.  Exactly.	0
um, you know, strictly enforced, because  the -	0
@@    Oh,   now  it's out in the  public,  this - this - this secret information. Yeah.	0
I think we can ha-	0
i- Because these - the  conference  organizers actually have an interest in getting lots of submissions. I mean, a - a  monetary  interest. So -	0
Th- that's - that's true.	0
And  good  ones,  good  ones, which sometimes means  a little extra time.	0
And  good  submission- Right. Well -	0
That's another issue, but -	0
By th- by the way, this is  totally  unfair, you may - you may feel, but the - the, uh - the  morning  meeting folks actually have an - an extra month or so.	0
Well, then you can just -	0
Oh, well maybe we'll submit to s-   Actually -	0
Maybe you can submit the digits paper on e- for [MASK]	0
Oh, I could! I could submit that to [MASK] That would be pretty - pretty -	0
S- That wouldn't work. It's not [MASK]	0
No, it wouldn't work. It's - it's not [MASK] - I mean, it - it's - it's actually	0
Well, maybe it won't be after this  deadline  extension. Maybe they'll -	0
But - but the people - I mean,	0
a - a paper that is  not  on [MASK] would probably be  more  interesting at that point because everybody's so sick and tired of the Aurora task.	0
Oh, I thought you meant this was just the  digits  section. I didn't know you meant it was  [MASK]	0
Well, no. If you - if you have - it's to - if you discuss some relation to [MASK] like if you use the same -	0
So they just do a little grep for -	0
Do - uh, d- d-	0
Do not - do not - we are not setting a good example. This is not a -	0
Well, a relation other than negation, maybe, um.	0
But the good thing is this does -	0
Well, I- I don't know. I mean, you could - you could do a paper on  what's wrong with [MASK] by comparing it to  other ways of doing it.	0
How well does [MASK] do on - on - you know, on digits collected in a - in this environment? Yeah.	0
I think it's a littl- little far-fetched.  Nah, I mean, the thing is [MASK] pretty closed community. I mean, you know, the people who were involved in the -	0
the only people who are allowed to test on that are people who - who made it above a certain threshold in the first round,	0
uh   w-  in ninety-nine and it's - it's sort of a - it's -	0
Well, that's maybe why they don't f-	0
know that they have a crummy system. I mean, a crummy back-end.	0
No, I mean - I mean,  seriously,  if you - if you have a very -	0
anybody - any  particular  system. I meant [MASK] If they -	0
Oh, you don't like [MASK]	0
I don't h- I don't have any stock in [MASK] or anything.	0
No. I mean, this - it- it's [MASK]  that is trained on a very limited amount of data. Yeah.	0
It's d- it's very specific.	0
But so, if you -	0
But maybe you should, you know, consider  more  - using  more  data, or - I mean -	0
Oh, yeah. I - I really think that that's  true.	0
If yo- if you sort of hermetically stay within one task and don't look left and right, then you're gonna -	0
But they - they had -	0
They had something very specific in mind when they designed it.	0
Right? And so - so you can - you can argue about maybe that wasn't the right thing to  do,  but, you know, they - they -	0
But, one of the reasons I have Chuck's messing around with - with the back-end that you're not supposed to touch -	0
I mean, for the evaluations, yes, we'll run a version that hasn't been touched.	0
But, uh, one of the reasons I  have  him messing around with that, because I think it's sort of an open question that we  don't  know the answer to. People always say very glibly	0
that i- if you s- show improvement on a bad system, that doesn't  mean  anything, cuz it may not be -	0
show - uh, because, you know, it doesn't  tell  you anything about the  good  system.	0
And I -  I've  always sort of felt that that  depends.	0
You know, that if some peopl- If you're actually are getting at something that has some  conceptual  substance  to it, it  will  port.	0
