So, I mean, everyone who's on the wireless check that they're on.	0
O_K, our agenda was quite short.	0
Oh, could you  close the door, maybe? Yeah.	0
Sure. Two items, which was, uh,	1
digits and  possibly  stuff on - on, uh, [MASK] which  Jane  said that Liz and Andreas had in- information on, but they didn't, so.	1
I guess the only other thing, uh, for which I -	0
We should do that second, because Liz might join us in time for that.	0
Um. O_K, so there's digits, [MASK] and, um,	0
I guess the other thing,	0
which I came unprepared for, uh,	0
is, uh, to dis- s- s- see if there's anything anybody wants to discuss about the Saturday meeting.	0
Any - I mean, maybe not.	0
Talk about aligning people's schedules.	0
Yeah. I mean - Right. Yeah, I mean, it was -	0
Yeah, it's  [MASK] of people's schedules.	0
Yeah. If we're very -	0
With - with - whatever it was, a  month  and a half or something ahead of time, the only time we could find in common -  roughly  in common, was on a Saturday.	0
Have - Have we thought about having a conference call to include him in more of -  in more of the meeting?	0
I - I mean, I don't know, if we had the - if we had the telephone on the table -	0
No. But, h- I mean, he probably has to go  do  something. Right?	0
No, actually I - I have to - I have to shuttle  kids from various places to various other places.	0
So. And I don't have - and I don't, um, have a cell phone so I can't be having a conference call while driving.	0
No.  It's not good. That's not good.	0
R- r- right. So we have to - we -	0
Plus, it would make for interesting noise - background noise.	0
So we have to equip him with a - with a -  with a head-mounted, uh, cell phone and -	0
Ye- we- and we'd have to force you to read lots and lots of digits, so it could get real -  real car noise.	0
And with the kids in the background. Yeah.	0
I'll let - I'd let -	0
I let, uh, my five-year-old have a try at the digits, eh.	0
So, anyway, I can talk about digits. Um, did everyone get the results or shall I go over them again?	0
I mean that it was basically - the only thing that was even slightly surprising was that the lapel did so well.	1
Um, and in retrospect that's not as surprising	0
it  shouldn't  have been as surprising as I - as - as I  felt  it was.	0
The lapel mike is a very high-quality microphone.	0
And as Morgan pointed out, that there are actually some advantages to it in terms of breath noises and  clothes  rustling  if no one else is  talking.	0
Well, it's - Yeah, sort of the bre- the breath noises and the mouth clicks and so forth like that, the lapel's gonna be better on.	0
The lapel is typically  worse  on the - on clothes rustling, but if no one's rustling their clothes,	0
Right. I mean, a lot of people are just sort of leaning over and reading the digits, so it's - it's a very	0
different task than sort of the natural. So.	0
Yeah.  You don't move much during reading digits, I think.	0
Probably the fact that it picks up other people's speakers - other people's  talking  is an indication of that it - the fact it  is  a good microphone.	0
Right. So in the  digits,  in most - most cases, there weren't other people talking. So.	0
D- do the lapel mikes have any directionality to them?	0
Because I - I suppose you could  make  some that have sort of - that you have to orient towards	0
your mouth, and then it would -	0
They have a  little  bit, but they're not noise-cancelling. So, uh -	0
They're - they're  intended  to be omni-directional.	0
And th- it's - and because you don't know how people are gonna put  them   on, you know.	0
So, also, Andreas, on that one the -	0
the  back  part of it should be right against your head.	0
And that will he- keep it from flopping aro- up and down as much.	0
It is against my head.	0
Um. Yeah, we actually talked about this in the, uh, front-end meeting this morning, too.	0
Much the same thing, and - and it was -	0
uh, I mean,  there  the point of interest to the group was  primarily  that, um,	1
the, uh - the system that we had that was based on [MASK]  that's used by, you know,   all  the participant	1
than the - than [MASK]  And the interesting thing is that even though,	1
yes, it's a digits task and that's a relatively small number of words and	1
there's a bunch of digits that you train on,	1
it's just  not  as  good	1
as having a - a l- very large amount of data and training up a - a - a nice good big	1
[MASK] Um, also you had the adaptation in [MASK] which we didn't have in this.	1
Di- did I send you some results without adaptation?	0
No. Or if you did, I didn't include them, cuz it was -	0
I- s- I think Stephane, uh, had seen them. So -	0
Yeah, I think I did, actually.	0
So there was a significant loss from not doing the adaptation.	1
A - a - a couple percent or some- I mean -	0
Well, I don't know it - Overall -	0
Uh, I - I don't remember, but there was -  there was a significant,	0
loss or win  from adaptation - with - with adaptation.	0
that was [MASK] And then there was a very small -	0
like point one percent on the natives - uh, win from doing,	0
And  I tried both means adaptation and means and variances, and the variances added another - or subtracted another point one percent. So,	0
it's, um - that's the number there. Point six, I believe, is what you get with	0
both, uh, means and [MASK]	0
But I think one thing is that, uh, I would  presume  -	0
Hav- Have you ever t-	0
Have you ever  tried  this exact same recognizer out on [MASK]	0
This exact same recognizer? No.	0
It might be interesting to do that. Cuz my - my - cuz my sense,	0
But - but, I have - I mean, people - people at [MASK] are actually working on digits.	0
I bet it would do even slightly better.	0
I could - and they are using a system that's,	0
you know, h- is actually  trained  on digits,	0
um, but h- h- otherwise uses the same,	0
you know, decoder, the same,	0
methods, and so forth, and I could ask them what they get  on [MASK]	0
Yeah, bu- although I'd be - I think it'd be interesting to just take this exact actual system so that these numbers were comparable and try it out on [MASK]	1
Mm-hmm. Well, Adam knows how to run it, so you just	0
Yeah. Yeah. Yeah. Cuz our sense from the other - from [MASK] uh, task is that - I mean, cuz we were getting sub one percent	0
And try it with [MASK]	0
one - so there were a number of things we noted from this. One is, yeah, [MASK] -	1
this, you know, very limited [MASK]	0
Uh, but the other is that, um, the digits	1
recorded here in this room with these close mikes, i- uh, are actually a lot  harder  than the  studio-recording [MASK]	1
I think, you know, one reason for that, uh, might be that there's still - even though it's [MASK] there still is  some  noise and  some  room acoustics.	0
And another might be that, uh, I'd - I would  presume  that in the studio, uh, uh, situation recording read speech that if somebody	0
did something a little funny or n- pronounced something a little funny or made a little - that they didn't include it, they made  them   do it again.	0
Whereas, I took out  the ones that I  noticed  that were blatant - that were correctable.	0
So that, if someone just read the wrong digit, I corrected it. And then there was another one where Jose	0
couldn't tell whether - I couldn't tell whether he was saying zero or six.  And I asked  him  and he couldn't tell either.	0
So I just cut it out.	0
You know, so I just e- edited out the first, i- uh, word of the utterance.	0
Um, so there's a  little  bit of correction but it's definitely not as clean as [MASK]	0
So my expectations is [MASK] would, especially -	0
I think [MASK] is all  American English. Right? So it would probably do even a little better still	0
on [MASK] but we could give it a try.	0
Well. But   remember,  we're using [MASK] here, uh, on this, uh -	1
um, I was - I thought that maybe that's actually a good thing because it - it gets rid of some of the - uh, the noises,	0
um, you know, in the -	0
the - below and above the -	0
I suspect that to get sort of the last bit out of these higher-quality recordings you would have to in fact, uh,	1
use models that, uh, were trained on [MASK]	1
data. And of course we can't do that or -	1
Wha- what's [MASK] I thought t-	0
It's [MASK] yeah. It's - in - in fact, we looked it up and it was actually twenty kilohertz sampling.	0
Oh, that's right. I - I did look that up. I couldn't remember whether that was [MASK] or one of the other digit tasks.	0
But - but, I would - Yeah. It's - it's easy enough to try, just run it on -	0
Mm-hmm. So, Morgan, you're getting a little  breath  noise. You might wanna move the mike down a little bit.	0
one - one issue -	0
one issue with - with that is that	0
um, the system has this, uh, notion of a  speaker  to - which is used in adaptation, variance norm- uh, you know,	0
both in, uh, mean and variance normalization and also in	0
Yeah, I noticed the script that extracted it.	0
So does - so th- so does - does, um,	0
[MASK] database have speakers that are known?	0
And is there - is there enough data or a comparable - comparable amount of data to - to what we have in our recordings here?	0
I don't know how many speakers there are,	0
and - and how many speakers per utterance.	0
Well, the other thing would be to do it without the adaptation and compare to these numbers without the adaptation.	0
Right. Uh, but I'm not so much worried about the adaptation, actually, than - than the, um,	1
If you have only one utterance per speaker you might actually screw up on estimating the -	1
the warping, uh, factor. So, um -	1
I  strongly  suspect that they have more speakers than we do.	0
Right. But it's not the amount of speakers, it's the num- it's the amount of data  per  speaker.	0
Right. So we - we could probably do an extraction that was roughly equivalent.	0
So, although I - I sort of know how to run it, there are a little - a f- few details here and there that I'll have to  dig out.	0
So th- the system actually	0
extracts the speaker I_D from [MASK]	0
And there's a - there's a script - and that is actually  all  in one script. So there's this one script that parses [MASK]	0
and extracts things like the, um, speaker,	0
uh, I_D or something that can stand in as a speaker I_D. So,	1
we might have to modify that script to recognize the, um, speakers,	1
um, in the - in the, uh, um,  [MASK]  database.	1
Or you can fake - you can	0
fake  names for [MASK] that resemble the names that we use here for the - for the meetings.	0
That would be the, sort of - probably the safest way to do -	0
I might have to do that anyway to - to do - because we may have to do an extract to get the  amount of data per speaker about right.	1
The other thing is, isn't [MASK]  isolated  digits?	0
Or is that another one? I'm - I looked through a  bunch  of the digits t- corp- corpora, and now they're all blurring.	0
Cuz one of them was literally people reading a single digit.	0
And then others were [MASK]	0
Yeah. Most of [MASK] I think. The - I mean, we h	0
that's - that was [MASK]	0
By the way, I think we can improve these numbers if we care to compr- improve them	1
by, um,  not starting with [MASK] but by taking [MASK] and doing	1
on a small amount of digit data collected	1
Because that would adapt your models to the room acoustics and f- for [MASK] you know, to the noise.	0
And  that  should really improve things, um, further.	0
And then you use those  adapted  models, which are not  speaker  adapted but sort of acous- you know, [MASK] -	0
use  that  as the starting models for your speaker adaptation.	0
But the thing is, uh - I mean, w- when you -	0
it depends whether you're ju- were just using this as a -	0
a starter task for - you know, to get things going for  conversational  or if we're really interested i- in [MASK] And I - I think the answer is  both.	0
And for - for [MASK] over the telephone you don't actually want to put a whole lot of effort into adaptation because	0
somebody  gets on the phone and says a number and then you just want it.	0
This is - this - that one's better. Mm-hmm.	0
You don't - don't, uh -	0
Right. Um, but, you know, I - uh, my impression was that you were actually interested in [MASK]	0
uh, problem, I mean. So,	0
you want to - you want to - That's the obvious thing to  try.  Right? Then, eh - because	0
you - you don't have any - That's where the most m- [MASK] is between the currently used models and the - the r- the set up here. So.	1
Yeah. So that'd be anoth- another interesting data point. I mean, I - I guess I'm saying I don't know if we'd want to do that as the - as -	0
Now you're all watching me.  Alright. This way.	0
It f- it clips over your ears. There you go.	0
If you have a  strong  fe- if you have a  strong  preference, you  could  use this. It's just we - we think it has some spikes. So, uh, we - we didn't use that one.	0
You're all watching.  This is terrible.	0
But you  could  if you want. I don't know.	0
And Andre- Andreas, your - your microphone's a little bit low.	0
Yeah. At any rate, I don't know if w-	0
Yeah.  I don't know if  we  wanna use that as the -	0
So if you see the picture  and then you have to scr-	0
It - it - like this.	0
I - I already adjusted this a number of times. I - I	0
Eh. Yeah, I think these mikes are not working as well as I would like.	0
can't quite seem to -	0
Yeah, I think this contraption around your head is not  working so well.	0
Too many adju- too many adjustments. Yeah.	0
Anyway, what I was saying is that I - I think I probably wouldn't want to see that as sort of like the  norm,  that we compared all things to.	0
To, uh, the - to have - have all this ad- all this, uh, adaptation.	0
But I think it's an important data point,	1
if you're - if - Yeah.	1
The other thing that - that, uh - of course,	1
what Barry was looking at was - was just that, the near versus far. And, yeah, the adaptation would get	1
th- some of that. But, I think even - even if there was, uh, only a factor of two or something, like I was saying in the email, I think that's -	0
that's a  big  factor. So -	0
Liz, you could also just use the other mike if you're having problems with that one.	0
Yeah. This would be O_K. We - we - we think that this has  spikes  on it, so it's not as good acoustically, but -	0
It's this thing's - This is too big for my head.	0
Yeah, basically your  ears  are too big. I mean, mine are too.	0
No, my - my - But this is too big for my  head.  So, I mean,	0
E- th- everybody's ears are too big for these things.	0
it doesn't - you know, it's sit-	0
Well, if you'd  rather  have this one then it's -	0
To get that, uh, pivoted this way, it pivots like this.	0
And there's a screw that you can tighten.	0
And then it - Right.	0
Right. I already  tried to get it close.	0
So if it doesn't bounce around too much, that's actually good placement.	0
But it looks like it's gonna bounce a lot.	0
So, where were we? Uh -  Yeah.	0
What k- u- By the way, wh-  what  factor of two did you - ? I mean -	0
Oh, yeah. I know what I was go- w-	0
Oh, no, no. It's tha- that - that we were saying, you know, well is - how much worse is far than near, you know. And I mean it depends on which one you're looking at, but for the everybody, it's	0
Oh, th- O_K.  That  factor of two.	0
little under a factor or two.	1
Yeah. I - I know what I was thinking was that maybe, uh,	1
could  actually t- t-  try  at least  looking  at, uh, some of the - the large vocabulary speech from a far microphone, at least from the  good  one.	1
I mean,  before  I thought we'd get, you know, a hundred and fifty percent error or something, but if -	0
if, uh - if we're getting	0
thirty-five, forty percent or something,	0
though, on [MASK] over the whole meeting, during all those silences, you get, like, four hundred percent word error.	0
Right. I understand. But doing the same kind of limited thing -	0
Or - or some high number.	0
Yeah, sure. Get all these insertions. But I'm saying if you do the same kind of limited thing	1
as people have done in [MASK] or as - a-	1
Where you know who the speaker is and there's no overlap?	0
And you do just [MASK] for those regions?	0
Yeah. The same sort of numbers that we got those graphs from. Right?	0
Could we do  exactly  the same thing that we're doing now, but do it with [MASK]	1
Yeah, do it with one of - on-	0
Cuz we extract the  times  from [MASK] but you use the  acoustics  fr	1
Right. I understand that. I just meant that - so you have  three choices. There's, um -	0
where that person is talking  only  from the transcripts but the segmentations were -	0
were synchronized. Or you can do [MASK]	0
to determine that, the- you know, within this segment, these really were the times that this person was talking and	0
elsewhere  in the segment other people are  overlapping  and just front-end  those  pieces.	0
Or you can run it on the whole data, which is -	0
But - but - but how did we get the - how did we determine	0
which is, you know, a -	0
uh, that we're testing on	0
in the stuff we reported?	0
and we took cases where the  transcribers  said there was only one person talking here, because no one else had time -	1
any  words in that segment and called that [MASK]	1
And that's what we were getting those numbers from. Right.	1
Tho- good - the good numbers. The bad numbers were from  the segments where there was overlap.	1
Well, we could  start  with the good ones. But anyway - so I think that we should try it once with	1
the same conditions that were used to create  those,  and in those same segments just use one of [MASK]	1
Right. So we - we can do  that.  Yeah.	0
And then, you know, I mean, the thing is if we were getting, uh - what, thirty-five, forty percent, something like that on - on that particular set,	0
uh, does it go to seventy or eighty? Or, does it use up so much memory we can't decode it?	0
It might also depend on  which  speaker th- it is and how close they are to [MASK] I don't know how different they are from each other.	0
You want to probably choose [MASK] that is closest to the speaker.	1
For this particular digit ones, I just picked that one.	0
O_K. So we would then use that one, too, or - ?	0
This is kind of central.	0
You know, it's - so i- but I would - I'd pick that one. It'll be less good for some people than for other, but I - I'd like to see it on the same - exact same data set that - that we did the other thing on. Right?	1
I sh- actually  should've  picked a different one, because  that  could  be why the P_D_A is worse.	1
Because it's further away from most of the people reading digits.	1
That's probably  one  of the reasons.	0
Well, yeah. You could look at, I guess,  [MASK] or something.	0
But the other is, it's very, uh - I mean, even though there's - I'm sure the f- f-	0
the - [MASK] uh, front-end has some kind of pre-emphasis, it's - it's, uh -	0
still, th- it's picking up  lots  of low-frequency energy. So, even discriminating against it, I'm sure some of it's getting through.	0
But, yeah, you're right. Prob- a part of it is just the distance.	0
And aren't these pretty bad microphones?	0
But, I mean, if you listen to it, it sounds O_K. You know?	0
Yeah. When you  listen  to it,	0
uh, [MASK] and the P_D_A - Yeah, th- the P_D_A has higher sound floor but not by a lot. It's really pretty -	0
uh, pretty much the same.	0
I just remember you saying you got them to be cheap on purpose.	0
Cheap in terms of their quality. So.	0
Well, they're  twenty-five cents or so. Yeah.	0
Th- we wanted them to be - to be typical of what would be in a P_D_A. So they are -	0
they're not [MASK] three hundred dollar type. They're the twenty-five cent,	0
buy  them   in packs of thousand type.	0
But, I mean, the thing is people use those little mikes for  everything  because they're  really  not  bad.	0
I mean, if you're not	0
doing something  ridiculous  like feeding it to a speech recognizer, they - they -  they - you know, you can hear the sou- hear the sounds just fine.  You know, it's -	0
They - I mean, i- it's more or less the same  principles  as these other mikes are built under, it's just that  there's less quality control.	0
They just, you know, churn  them   out and don't check  them.	0
So that was - Yeah. So that was i- interesting result. So like I said, the front-end guys are	0
very much interested in - in this is as - as well and	0
So - so, but where is this now? I mean, what's - where do we go from here? I mean,	1
Yeah. That was gonna be my question.	0
we - so we have a - we have a - a system that works pretty well but it's not, you know, the system that	0
people here are  used  to using - to working with. So what - what do we do now?	0
Well, I think what we wanna do is we want to - eh, and we've talked about this in other  contexts - we want to	1
have the ability to feed it different features.	1
from the point of view of the front-end research, it would be s- uh, substituting for [MASK]	1
I think that's the key thing. And then if we can feed it different features, then we can try all the different things that we're trying there.	0
uh, also Dave is - is thinking about	1
using the data in different ways, uh, to	1
explicitly work on reverberation starting with some techniques that some other people have  found somewhat useful, and - Yeah.	1
So - so the key  thing that's missing here is basically the	1
you know, other features  i- into the recognizer and also then to train the system.	1
O_K. And, uh, es- I don't know when Chuck will be back but that's exactly what he - he's gonna -	0
He's - he's  sort  of back, but he drove for fourteen hours an- and wasn't gonna make it in today.	0
I think that's one of the things that he said he would be working on. Um.	0
Just sort of t- to make sure that  we can do that and -	0
It's - uh, I mean, the - the front-end is f- i- tha- that's in [MASK] is very nice in that it	1
does a lot of things on the fly but it unfortunately  is not  designed and, um -  like the, uh, ICSI system is, where you can feed it	1
from a pipeline of - of the command. So,	1
the - what that means probably for the foreseeable future is that	1
you have to, uh, dump out, um -	1
you know, if you want to use some new features, you have to dump them into	1
and  give those files to the recognizer.	0
We do - we tend to do that anyway.	1
Oh. So, although you - you can pipe it as well, we tend to do it that way because that way you can concentrate on one block and not keep re-doing it over and over.	0
Yeah. So I've - I -	0
So tha- that's exactly what [MASK]  is for.	0
Yeah, the - the - the cumbersome thing is - is, um - is that you actually have to dump out little - little files. So for each segment that you want to recognize  you have to  dump out  a separate file.	1
Just like i- th- like th- as if there were [MASK] but instead you have sort	0
O_K. So the s- the - the next thing we had on the agenda was something about alignments?	0
I don't know, did  you  wanna talk about it, or - ?	0
I can give a - I was just telling this to  Jane  and - and -	1
we were able to get some	1
definite improvement on [MASK] by	1
looking  at them first and then realizing the kinds of errors  that were occurring and	1
some of the errors occurring very frequently are just things like the first word being moved to as early as possible in the recognition, which is a	0
I think was  both  a - a pruning  problem  and	0
needing constraints on word locations. And so we tried both of these  st-  things. We tried saying -	0
I don't know, I got this  whacky idea that -	0
just from looking at the data, that when people talk  their words are usually chunked together.	0
It's not that they say one word	0
and then there's a bunch of words together.	0
They're   might  say one word and then another word far away if they were doing just [MASK]	0
But in general, if there's, like, five or six words and one word's far  away  from it, that's probably  wrong  on average. So,	0
And then also, ca- [MASK] of course, was too - too severe.	0
So that's actually interesting. [MASK] was the same value that we used for recognition.	0
And we had lowered that - we had used  [MASK] after Liz ran some experiments showing that,	0
you know, it runs  slower  and there's no real difference in -	0
Actually it was  better  with - slightly better or about th- it was the  same  with [MASK]	1
So for [MASK] this -	1
It's probably cuz the recognition's just bad en-	0
at a point where it's  bad  enough that - that you don't lose anything.	0
Um, but it turned out for - for - to get [MASK]  it was really important t	1
Um  because otherwise it would sort of do [MASK] um, in regions where there was no real speech  yet  from the foreground speaker.	0
Um,  so that was one big factor that helped improve things and then the other thing was that,	1
you know, as Liz said the - we f- enforce	1
uh, the foreground speech has to be continuous. It cannot be -	1
you cannot have a background speech	0
hypothesis in the  middle  of the foreground speech. You can only have background speech at the beginning and the end.	0
Yeah. I mean, yeah, it isn't  always  true, and I think what we really want is some  clever  way to do this, where,	1
um, you know, from the  data  or from maybe [MASK] from transcribers that	1
words that  do  occur just by themselves  a- alone, like [MASK] or something that we  did  allow to have background speech around it -	1
those  would be able to do that, but the rest would be constrained.	1
So, I think we have a version that's	1
pretty good for the native speakers. I don't know yet about the non-native speakers.	1
we basically also made [MASK] for the different - sort of grouped some of the  mouth noises together.	0
Um, so, and then there's [MASK]	1
There was some neat - or, interesting cases, like there's one meeting where,	0
um, Jose's giving a presentation and he's talking about,	0
um, the word [MASK] and someone didn't understand,	0
uh, that you were saying " mixed " -	0
And so your speech -ch	0
was s- saying something about [MASK] And the next turn	0
