come in in time to be relevant, but, uh, we had talked about, uh,  [MASK]	0
uh, over in Germany and - and,  @@	0
uh,  possibly coming up with something	0
that would, uh,  uh, fit in later. Uh, I saw that other mail where he said that he -	0
uh,  it  wasn't going to work for him to do C_V_S.	0
Yeah. So now he has a version of the software.	0
So he just has it all sitting there. Yeah.	0
he might work on improving the noise estimate  or on	0
some histogram things, or -	0
Yeah. I just saw [MASK] - We - we didn't talk about it at our meeting but I just saw the - just read the paper.	0
Someone, I forget the name,  and - and Ney, uh, about histogram	0
Did you see that one?	0
Um, it was a  poster.  Or -	0
Yeah. I mean, I just read the paper. I didn't see the poster.	0
It was something  similar to n-  on-line normalization finally - I mean, in  the idea of - of normalizing -	0
Yeah. But it's a little more - it - it's a little finer, right? So they had like ten quantiles and -	0
and they adjust the distribution. So you - you have the distributions from the training set,	0
So this is just a - a histogram of - of	0
the  amplitudes,  I guess. Right? And then -	0
Um, people do this in image processing some.  You have this kind of -	0
of histogram of - of levels of brightness or whatever. And - and - and then,	0
when you get a  new   - new thing that you - you want to adjust to be  better in some way,	0
you adjust it so that the histogram of the  new  data looks like the  old  data. You do this kind of  piece-wise  linear   or,	0
uh,  some  kind of piece-wise approximation. They did a -	0
uh  one version that was piece-wise linear and another that had a power law thing between  them   -	0
between the  points. And, uh,	0
they said they s- they sort of see it in a way as s- for the speech case  - as being kind of [MASK] in a way, because, you know, in spectral subtraction you're trying to	0
get rid of this excess energy. Uh, you know, it's not supposed to be there.	0
Uh -  and, uh, this is sort of   adjusting it for - for a  lot  of different levels. And then they have s- they have some kind of,	0
uh,  a floor or something, so if it gets too low you don't -	0
don't do it. And they - they claimed very nice results, and -	0
So is  this  a histogram across different frequency bins?	0
Um, I  think  this i-	0
You know, I don't remember that.	0
Do you remember - ?	0
I  think  they have, yeah, different histograms.  I- uh -	0
Something like one per  frequency band, or -  But I did -	0
So, one histogram per frequency bin.	0
But I should read the paper. I just went  through the poster quickly, and I didn't -	0
Yeah. And I don't remember whether it was  filter bank things or whether it was [MASK] or -	0
And - and that -	0
that, um,  histogram represents  the  different energy levels that have been seen at that  frequency?	0
And how often they - you've seen them. Yeah.	0
Yeah. And they do - they said that they could do it for the test -	0
So you don't have to change the training. You just do a measurement over the training.	0
And then, uh, for testing, uh, you can do it for one per utterance.	0
Even relatively short utterances. And they claim it - it works pretty well.	0
Is the idea that you - you run a test utterance	0
through some histogram generation thing and then you  compare  the histograms and that tells you	0
what to do to the utterance to	0
make it more like - ?	0
In principle. I didn't read carefully how they actually implemented it, whether it was some,	0
uh, on-line thing, or whether it was a second pass, or what. But -	0
That - that was sort of the idea. So that - that seemed, you know, different.	0
We're sort of curious about, uh, what are some things that are,	0
conceptually  quite different from what we've done.	0
Cuz we - you know, one thing that w- that,	0
uh, Stephane and Sunil seemed to find,	0
uh, was, you know, they could actually make a unified piece of software that handled a  range  of different things that people were talking about, and it was really just sort of setting of different  constants.	0
And it would turn, you know, one thing into another. It'd turn [MASK] int	0
But there's other things that we're  not  doing. So, we're  not  making any use of pitch,	0
uh, uh, which again, might - might be important,	0
uh, because the stuff between the harmonics is probably a [MASK] And - and the,	0
uh, transcribers will have fun with that.	0
the, uh, stuff at the harmonics isn't so much.	0
And - and, uh -	0
And we- there's this overall idea of really sort of	0
matching the - the hi- distributions somehow.	0
not just subtracting off your estimate of the noise.	0
play around with some of these things now over this next  period, or - ?	0
I dunno. I don't have feedback from him, but	0
I guess he's gonna, maybe -	0
Well, he's  got  it anyway, so he  can.	0
So potentially if he came up with something that was useful, like a diff- a better noise estimation module or something, he could ship it to you guys  u-  up there and	0
we could put it in.	0
So, why don't we just, uh, um - I think starting -	0
starting a w- couple weeks from now, especially if you're not gonna be around for a while, we'll - we'll be shifting more over to some other -	0
uh, n- not - not  so  much in this meeting about Aurora, but -	0
uh, maybe just, uh, quickly today about - maybe	0
you could just say a little bit about what you've been talking about with Michael. And -	0
and then Barry can say something about  what  - what we're talking about.	0
So Michael Kleinschmidt, who's a P_H_D student from Germany,	1
showed up  this  week. He'll be here for about six months. And he's done some work using	1
and  using that f- uh, to generate speech recognition features.	1
And  he did  work back in Germany	1
with, um, a  toy  recognition system	1
digit recognition  as the task. It was actually just [MASK]	1
that classified words - classified digits,	0
Um, and  he tried that on - I  think  on some Aurora data and got results that he thought  seemed respectable. And	0
he w- he's coming here to u- u- use it on a-	1
uh, a real speech recognition system.	1
So I'll be working with him on that. And, um,	0
maybe I should say a little more about these features,	0
although I don't understand them  that  well.	0
The - I think it's a two-stage idea. And, um,	0
the first stage of these features	0
correspond to what's called the [MASK]	0
I guess  that  is like	0
a filter bank with [MASK]	0
I'm- I'm not sure  what  we have	0
@@   in  there that isn't already modeled in something like,	0
um,  [MASK] I should learn more about that.	0
the  second  stage  is, um,	0
the  most  different thing, I think, from what we usually do. It's, um -	0
it computes features which are,	0
sort of like based on diffe- different w- um, wavelet basis functions	0
So th- he uses analysis functions called  [MASK]	0
um,  which have a certain	0
in time and in frequency.	0
the idea is these are used to sample,	0
represented as a time-frequency representation.	0
So you're  sampling some piece of this time-frequency plane.	0
um, is - is interesting, cuz,	0
@@  for - for one thing, you could use it,	0
um, in a - a multi-scale way. You could have these -	0
instead of having everything - like we use a twenty-five millisecond or so analysis window,	0
um, and that's our time scale for features, but you could -	0
using this, um, basis function idea, you could have  some  basis functions	0
which have a lot  longer  time scale	0
and, um, some which have a lot  shorter,  and	0
so it would be like  a set of  multi-scale  features.	0
So he's interested in, um -	0
Th- this is -  because  it's, um - there are these different parameters for the shape of these	1
there are a  lot  of different possible basis functions. And so he -	1
an optimization procedure to choose an -	1
an optimal set of basis functions out of all the possible ones.	1
What does he do to choose those?	0
The method he uses is kind of funny - is,	1
he starts with - he has a set of M_ of them.	1
he - and then  he uses that to classify -	0
I mean, he t- he tries, um,	1
using  just M_ minus one of them.	1
So there are M_ possible subsets of this	1
length-M_ vector.  He tries classifying, using each of the M_	1
the  best,  I guess, he says -	1
the - the fe- feature  that  didn't use	1
was the most useless feature,	1
so we'll throw it out and we're gonna randomly select	1
from the set of possible basis functions.	1
Yeah.  So i- so it's actuall-	0
it's a  little  bit like [MASK] or something in a way.	0
It's like a greedy -	0
Well, it's - it's much simpler. But it's - but it's - uh, it's - there's a lot - number of things I like about it, let me just say.	0
So, first thing, well, you're absolutely right. I mean,	0
both  pieces of this are - have their analogies in stuff we already do.	0
But it's a different  take	0
at how to approach it and  potentially  one that's	0
m- maybe a bit more  systematic  than what we've done,	0
uh, and a b- a  bit  more inspiration from - from auditory things. So it's - so I think it's a neat thing to try.	0
um,  are  in fact -	0
Yeah, essentially, it's - it's, uh, you know, [MASK] or -	0
uh,  compression.  We always have some compression. We always have some - you know, the - the -	0
the kind of filter bank with a kind of	0
Um,  if you put in - if you also include the  [MASK]  in it - i- RASTA - the filtering being done in the log domain	0
has an A_G_C-like, uh, characteristic, which, you know, people typi- typically put in these kind of,	0
uh, auditory front-ends. So it's very, very similar,	0
uh, but it's not exactly the same.	0
I would agree that the second one is - is  somewhat  more different but,	0
um, it's  mainly  different in that the things that we have been  doing   like that	0
had a different kind of motivation and have ended up with different kinds of constraints.	0
So, for instance, if you look at [MASK] stuff,	0
you know,  basically  what they do is they - they look at the different [MASK] out of the L_D_A and they form filters out of it. Right?	0
And those   filters  have different, uh, kinds of temporal extents and temporal characteristics.	0
And so in fact they're multi- scale.	0
But, they're not sort of systematically multi-scale, like "let's start here and go to there, and go to there, and go to there", and so forth. It's more like,	0
you run it on this, you do [MASK] and you find out what's helpful.	0
I- it's multi-scale because you use several of these in parallel, is that right? Of -	0
Yeah. They use several of them. Yeah.	0
Uh, I mean, you don't  have  to but - but - but, uh, Hynek has.	0
but it's  also,  uh -	0
Hyn-  when Hynek's had people do this kind of L_D_A analysis, they've done it on  frequency  direction and they've done it on the  time  direction.	0
I  think  he  may  have had people sometimes doing it on both  simultaneously   - some two-D_ - and that would be the closest to these Gabor function kind of things.	0
Uh, but I don't think they've done that much of that.	0
And, uh, the  other  thing that's interesting - the - the, uh -	0
the  feature  selection thing, it's a  simple  method,	0
but I kinda  like  it. Um,	0
there's a -  a old, old method for feature selection. I mean,	0
eh, uh, I remember people referring to it as old when I was playing with it twenty years ago, so I know it's pretty old,	0
uh, called [MASK] in which you - which - I think it's used in social sciences a lot.	0
So, you - you - you - you pick the best feature.	0
you take - y- you find the next feature that's the best in  combination  with it.	0
And then so on and so on.	0
And what - what  Michael's  describing seems to me  much,  much  better,	0
because the  problem  with the stepwise discriminant analysis is that you don't know that - you know, if you've  picked the right	0
set of features. Just because something's a good feature doesn't mean that you should be  adding  it. So,	0
uh,  here  at least you're starting off with  all  of them,  and you're  throwing out  useless  features. I think that's - that seems, uh -  that seems like a lot better idea.	0
Uh, you're  always  looking at things in combination with other features.	0
so the only thing is, of course, there's this - this	0
artificial question of - of, uh,	0
how you a- how you assess it and if - if your order had been different in throwing them out.	0
I mean, it still isn't necessarily really  optimal,  but it seems like a pretty good heuristic.	0
So I th- I think it's - it's - I think it's kinda neat stuff. And - and - and, uh,	1
the thing that  I  wanted to - to add to it also was to have us use this in a multi-stream way.	1
so - so that, um,	1
when you come up with these different things,	1
you don't necessarily just put  them   all into one huge vector,	1
have some of  them   in one stream and some of  them   in another stream, and so forth.	1
And we've also talked a little bit about, uh,	0
uh, Shihab Shamma's stuff, in which	0
you - the way you look at it is that there's these different mappings and some of them emphasize, uh,  [MASK]	0
uh, energy and fre- and frequency. And some are emphasizing  downward  and	0
fast  things and  slow  things and -	0
So there's a bunch of stuff to look at. But, uh, I think we're sorta gonna start off with what	0
he, uh, came here with and branch out -	0
here, too,  at the same time.  So,	0
he'll be another  interesting source of  wisdom.	0
As - as we were talking about this I was thinking,	0
um,  whether there's a relationship between -	0
between Michael's approach to, uh, some - some sort of optimal brain damage or optimal brain surgeon on the neural nets.	0
So, like, if we have,	0
we have our - we have our RASTA features and -	0
and  presumably  [MASK] are - are learning some sort of a nonlinear mapping,	0
uh, from the - the - the features	0
to - to this - this  probability  posterior space.	0
and each of the hidden units is learning some sort of - some sort of -	0
Right? And it could be, like -	0
like these, um - these auditory patterns that Michael  is looking at.	0
And then when you're looking at the -	0
the, uh,  um,  the  best  features,	0
you know, you can take out -  you can  do the - do this, uh, brain surgery by taking out,  um,  hidden  units that don't really help at all. And this is k- sorta like -	0
Or the - or  features.	0
I mean, y- actually, you make me think a - a very important  point  here is that, um,	0
if we a- again try to look at how is this different from what we're already  doing,	0
uh, there's a - a, uh -	0
a nasty argument that could be made th- that it's - it's not different at - at  all,	0
because, uh - if you ignore the - the selection part  -	0
because we are going into a - a very powerful,	0
that, uh, in fact is  combining  over time and frequency,	0
and is coming up with its own - you know,  better  than Gabor functions  - its, you know,  neural  net functions, its -   whatever it finds to be  best.	0
Um, so you could argue that in fact it -  But I - I don't actually  believe  that argument because I know that, um,	0
added  anything - in fact, you  subtracted  something, from the original  waveform  -	0
You know, uh, if you've - you've processed it in some way you've typically lost  something  - some  information.  And so,	0
you've  lost  information and yet it does  better	0
with -  with features than it does with the waveform. So,	0
uh, I - I know that i- sometimes it's useful to -	0
to  constrain  things. So that's	0
why it really seems like the  constraint  - in - in  all  this stuff it's the constraints that  are  actually what matters.	0
Because if it wasn't  the constraints that mattered, then we would've  completely  solved this problem long  ago,  because long  ago  we already knew how to put waveforms into powerful statistical mechanisms.	0
Yeah. Well, if we had infinite processing power and  data,	0
I guess, using the waveform could -	0
then it would work. Yeah, I agree.	0
Yeah. Then it would work. But - but, I mean, i- it's -	0
With finite  of  those  things - I mean, uh, we - we  have  done experiments where we literally have put waveforms in and -	0
and - and, uh, we kept the number of parameters the same and so forth, and it used a  lot  of training data. And it - and it - it, uh -	0
not infinite but a lot, and then compared to the number parameters - and it - it, uh - it just doesn't do nearly as well.	0
So,  anyway  the point is that you want to  suppress  -	0
it's not just having the maximum information, you want to suppress,	0
uh, the aspects of the input signal that are not helpful for -	0
for the discrimination you're trying to make.	0
So maybe just briefly, uh -	0
Well, that sort of  segues  into  what - what  I'm  doing.	1
so, uh, the big picture is k-	1
um,  come up with a set of,	1
uh, intermediate categories, then build intermediate [MASK] then do  recognition,	1
and, um, improve speech recognition in that way.	0
Um, so right now I'm in - in the phase where  I'm looking at - at, um, deciding on a initial set of intermediate categories. And	1
I'm looking  for data- data-driven	1
methods that can help me find,	1
um, a set of intermediate categories  of speech that, uh, will help me to discriminate  later down the line.	1
And  one  of the ideas,  um, that was to take a - take a  neural  net -	1
train - train an ordinary neural net	1
uh, to learn the posterior probabilities of phones.	1
um, at the end of the day you have this neural net and it has hidden -	0
hidden units. And each of these hidden units is -	0
um, is learning some sort of pattern.	0
And so, um, what - what  are  these patterns? I don't  know.	0
Um, and I'm gonna to try to -	0
to look at those patterns	0
to - to see,  um,  from those patterns -	0
uh,  presumably  those are  important  patterns for discriminating between phone classes. And maybe -	0
maybe some, uh, intermediate categories can come from	0
just looking at the patterns of -	0
um, that the neural net learns.	0
Be- before you get on the next part l- let me just point out that s- there's - there's a - a pretty nice	0
relationship  between what  you're  talking about doing and what  you're  talking about doing there. Right? So,	0
it seems to me that, you know, if you take away the - the -  the difference of this	0
and, say, you use - as we had talked about maybe  doing  - you use P_- RASTA-P_L_P or something for the - the primary features,	0
um, then this feature discovery,	0
is just what  he's  talking about doing,  too,	0
except that he's talking about doing them in order to discover  intermediate  categories  that correspond	0
to these - uh, uh, what these	0
sub-features are - are - are - are showing you.	0
the  other  difference is that,	0
he's doing this in a - in a  multi-band  setting,	0
which means that he's  constraining  himself	0
to look across  time  in some f- relatively limited, uh, uh, spectral extent. Right?	0
And whereas in - in this case you're saying "let's just do it unconstrained".	0
So they're - they're  really  pretty  related  and maybe they'll be - at  some  point where we'll	0
see the - the connections a little better and	0
Yeah, so - so that's the - that's the first part - uh, one - one of the ideas to get at some -	0
some  patterns  of intermediate categories.	0
Um,  the other one  was,	1
uh, come up with a - a - a model -  um, a graphical model,	1
as  hidden  - [MASK] that we don't know anything  about,	1
um, s- statistical training and [MASK]  um, at the end of the  day,   we have, um -	1
we have  learned  something about these - these latent, um - latent variables which  happen  to correspond to  [MASK]	1
Yeah, and so those are the - the two directions that I'm - I'm looking into right now.  And, uh,	0
Yeah. I guess that's - that's it.	0
Should we do our digits and	0
get ou- get our treats?	0
Yeah. It's kind of like, you know, the little rats with the little thing dropping down to  them.   We do the digits and then we get our treats.	0
