And uh Hans- uh, Hans-Guenter will be here, um, I think by next next Tuesday or so.	1
So he's he's going to be here for about three weeks, and, uh -	1
We might might end up with some longer collaboration or something. So he's gonna look in on everything we're doing and	1
give us his his thoughts. And so it'll be another another good person looking at things.	1
Th- that's his spectral subtraction group? Is that right?	1
Oh, O_K. So I guess I should probably talk to him a bit too?	1
Yeah. No, he'll be around for three weeks. He's, uh, um, very, very, easygoing, easy to talk to, and, uh, very interested in everything.	0
Yeah, we met him in Amsterdam.	0
Yeah, yeah, he's been here before. I mean, he's he's he's he's -	0
Oh, O_K.  I haven't noticed him.	0
Wh- Back when  I  was a grad student he was here for a, uh, uh a  year  or	0
n- six months.  Something like that.	0
N- nine months.  Something  like that. Yeah.	0
Yeah. He's he's done a couple stays here. Yeah.	0
So, um,   I guess we got lots to catch up on. And we haven't met for a couple of weeks. We didn't meet last week, Morgan.	1
Um, I went around and talked to everybody, and it seemed like they they had some new results but rather than them	0
coming up and telling me I figured we should just wait a week and they can tell both you know, all of us.	0
why don't we why don't we start with  you,  Dave, and then, um, we can go on. So.	1
So, um, since we're looking at putting this, um -	1
mean log m- magnitude spectral subtraction, um, into the SmartKom system,	1
I- I did a test seeing if, um, it would work using past  only   and plus the present to calculate the mean. So, I did a test, um,	1
where I used twelve seconds from the past and the present frame to, um, calculate the mean.  And -	1
Twelve twelve seconds back from the current  frame, is that what you mean?	0
Twelve seconds, um, counting back from the end of the current frame, yeah. So it was, um, twen- I think it was twenty-one frames and that worked out to about twelve seconds.	1
And compared to, um, do- using a twelve second  centered  window, I think there was a drop in performance  but it was just a slight drop.	1
Um, yeah, I mean, it was pretty it was pretty tiny. Yeah.	0
So  that  was encouraging. And, um,	0
that that um, that's encouraging for for the idea of using it in an interactive system like SmartKom.	0
And, um, another issue I'm I'm thinking about is in the SmartKom system. So say twe- twelve seconds in the earlier test seemed like a good length of time, but what happens if you have less than twelve seconds?	1
So I w- bef- before, um Back in  May,  I did some experiments using, say,  two  seconds, or  four  seconds, or  six  seconds.	1
In those I  trained  the  models  using mean subtraction with the means calculated over  two  seconds, or  four  seconds, or  six  seconds. And, um,	1
here,  I was curious, what if I trained the models using  twelve  seconds but I f- I gave it a situation where the  test  set I was subtracted using two seconds, or four seconds, or six seconds. And, um -	1
So I did that for about three different conditions. And, um -	0
I mean, I th- I think it was, um, four se-	0
I think I think it was, um, something like four seconds and,	0
um, six seconds, and eight seconds. Something like that. And it seems like it it it  hurts  compared to if you actually train the models  using th- that same length of time  but it it doesn't hurt that much. Um,	1
u- usually less than point five percent, although I think I did see  one  where it was a point eight percent or so rise in word error rate.  But this is, um,	0
w- where, um, even if I train on the, uh, model, and mean subtracted it with the same	0
length of time as in the test, it the word error rate is around, um, ten percent or nine percent. So it doesn't seem like that big a d- a difference.	0
But it but looking at it the  other  way, isn't it what you're saying that it didn't  help  you to have the longer time for  training,   if you were going to have a short time for -	0
I mean,  why  would you  do  it, if you knew that you were going to have short windows in testing.	1
Yeah, it  seems  like for your  I mean , in normal situations you would never get twelve seconds of  speech,  right?	1
You need twelve seconds in the past to estimate, right?	0
Or l- or you're looking at six sec seconds in  future  and six in -	0
N- n- uh For the  test  it's just twelve seconds in the  past.	0
Is this twelve seconds of uh, regardless of speech or silence? Or twelve seconds of  speech?	0
The  other  thing, um, which maybe relates a little bit to something else we've talked about in terms of  windowing  and so on is,	1
that, um, I wonder if you trained with twelve seconds, and then when you were  two  seconds in	1
you used  two  seconds, and when you were  four  seconds in, you used  four  seconds, and when you were six and you basically build up to the twelve seconds. So that if you have very  long  utterances you have the best,	1
but if you have shorter  utterances   you use what you  can.	1
Right. And that's actually what we're planning to do in SmartKom.	1
But s- so I g- So I guess the que- the question I was trying to get at with those experiments is,	0
"does it matter what  models  you use? Does it matter how much time y- you use to calculate the mean when you were, um, tra- doing the  training  data?"	0
But I mean the other thing is that that's I mean, the other way of looking at this, going back to, uh, mean cepstral subtraction versus RASTA kind of things, is that you could look at	0
mean cepstral subtraction, especially the way  you're  doing it, uh, as being a kind of filter.	0
And so, the other thing is just to design a  filter.	0
You know, basically you're you're you're doing a high-pass filter or a band-pass filter of some sort and and just design a  filter.	0
And then, you know, a filter will have a certain behavior and you loo- can look at the start up behavior	0
when you start up with nothing. And and, you know, it will, uh, if you have an I_I_R filter for instance, it will, um,	0
uh, not behave in the steady-state way that you would like it to behave until you get a long enough  period,  but, um,	0
uh, by just constraining yourself to have your filter be only a subtraction of the mean, you're kind of, you know, tying your hands behind your back because there's -	0
filters have all sorts of be- temporal and spectral behaviors.	0
And the only thing, you know,  consistent  that we know about is that you want to get rid of the very low frequency  component.	0
But do you really want to calculate the mean?  And  you neglect all the silence  regions   or you just use everything that's twelve seconds, and -	0
you do you mean in my tests so far?	0
Most of the silence has been cut out.	0
Just There's just inter-word silences.	0
Mm-hmm. And they are, like, pretty short. Shor- Yeah, O_K. Yeah.	0
So you really need a lot of speech to estimate the mean of it.	0
Well, if I only use six seconds, it still works pretty well.	0
I saw in my test before.	0
I was  trying  twelve seconds cuz that was the  best   in my test before and  that  increasing past twelve seconds didn't seem to help.	0
th- um, yeah, I guess it's something I need to play with more to decide how to set that up for the SmartKom system. Like,	0
may- maybe if I trained on six seconds it would work better when I only had	0
two seconds or four seconds, and -	0
Yeah. Yeah. And, um -	0
Yeah, and again, if you take this  filtering  perspective and if you	0
essentially have it build up over time. I mean, if you computed means over two and then over four, and over six, essentially what you're getting at is a kind of,	0
uh, ramp up of a filter anyway. And so you may may just want to  think  of it as a filter. But, uh, if you  do  that,	0
then, um, in  practice  somebody using the SmartKom system, one would  think   if they're using it for a while,	0
it means that their  first  utterance, instead of, you know, getting, uh, a forty percent error rate reduction, they'll get a uh, over what, uh, you'd get without this, uh, um, policy,	0
uh, you get  thirty  percent. And then the  second  utterance that you give, they get the  full  you know, uh,  full  benefit of it if it's this ongoing thing.	0
Oh, so you you cache the utterances? That's how you get your, uh -	0
Well, I'm saying in  practice,  yeah, that's If somebody's using a system to ask for directions or something,	0
you know, they'll say something first. And and to  begin  with if it doesn't get them quite right, ma- m- maybe they'll come back and say, "excuse me?" uh, or some I mean it  should  have some policy like that  anyway.	0
uh, in any event they might ask a second question. And it's not like what he's doing doesn't, uh,  improve  things. It  does   improve  things, just not as much as he would  like.	0
And so, uh, there's a higher probability of it making an  error,	0
uh, in the first  utterance.	0
What would be  really  cool is if you could have -	0
uh, this probably users would never  like  this but if you had -	0
could have a system where,  before they began to use it they had to introduce themselves,	0
verbally.  You know. "Hi, my name is so-and-so, I'm from blah-blah-blah." And you could use that initial speech to do all these	0
Oh, the  other  thing I guess which which, uh,	0
I don't know much about as much as I  should  about the rest of the  system  but but, um,	1
if you if you sort of did a first pass  I don't know what kind of, uh,	0
uh, capability we have at the moment for for doing second passes on on, uh,	0
uh, some kind of little small lattice, or a graph, or confusion network, or something. But if you did first pass with, um,	1
the with either without the mean sub- subtraction or with a a very short time one,	1
and then, um, once you, uh, actually had the whole  utterance  in,	1
the, uh, uh,  longer  time version  then,  based on everything that you  had,  um, and then at that point  only  used it to distinguish between,	1
you know, top N_, um, possible utterances or something,	1
you you might it might not take very much  time.	1
I mean, I know in the large vocabulary stu- uh, uh, systems, people were evaluating on in the past,	1
some people really pushed everything in to make it in one pass but other people  didn't  and had  multiple  passes.	1
the argument, um, against multiple passes was u- u- has often been "but we want to this to be r- you know have a nice interactive response".	1
And the counterargument to that which, say, uh, B_B_N I think had,  was "yeah, but our  second  responses are  second,  uh, passes and third passes are  really,  really fast".	1
So, um, if if your  second   pass  takes a  millisecond  who  cares?	0
the the idea of the second pass would be waiting till you have more recorded speech? Or ?	0
Yeah, so if it turned out to be a problem,	0
that you didn't have enough speech because you need a longer longer window to do this processing,	0
then, uh, one tactic is you know, looking at the larger system and not just at the front-end stuff  -	0
is to take in, um, the speech with some  simpler  mechanism or shorter  time  mechanism,	0
um, do the best you  can,  and come up with some al- possible  alternates  of what might have been  said.	0
And, uh, either in the form of an N_best list or in the form of a lattice, or or confusion network, or whatever.	0
And then the  decoding  of  that  is much, much faster or  can  be much, much faster if it isn't a big bushy network.	0
And you can decode  that  now with speech that you've actually  processed  using this  longer  time, uh, subtraction.	0
So I mean, it's it's common that people do this sort of thing where they do more things that are more complex or require looking over more time, whatever, in some kind of second pass.	0
um, and again, if the second pass is  really,  really  fast  Uh, another one I've heard of is is in in connected digit stuff,	0
um, going back and l- and through backtrace and finding regions that are considered to be a d- a digit,	0
but, uh, which have very low energy.	0
So, uh I mean, there's lots of things you can do in second passes, at all sorts of levels. Anyway, I'm throwing too many things out. But.	0
So is that, uh -	0
O_K, uh, do you wanna go, Sunil?	1
the last two weeks was, like So I've been working on that Wiener filtering.	1
found that, uh, s- single like, I just do a s- normal Wiener filtering, like the standard method of Wiener filtering.	1
And that doesn't actually  give  me any	1
I mean, uh, b- it actually improves over the  baseline  but it's not like it doesn't meet something like fifty percent or something.	1
So, I've been playing with the v-	0
Improves over the base line M_F_C_C system? Yeah.	1
Yeah. Yeah. Yeah. So, um  So that's The improvement is somewhere around, like, thirty percent over the baseline.	1
Is that using in  combination  with something else? With with a -	1
No, just just one stage Wiener filter which is a standard Wiener filter.	1
No, no, but I mean in combination with our on-line normalization or with the L_D_A? Oh, O_K.	0
Yeah, yeah, yeah, yeah. So I just plug  in  the Wiener filtering.	0
I mean, in the s- in our system, where So, I di- i- di-	0
So, does it g- does that mean it gets  worse?  Or ?	0
No. It actually improves over the baseline of  not  having a Wiener filter in the whole system.	0
Like I have an L_D_A f- L_D_A plus on-line normalization,	0
and then I plug in the Wiener filter in that,  so it improves over not having the Wiener filter.	0
So it improves but it it doesn't take it like be- beyond like thirty percent over the baseline.	0
But that's what I'm confused about, cuz I think I thought that our system was more like  forty  percent  without  the Wiener filtering.	0
well,   these  are not -	0
Is this with the v- new V_A_D?	0
No, it's the  old  V_A_D. So my baseline was,	0
nine This is like w- the baseline is ninety-five point six eight,	0
So I mean, if you can do all these in  word  errors it's a lot a lot easier actually.	0
If you do all these in  word  error rates it's a lot  easier,  right?	0
Oh, O_K, O_K, O_K.  Errors, right,  I don't have. It's all accuracies.	0
O_K, cuz then you can figure out the  percentages.	0
The baseline is something similar to	0
the t- the the baseline that you are talking about is the M_F_C_C baseline, right?	0
The t- yeah, there are  two  baselines. O_K. So the baseline  One  baseline is M_F_C_C baseline that When I said thirty percent improvement it's like M_F_C_C baseline.	0
So so so  what's it start on?  The M_F_C_C baseline is is  what?  Is at what  level?	0
it's just the mel frequency and that's it.	0
No, what's what's the  number?	0
Uh, so I- I don't have that number here. O_K, O_K, O_K, I have it here.	0
Uh, it's the V_A_D plus the baseline actually. I'm talking about the -	0
the M_F_C_C plus I do a frame dropping on it. So that's like the word error rate is like four point three.	0
It's a medium misma- O_K, sorry. There's a well ma- well matched, medium mismatched, and a high matched. So I don't have the like the -	0
O_K, four point three, ten point seven, and -	0
Forty percent is the high mismatch.	0
And that becomes like four point three -	0
Yeah, it's like ten point one.  Still the same.	0
And the  high  mismatch is like	0
Eighteen point five. And what were you just describing?	0
Oh, the one is this one is just the baseline plus the,	0
uh, Wiener filter plugged into it.	0
But where's the, uh, on-line normalization and so on?	0
So, with the with the on-line normalization, the performance was, um,	0
ten  O_K, so it's like four point three.	0
Uh, and again, that's the ba- the ten point, uh, four	0
That was with on-line normalization and L_D_A.	0
So the h- well matched has like literally not changed by adding on-line or L_D_A on it.	0
I mean, even the medium mismatch is pretty much the same.	0
And the high mismatch was improved by twenty percent absolute.	0
O_K, and what kind of number an- and what are we talking about here? Is this T_I-digits or -	0
It's the It- it's Italian. I'm talking about Italian, yeah.	0
Italian? And what did So, what was the, um,	0
uh, corresponding number, say, for,	0
um, uh, the Alcatel system for instance? Do you know?	0
Yeah, so it looks to be, um -	0
uh, eight point, uh, seven,  and, uh, thirteen point seven.	0
So, uh, this is the	0
with The noise estimation was based on	0
Actually I started with using the V_A_D to estimate the noise and then I found that it works -	0
it  doesn't work for Finnish and Spanish because the V_A_D endpoints are not good	0
to estimate the noise because it cuts into the speech sometimes, so I end up overestimating the noise and getting a  worse  result.	0
So it works only for Italian by u- for using a V_A_D to estimate noise. It works for Italian because the VAD was  trained  on Italian.	0
So, uh so this was, uh -	0
And so this was giving -	0
um, this this was like not improving a lot on this baseline of  not  having the Wiener filter on it.	0
And, so, uh, I ran this stuff with one more stage of Wiener filtering on it but the second time, what I did was I -	1
estimated the new Wiener filter based on the cleaned up speech,	1
and did, uh, smoothing in the frequency to -	1
to reduce the variance -	1
I mean, I have I've I've observed there are, like, a lot of bumps in the frequency when I do this Wiener filtering which is more like a musical noise or something.	0
And so by adding another stage of Wiener filtering,	1
the results on the SpeechDat-Car was like,	1
um So, I still don't have the word error rate. I'm sorry about it. But the overall improvement was like fifty-six point four six.	1
This was again using ten frames of noise estimate and two stage of Wiener filtering.	0
And the rest is like the L_D_A  plu-  and the on-line normalization all remaining the same.	0
Uh, so this was, like, compared to, uh, uh Fifty-seven is what you got by using the French Telecom system, right?	0
No, I don't  think  so. Is it on Italian?	0
No, this is over the whole SpeechDat-Car. So -	0
Yeah, so the new the new Wiener filtering schema is like some fifty-six point four six which is like	0
one percent still less than	0
what you got using the French Telecom system.	0
But it's a pretty similar number in any event.	0
Yeah. But again, you're you're  more  or less doing what they were  doing,  right?	0
It's it's different in a sense like I'm actually cleaning up the cleaned up spectrum which they're not doing.	0
They're d- what they're doing is, they have two stage stages of estimating the Wiener filter,	0
the final filter, what they do is they -	0
they take it to their time domain by doing an inverse Fourier transform.	0
And they filter the original signal using that fil- filter,	0
final  filter is acting on the input noisy speech rather than on the cleaned up.	0
So this is more like I'm doing Wiener filter twice,	0
but the only thing is that the second time I'm actually smoothing the filter and then cleaning up the cleaned up spectrum first level.	0
And so that that's that's what the difference is. And actually I tried it on s- the original clean -	0
I mean, the original spectrum where, like, I the second time I estimate the filter but actually clean up the	0
noisy speech rather the c- s- first -	0
output of the first stage and that doesn't -	0
seems to be a giving, I mean, that much improvement. I I didn- didn't run it for the whole case.	0
and what I t- what I tried was, by using the  same  thing but Uh, so we actually found that	0
the VAD is very, like, crucial. I mean, just by changing the  VAD  itself gives you the a lot of improvement by instead of using	0
the current VAD, if you just take up the VAD output from the channel zero,	0
when  instead of using channel zero and channel one,	0
because that was the p- that was the reason why I was  not  getting a lot of improvement for estimating  the  noise.	0
So I just used the channel zero VAD to estimate the noise so that it gives me some reliable mar-	0
markers for this noise estimation.	0
What's a channel zero VAD? I'm I'm confused about that.	0
Um, so, it's like -	0
So it's the close-talking microphone.	0
Yeah, the close-talking without So because the channel zero and channel one are like the same	0
speech, but only w- I mean, the same  endpoints.  But the only thing is that the speech is very noisy for channel one, so you can actually use the output of the channel zero for	0
channel one for the VAD. I mean, that's like a cheating method.	0
Right. I mean, so a- are they going to pro-	0
What are they doing to do, do we know yet?	1
about as far as what they're what the rules are going to be and what we can use?	1
Yeah, so actually I received a a new document, describing  this.  And what they did finally is to, mmm,	1
uh, not to align the utterances but to perform recognition,	1
um, only on the close-talking microphone,	1
and to take the result of the recognition to get the boundaries	1
Which is the channel zero.	0
So it's  not  like that's being done in one  place  or one  time.  That's that's just a rule and we'd you you were permitted to do that.  Is is that it?	0
Uh, I think they will send, um, files but we we don't Well, apparently -	0
Oh, so they  will  send files so everybody will have the same boundaries to work with?	1
But actually their alignment actually is  not  seems to be improving in like on all cases.	0
Yeah, so what happened here is that,	0
um, the overall improvement that they have with this method So Well, to be more precise, what they have is, they have these alignments and then	0
they drop the beginning silence and and the end silence but they keep,	0
uh, two hundred milliseconds before speech and two hundred  after  speech. And they keep the speech pauses also.	0
Um, and the overall improvement over the M_F_C_C baseline  So, when they just,	0
uh, add this frame dropping in addition it's r- uh, forty percent, right? Fourteen percent, I mean.	0
Um, which is, um, t-	0
which is the overall improvement. But in some cases it doesn't improve at all. Like, uh, y- do you remember which case?	0
It gives like negative Well, in in like some Italian and T_I-digits, right?	0
endpointed speech, actually it's worse than the baseline in some instances, which could be due to the	0
Yeah. And Yeah, the other thing also is that fourteen percent is less than what you obtain using a real V_A_D.	0
Yeah, our neural net -	0
So with- without cheating like this. So Uh So I think this shows that there is still work -	0
Uh, well, working on the V_A_D is still still important I think.	0
Can I ask just a a  high  level question?	1
Can you just say like one or two sentences about Wiener filtering and why -	1
why are people doing that? What's what's the  deal  with that?	1
it's it's like it's like you	0
try to minimize I mean, so the basic principle of Wiener filter is like you try to minimize the,	1
uh, d- uh, difference between the noisy signal and the clean signal if you have two channels. Like let's say you have a clean t- signal and you have an additional channel where you know what is the	1
noisy signal. And then you try to minimize the error between these two.	0
So that's the basic principle. And you	0
get you can do that I mean, if if you have only a c-	0
noisy  signal, at a level which you, you w- try to estimate the noise from the w-	0
assuming that the first few frames are noise or if you have a w- voice activity detector, uh, you estimate the noise spectrum. And then you -	0
Do you assume the noise is the same?	0
in yeah, after the speech starts.	0
but that's not the case in, uh, many many of our cases but it works reasonably well.	0
What you do is you, uh b-	0
So again, I can write down some of these eq- Oh, O_K.	0
And then you do this uh, this is the transfer function of the	0
Wiener filter, so "S_F" is a clean speech spectrum, power spectrum	0
And "N_" is the noisy power spectrum.	0
And so this is the transfer function.	0
Right  actually, I guess -	0
And then you multiply your noisy power spectrum with this. You get an estimate of the clean power spectrum.	0
but the thing is that you have to estimate the S_F from the noisy spectrum, what you have.	0
So you estimate the N_F from the initial noise portions	0
and then you subtract that from the current noisy spectrum to get an estimate of the S_F.	0
So sometimes that becomes zero because you do- you don't have a true estimate of the noise.	0
So the f- filter will have like sometimes zeros	0
in it because some frequency values will be zeroed out because of that.	0
And that creates a lot of	0
discontinuities across the spectrum because  @@  the filter.	0
uh, so that's what that was just the first stage of Wiener filtering that I tried.	0
basically s- uh, similar to just regular spectral subtraction?	0
It's all pretty related, yeah. It's it's there's a di- there's a whole class of techniques where you try in some sense to minimize the noise.	0
And it's typically a mean square sense, uh uh uh, i- in in in some way. And, uh uh, spectral subtraction is is, uh uh, one approach to it.	0
Do people use the Wiener filtering in combination with the spectral subtraction typically, or is i- are they	0
They are very s- similar techniques. So it's like I haven't seen anybody using s- Wiener filter with spectral subtraction.	0
I mean, in the long run you're doing the same thing but y- but there you make different approximations, and -	0
in spectral subtraction, for instance, there's a a an estimation factor. You sometimes will figure out what the noise is and you'll multiply	0
that noise spectrum times some constant and subtract that rather than and sometimes people -	0
even though this really should be in the power domain, sometimes people s- work in the magnitude domain because it it it works better.  And, uh,	0
So why did you choose, uh, Wiener filtering over some other one of these other techniques?	0
