if it's possible to be able to discriminate	0
among the phonemes in context.	0
it's an interesting thought. I mean we we could disagree about it at length	1
but the the  real  thing is if you're interested in it you'll probably try it and -	1
But but what I'm  more  concerned with now, as an operational level, is	1
uh, you know, what do we do in four or five days?	0
so we have  to be concerned  with	0
Are we gonna look at any combinations of things, you know once the nets get retrained so you have this problem out of it.	0
Um, are we going to look at  multi-band? Are we gonna look at combinations of things?	0
Uh, what  questions  are we gonna ask,	0
uh now that, I mean,	0
we should probably turn shortly to this O_G_ I  note.	0
Um, how are we going to  combine	0
with what  they've  been focusing on?	0
Uh we haven't been doing any of the L_D_ A  RASTA sort of thing.	0
And they, although they don't  talk  about it in this  note,  um,	0
there's um,  the issue of the	0
um  Mu law   business  uh  versus the logarithm,	0
So what i- what is going on right  now?  What's right you've got	0
Are there is there are there any H_T_ K   trainings testings going on?	1
I I I'm trying the H_T_K with eh,	1
P_L_P twelve on-line delta-delta and  M_S_G   filter  together.	1
The combination, yeah. But I haven't result  at this moment.	1
And is this with the revised  on-line normalization?	0
Ye- Uh, with the old   older , yeah.	0
So it's using all the nets for that but again we have the hope that it -	0
We have the hope that it -	0
maybe it's not making too much difference,	0
Uh so there is this combination, yeah. Working on combination obviously.	0
Um, I will start work on multi-band.	0
plan to work also on the idea of using both	1
we could reduce the number of outputs of the neural network.	0
because we still have the features.	0
different kind of  broad phonetic categories.	1
Basically we have three  types of broad phonetic classes.	1
Well, something using place of articulation which which leads to  nine, I think,  broad classes.	1
Uh, another which is based on manner, which is is also something like nine classes.	0
And then,  something that combine both,	0
and we have  twenty f-  twenty-five?	0
So like, uh,  oh, I don't know,	0
like back vowels, front vowels.	0
So what you do -	0
um I just wanna understand so	0
You have  two  net or  three  nets?  Was this?	0
How many how many nets do you have?	0
For the moments we do not don't have nets, I mean,	0
Begin to work in this.	0
Were we just changing  the labels to retrain nets  with fewer out- outputs.	0
But but I didn't understand -	0
the software currently just has uh a allows for I think, the one one hot	0
output. So you're having multiple nets and combining them,  or ?	0
Uh, how are you how are you coming up with -	0
If you say  uh  If you have a  place   characteristic and a  manner  characteristic, how do you -	0
I think they have one output.	0
It's the single net, yeah.	0
Oh, it's just one net.	0
um  twenty-seven outputs if we have twenty-seven classes, yeah.	0
So it's Well, it's basically a standard net with fewer  classes.	1
So you're sort of going the  other  way of what you were saying a bit ago instead of yeah.	0
Yeah, but I think Yeah.	0
I don't think this  will work  alone.	0
I think it will get worse because	1
Well, I believe the effect that of of too	1
reducing too much the information is	1
basically basically what happens and -	1
But you think if you include that	1
Yeah, because  there is perhaps one important thing that the net	0
brings, and O_G_I  show-   showed  that, is	0
the distinction between  sp- speech and  silence	0
Because these nets are trained on well-controlled condition. I mean the labels are obtained on clean speech, and we add noise after.	0
So this is one thing	0
But perhaps, something intermediary using also	0
some broad classes could could bring so much more information.	0
So so again then we have these broad classes	0
well,  somewhat  broad. I mean, it's twenty-seven instead of sixty-four,	0
And you have the  original  features.	0
Which are P_L_P, or something.	0
And then uh, just to remind me, all of that goes  into -	1
uh, that all of that is transformed by uh, uh, K_- K_L or something, or ?	1
There will probably be, yeah, one single K_L to transform everything or	1
No transform the P_L_P and only	0
This is  still something  that yeah, we  don't know -	0
Well no, I think -	0
So there's a question of whether you would -	1
Whether you would transform  together  or just  one.	1
Might wanna try it both ways.	1
So that's something that you're you  haven't  trained yet but are  preparing  to train, and -	0
Yeah, so I think Hynek will be here Monday.	1
So I think, you know, we need to	1
choose the choose the experiments carefully,	1
so we can get uh key -	1
leave other ones  aside  even if it	0
leaves incomplete  tables   someplace, uh	0
uh, it's it's really time to -	0
Um, let me pass this out,	0
did I interrupt you? Were there other things that you wanted to -	0
Uh, no. I don't think so.	0
O_K, we have  lots of them.	0
So they're they're doing  the the V_A_D  I guess they mean	1
So again, it's the silence -	1
So they've just trained up a net	1
which has two outputs, I believe.	0
I asked uh  Hynek whether -	0
I haven't talked to Sunil I asked Hynek whether	0
just taking the nets we already  had   and summing up the probabilities.	0
To get the speech -	0
voice activity detection, or else just using the silence,	0
if there's only  one   silence output.	0
Um  And, he didn't think they  had,  um.	0
But on the other hand, maybe they can get by with a smaller net	0
and  maybe  sometimes you don't  run  the other, maybe there's a  computational  advantage to having a separate net, anyway.	0
the  results  look pretty  good.	1
Um,  I mean, not  uniformly.	0
I mean, there's a an example or two  that you can find, where it made it slightly worse, but	0
uh in in  all  but a  couple	0
But they have a question of the result. Um how are  trained  the the L_D_A filter?	0
How  obtained  the L_D_A filter?	0
I- I'm sorry. I don't understand your question.	0
Yes, um the L_D_A filter	0
I don't know exactly  how   they are obtained.	0
Training, with the training test of each -	0
need a set of -	0
a set of training  to obtain the filter.	0
And maybe  for the Italian, for the  T_D    T_E  on for Finnish, these filter are are obtained with their own training set.	0
That's that's so that's a -	0
that's a very good question, then -	0
"yeah, where does the L_D_A come from?" In the -	0
In   earlier  experiments, they had taken L_D_A	0
from a  completely  different  database,  right?	0
Yeah, because maybe it the same situation that the neural network training with their own	0
So that's a good question.   Where  does it come from?	0
but uh to tell you the  truth, I wasn't actually looking at the L_D_A so much when I I was looking at it I was  mostly thinking about the  the V_A_D.	0
Oh what does what does A_S_P?	0
I don't understand also what is -	0
what is the  difference  between A_S_P and uh baseline  over ?	0
Cuz there's "baseline  Aurora "   above  it.	0
This is  mostly  better than baseline, although in some cases it's a little worse, in a couple cases.	0
Well, it says baseline A_S_P is twenty-three mill	0
Yeah, it  says  what it  is.  But I don't how that's different  from -	0
I think this was -	0
I think this is the same point we were at	0
when when we were up in Oregon.	0
I think it's the C_zero using C_zero instead of log energy. Yeah, it's  this.	0
It should be that, yeah.	0
they say in here that the V_A_D is  not  used as an additional feature. Does does anybody know  how  they're using it?	0
Yeah.  So so what they're doing here is,	0
i- if you look down at the block diagram,	0
they estimate they get a -	0
they get an estimate  of whether it's speech or silence,	0
and then they have a median  filter  of it.	0
basically they're trying to find  stretches.	0
The median filter is enforcing a i- it having some  continuity.	0
You find  stretches  where the  combination of the  frame wise V_A_D and the -	0
the median  filter  say that there's a stretch of  silence.	0
And then it's going through and just throwing the  data  away.	0
I don't understand. You mean it's throwing out frames?	0
It's throwing out chunks of frames, yeah.	0
There's the the median filter is enforcing that it's  not  gonna be single cases of frames, or isolated frames.	0
So it's throwing out frames	0
and the thing is  um,	0
what I don't understand is how they're doing this with H_T_ K.	0
Yeah, that's what I was just gonna ask. How can you just throw out frames?	0
you you  can,  right? I mean y- you you -	0
it  stretches  again. For single frames I think it would be pretty  hard.  But if you say speech starts here, speech ends there.  Right?	0
Yeah, you can basically remove the the frames from the feature feature files. And.	0
Yeah, so I mean in the i- i- in the in the  decoding,  you're saying that we're gonna decode from here to here.	0
I think they're they're they're treating it,	0
you know, like uh -	0
well, it's not isolated word, but but connected, you know, the the -	0
In the text they say that this this is a  tentative  block diagram of a  possible  configuration we could  think  of.	0
So that sort of sounds like they're not  doing  that yet.	0
Well.  No they they have  numbers  though, right?  So I think they're they're doing something like that. I think that they're they're -	0
I think what I mean by tha- that is they're trying to come up with a block diagram that's plausible for the standard.	0
In other words, it's uh -	0
I mean from the point of view of of uh reducing the number of bits you have to transmit it's not a bad idea to detect silence  anyway.	0
I'm just wondering what exactly  did  they do up in  this  table if it wasn't this.	0
But it's the thing is it's that that that's that's I I -	0
Certainly it would be tricky about it intrans- in transmitting  voice,	0
uh uh for  listening  to, is that these kinds of things	0
uh cut  speech  off  a lot. Right?	0
Plus it's gonna introduce delays.	0
It  does  introduce delays but they're claiming that it's it's within the -	0
And the L_D_A introduces delays, and b-  what he's suggesting this here is a parallel path so that it doesn't introduce	0
I- it introduces two hundred milliseconds of delay but at the same  time the L_D_A  down here -	0
I  don't know  Wh- what's the difference between  T_L_D_A  and  S_L_D_A ?	0
Yeah, you  would  know that.	0
The  temporal  L_D_A does in fact include the same -	0
by saying this is a b- a tentative block di- diagram I think means	0
if you construct it this way, this this delay would work in that way and then it'd be O_K.	0
They they clearly  did  actually  remove    silent  sections in order because they	0
got these   word  error rate  results.	0
I think that it's it's  nice  to do that in this because in fact, it's gonna give a better word error result	1
and therefore will help within an evaluation.	1
Whereas to whether this would actually be in a final standard, I don't know.	1
Uh, as you know,  part  of the problem with evaluation right now is that the  word models are pretty bad and nobody wants -	1
has has approached improving them.	1
So  it's possible that a lot of the problems	0
with so many insertions and so forth would go away if they were better word models  to begin with.	0
this might just be a temporary thing. But -	0
But, on the  other  hand, and maybe maybe it's a decent idea.	0
The question we're gonna wanna go  through next week when Hynek shows up I guess is given that we've been -	1
if you look at what we've been trying,	1
uh, by  then  I guess,	1
combinations of features and multi-band	1
Uh, and we've been looking at  cross-language, cross  task  issues.	1
And they've been not so much looking at	0
the cross task uh multiple language issues.	0
But they've been looking at uh  at these issues. At the	1
on-line normalization and the uh	1
And I guess when he comes here we're gonna have to start deciding about	1
um what do we choose	1
from what we've looked at	1
to um blend with  some group of things in what they've looked at	1
And once we  choose  that,	1
how do we split up the  effort?	1
Uh, because we still have even once we  choose,	0
we've still got  uh another	0
month or so, I mean there's holidays in the way,	0
I  think  the evaluation data comes January thirty- first  so there's still a fair amount of time	0
to  do  things together it's just that they probably should be somewhat more  coherent  between the two  sites	0
in that that amount of time.	0
When they removed the silence frames, did they insert some kind of a marker so that the recognizer knows it's  knows when it's time to back trace or something?	0
Well, see they, I I think they're	0
I don't know the -	0
the specifics of how they're doing it. They're -	0
they're getting around the way the recognizer works because they're not allowed to	0
Maybe they're just inserting some nummy frames or something?	0
Uh, you know  that's  what  I  had thought.	0
But I don't I don't think they  are.	0
I mean that's sort of what the way  I  had imagined would  happen  is that on the other side, yeah you	0
p- put some low level noise or something.	0
Probably don't want all zeros. Most recognizers don't like zeros but	0
put some epsilon in or some rand- sorry epsilon random variable	0
Maybe not a constant but it doesn't, uh don't like to divide by the variance of that,	0
That's right. But something that what I mean is something that is  very distinguishable from  speech.	0
So that the the  silence  model in H_T_K will always pick it up.	0
Yeah. So I I that's what I thought they would do.	0
or else, uh  uh maybe there  is  some indicator to tell it to start and stop, I don't know.	0
But  whatever  they did, I mean they have to play within the rules of this specific evaluation.	0
We c- we can find out.	0
Cuz you gotta do  something.   Otherwise,  if it's just a bunch of  speech,   stuck   together  -	0
It would do  badly  and it didn't so  badly,  right? So  they  did  something.	0
So, O_K, So I think	0
this brings  me  up to date a bit.	0
It hopefully brings other  people up to date a bit.	0
Uh, I wanna look at these numbers off-line a little bit and think about it and  and talk with everybody uh,  outside of this meeting.	0
No I mean it sounds like I mean	0
there there there are the usual number of of	0
little little problems and bugs and so forth but it sounds like they're getting ironed out.	0
seem to be kind of in a position to actually  uh,	0
look  at stuff and and and  compare  things.	0
So I think that's that's pretty good.	0
I don't know what the -	0
One of the things I wonder about,	0
coming back to the first results you talked about, is is	0
how much,  uh  things could be helped	0
And uh how many more parameters we can afford to  have,	0
in terms of the uh computational limits.	0
Because  anyway  when we go to	0
and have the  same  number of  parameters,	0
particularly when it's twice as much data  and  it's quite  diverse,	0
um, I wonder if having twice as many parameters would  help.	0
Uh, just have a bigger hidden  layer.	0
I  doubt  it would  help by forty per  cent.	0
How are we doing on the	0
I think we're alright, um,  not much problems with that.	0
Well this table took uh  more than five days to  get   back .	0
Are were you folks using Gin?  That's a that just died, you know?	0
Mmm, no. You were using Gin  perhaps, yeah?  No.	0
No? Oh, that's good. O_K.	0
we're gonna get a replacement	0
server that'll be a faster server,	0
actually. That'll be It's a	0
seven hundred fifty megahertz uh SUN	0
But it won't be installed for  a little while.	0
Do we have that big new I_B_M machine the, I think in th-	0
We have the  little tiny I_B_M machine	1
that might someday grow up to be a big  I_B_M machine.	1
It's got s- slots for eight,	1
uh I_B_M was donating  five,  I think we only got  two  so far,	1
We had originally hoped we were getting eight hundred megahertz processors. They ended up being five fifty.	0
So instead of having eight processors that were eight hundred megahertz, we ended up with two  that are five hundred and fifty megahertz.	0
And more are supposed to come soon and there's only a moderate amount of dat- of memory. So I don't think	0
anybody has been sufficiently excited by it to	0
uh  with it, but uh	0
Hopefully,  they'll get us some more	0
Uh, yeah, I think that'll be once we get it populated,	0
that'll be a nice  machine.  I mean we  will  ultimately get eight processors in there.	0
And uh and uh a nice amount of memory. Uh so it'll be a pr- pretty fast Linux machine.	0
And if we can do things on Linux,  some of the machines we have going already, like Swede?	0
I think Fudge is pretty fast too.	0
Yeah, I mean you can  check  with uh  Dave  Johnson.  I mean, it it's -	1
I  think  the machine is just  sitting  there.	0
And it  does  have two  processors,  you know and -	1
you know, uh, check out	1
uh the multi-threading  libraries. And	1
I mean i- it's possible that the -	1
I mean, I guess the  prudent  thing to do would be for somebody to do the work on -	1
on getting our code running	1
on that machine with  two  processors  even though there  aren't  five or eight.	1
There's there's there's gonna be  debugging  hassles	1
and then we'd be set for when we  did  have five or eight, to have it really be useful.	1
Notice how I said somebody and	1
turned my head your direction. That's one thing you don't get in these recordings. You don't get the -	1
don't get the visuals but -	0
I- is it um  mostly um the neural network trainings that are  um slowing us down or the H_T_K runs that are slowing us down?	0
Isn't that right? I mean I think you're you're sort of held up by both, right?	0
If the if the neural net trainings were a hundred times faster	0
you still wouldn't  be anything -	0
running through these a hundred times faster because you'd	0
be stuck by the H_T_K trainings, right?	0
But if the H_T_K I mean I think they're both -	0
It sounded like they were roughly equal?	0
Because, um  I  think  that'll be running Linux, and Sw- Swede and Fudge are already running Linux so,  um I could try to	1
get  um the train- the neural network trainings or the H_T_K stuff running under Linux, and to start with I'm  wondering which one I should pick first.	1
Uh, probably the neural net cuz it's probably it it's -	1
Well, I I don't know.	0
It's not  clear  yet what we're gonna use	0
there's the trainings uh is it the  training  that takes the time, or the  decoding?	0
Uh, is it about equal  between the two?	0
For Yeah. For the Aurora?	0
Well, I don't know how we can -	0
I don't know how to -	0
Do we have H_T_K source? Is that -	0
You would  think  that would fairly trivially -	0
the  training  would,  anyway,  th- the  testing	0
uh I don't I don't	0
But I think  that  you could	0
distributed, sort of  Ah, no, it's the -	0
is pretty tricky to parallelize.	0
But you could split up the sentences in a test set.	0
They  have  a they have a thing for  doing  that and th- they have for  awhile,  in H_T_ K.	0
And you can parallelize the training.	0
And run it on several machines and it just basically keeps counts.	0
a final  thing that you run and it accumulates all the counts together.	0
I don't what their scripts are  set up to do for the  Aurora  stuff, but -	0
Something that we haven't really settled on yet is other than	0
this  Aurora  stuff,  uh what do we do, large vocabulary	0
Cuz we hadn't really  done  much with tandem systems for larger stuff.	0
Cuz we had this one collaboration with C_M_U and we used SPHINX.	0
Uh, we're also gonna be collaborating with S_R_I and we have their have  theirs.	0
So I I think the the advantage of going with the neural net thing is that we're gonna use the neural net trainings,	0
for a lot of the things we're doing,	0
H_M_M Gaussian-mixture-based H_M_M thing we use is gonna depend	0
And, it's about eleven fifty.	0
Uh, I can I can start over here.	0
Great, uh, could you give Adam a call. Tell him to	0
He's at two nine seven seven.	0
O_K.  I think we can	0
@@  You know Herve's coming tomorrow, right?	0
Herve will be giving a talk, yeah, talk at eleven.	0
Hey Adam, this is Barry.	0
Did uh, did everybody sign these consent	0
Has everyone signed a consent form before, on previous meetings? You don't have to do it again each time	0
