O_K, that's it for spectral subtraction. The second thing I was working on is to, um,	1
try to look at noise estimation,	1
mmm, and using some technique that doesn't need voice activity detection.	1
Um, and for this I u- simply used some code that, uh,  I had from from Belgium,	1
which is technique that, um, takes a bunch of frame, um, and for each frequency bands of this frame, takes a look at the minima	1
And then average these minima and take this as an an energy estimate of the noise for this particular frequency band.	1
And there is something more to this actually. What is done is that,  uh, these minima are computed, um, based on, um,	0
high resolution spectra. So, I compute an F_F_T based on the long, uh, signal frame which is sixty-four millisecond -	0
So you have one minimum for each frequency?	0
What what I what I d- uh, I do actually, is to take a bunch of to take a tile on the spectrogram and this tile is five hundred milliseconds long and two hundred hertz wide.	0
Uh, in this tile appears, like, the harmonics if you have a voiced sound, because it's it's the F_T_T bins. And when you take the m- the minima of of these this tile,	0
when you don't have speech, these minima will give you some noise level estimate,	0
If you have voiced speech, these minima will  still  give you some noise estimate because	0
the minima are between the harmonics.	0
And If you have other other kind of speech sounds then it's not the case, but if the time frame is long enough,	0
uh, like s- five hundred milliseconds seems to be long enough,  you still have portions which, uh, are very close whi- which minima are very close to the noise energy.	0
I'm confused. You said five hundred milliseconds but you said sixty-four milliseconds. Which is which? What?	0
Sixty-four milliseconds is to compute the F_F_T, uh, bins. The the F_F_T.	0
Um, actually it's better to use sixty-four milliseconds because, um, if you use thirty milliseconds, then, uh, because of the this short windowing and at low pitch,	0
uh, sounds,  the harmonics are not, wha- uh, correctly separated.	0
So if you take these minima, it -	0
they will overestimate the noise a lot.	0
So you take sixty-four millisecond F_F_Ts and then you average them  over five hundred? Or ?	0
Uh, what do you do over five hundred?	0
So I take to I take a bunch of these sixty-four millisecond frame to cover five hundred milliseconds,	0
and then I look for the minima,	0
on the on on the bunch of uh fifty frames, right?	0
So the interest of this is that, as y- with this technique you can estimate u-	0
some reasonable noise spectra with only five hundred milliseconds of -	0
of signal,  so if the the n- the noise varies a lot, uh, you can track better track the noise,	0
which is not the case if you rely on the voice activity detector. So even if there are no- no speech pauses, you can track the noise level.	0
The only requirement is that you must have, in these five hundred milliseconds segment,  you must have  voiced  sound at least.	0
Cuz this these will help you to to track the the noise level.	0
Um. So what I did is just to simply replace the V_A_D-based, uh, noise estimate by this estimate,	0
first on SpeechDat-Car Well,  only  on SpeechDat-Car actually. And it's, uh, slightly worse, like one percent relative compared to the V_A_D-based  estimates.	0
I think the reason why it's not better, is that the SpeechDat-Car noises are all stationary.	0
y- y- there really is no need to have something that's adaptive and Uh, well, they are mainly stationary. Um.	0
But, I expect s- maybe some improvement on T_I-digits because, nnn, in this case the noises are all sometimes very variable.	0
Uh, so I have to test it. Mmm.	0
But are you comparing with something e- I'm I'm p- s- a little confused again, i- it -	0
Uh, when you compare it with the V_A_ D-based,	0
which  V_A_D- Is this is this the ?	0
It's the France-Telecom-based spectra, s- uh, Wiener filtering and V_A_D. So it's their system but just I replace their noise estimate by  this  one.	0
Oh, you're not doing this with  our  system?	0
In i- I'm not No, no.	0
Yeah, it's  our   system  but with just the Wiener filtering from  their  system.	0
Actually, th- the best system that we still have is,	0
uh, our system but with their noise compensation scheme, right?	0
So I'm trying to improve on this, and by by replacing their noise estimate by, uh, something that might be better.	0
O_K. But the spectral subtraction scheme that you reported on also re- requires a a noise estimate.	1
Couldn't you try this for that? Do you think it might help?	1
Not yet, because I did this in parallel, and I was working on one and the other. Um,	0
Yeah, for for sure I will. I can try also, mmm, the spectral subtraction.	1
So I'm also using that	0
n- new noise estimate technique on this Wiener filtering what  I'm  trying.	0
So I I have, like, some experiments running, I don't have the results.	0
So. I don't estimate the f- noise on the ten frames but use  his  estimate.	0
Yeah. I, um, also implemented a sp- um -	0
spectral whitening idea which is in the, um, Ericsson proposal.	0
Uh, the idea is just to	0
um, and to flatten it more if the the probability of silence is higher.	0
So in this way, you can also reduce somewhat reduce the musical noise and you reduce the variability if you have different noise shapes, because	0
the the spectrum becomes more flat in the silence portions. Um.	0
With this, no improvement,  uh, but there are a lot of parameters that we can play with  and,	0
um Actually, this this could be seen as a soft version of the frame dropping because,	0
um, you could just put the threshold and say that "below the threshold,	0
I will flatten comp- completely flatten the the spectrum". And above this threshold,	0
uh, keep the same spectrum.	0
So it would be like frame dropping, because during the silence portions which are below the threshold of voice activity probability,	0
uh, w- you would have some kind of dummy frame which is a perfectly flat spectrum.	0
And this, uh, whitening is something that's more soft because,	0
you whiten you just, uh, have a function the whitening is a function of the speech probability, so it's not a hard decision.	0
Um, so I think maybe it can be used together with frame dropping and	0
when   we are not sure about if it's speech or silence, well,	0
It's interesting. I mean, um, you know, in -	0
maybe it has something do with this.	0
in  J_RASTA  we were essentially adding in, uh, white uh, white noise dependent on our estimate of the noise.	0
On the overall estimate of the noise.  Uh, I think it never occurred to us to use a  probability  in there.	0
You could  imagine  one that that that made use of where -	0
where the amount that you added in was,	0
uh, a function of the probability of it being s- speech or noise.	0
Yeah, right now it's a constant that just depending on the -	0
Cuz that that brings in	0
sort of powers of classifiers that we don't really have in, uh, this other estimate. So it could be it could be interesting.	0
What what what point does the, uh, system stop recording? How much -	0
It'll keep going till -	0
It went a little long?	0
I guess when they run out of  disk  space, but -	0
Yeah, so there are with this technique there are some -	0
I just did something exactly the same as -	0
as the Ericsson proposal but, um,  the probability of speech is not computed the same way. And	0
I think, i- for yeah, for a lot of things, actually a g- a good	0
speech probability is important. Like for frame dropping you improve, like -	0
you can improve from ten percent as Sunil showed, if you use the channel zero speech probabilities. For this it might help, um -	0
Uh, so yeah, the next thing I started to do is to,  uh, try to develop a better voice activity detector. And, um -	0
I d- um yeah, for this I think we can maybe try to train the neural network for voice activity detection on all the data that we have, including all the SpeechDat-Car data. Um -	0
And so I'm starting to obtain alignments on these databases.	0
Um, and the way I mi- I do that is that I just use the H_T_K system but I train it only on the close-talking microphone.	0
And then I aligned I obtained the Viterbi alignment of the training utterances.	0
It seems to be, uh i-	0
Actually what I observed is that for Italian it doesn't seem -	0
Th- there seems to be a problem. Well. Because -	0
So, it doesn't seems to help by  their  use of channel zero or channel one.	0
Uh, you mean their d- the frame dropping, right?	0
Yeah. So, u- but actually the V_A_D was trained on  Italian  also, so -	0
Um, the c- the current V_A_D that we have was trained on, uh, t- SPINE, right? Italian, and T_I-digits with noise and -	0
Uh, yeah. And it seems to work on Italian but not on the Finnish and Spanish data.	0
So, maybe one reason is that s- s- Finnish and Spanish noise are different. And	0
actually we observed we listened to some of the utterances and sometimes for Finnish there is music in the recordings and strange things, right?	0
Um Yeah, so the idea was to train all the databases and obtain an alignment	0
to train on these databases, and, um, also to, um, try different kind of features,  uh, as input to the V_A_D network.	0
And we came up with a bunch of features that we want to try like, um,	0
the spectral slope, the, um, the  degree   o- degree of voicing with the features that, uh, we started to develop with Carmen,	0
um, e- with, uh, the correlation between bands	0
and different kind of features, and Yeah.	0
The energy. Yeah. Of course.	0
O_K. Well, Hans-Guenter will be here next week so I think he'll be interested in all  all  of these things. And, so.	0
O_K, shall we, uh, do digits?	0
Want to go ahead, Morgan?	0
