Wh- what causes the crash?	0
Oh, maybe it's the turning turning off and turning on of the mike, right?	0
Uh, you think that's  you?	0
O_K. So, um I guess we are	0
um  gonna do the digits at the end.	0
Channel channel three, yeah. O_K.	0
Yeah,  that's  the  mike  number  there,	0
Is it written on her  sheet,  I believe.	0
Watch this.   Yep, that's me.	0
Ah,   era el cuatro.   Yeah.	0
And I'm channel uh  two  I think,  or channel -	0
I think  I'm  channel two.	0
Oh, I'm channel must be channel one. Channel one?  Yes, O_K.	0
I also copied uh the results that we all got in the mail I think from uh -	0
from O_G_I and we'll go go through them also.	0
So where are we on -	1
Uh so.  uh We So  As I was already said, we we mainly focused on	1
uh four kind of features. The P_L_P, the P_L_P with J_RASTA, the M_S_G, and the M_F_C_C from the baseline Aurora.	1
I decided to talk about that.	0
Uh, and we focused for the the test part on the English and the Italian.	1
Um. We've trained uh several neural networks on so on the T_I-digits English  and on the Italian data and also on the broad uh  English uh French and uh Spanish databases.	1
Mmm, so there's our result tables here, for the tandem approach, and um, actually what we we  @@  observed is that if the network is trained on the task data it works pretty well.	1
I can't get  back  far enough.	0
O_K. Our our uh -	0
There's a  We're pausing for a photo -	0
How about over th- from the front of the room?	0
We're pausing for a photo opportunity here. Uh.	0
Oh wait wait wait wait wait. Wait. Hold on. Hold on. Let me give you a black screen.	0
Get out of the Yeah.	0
Because we  said  we were gonna  do  this and I  just  remembered.	0
O_K, this this would be a  good section for our silence detection.	0
about the training data -	0
Yeah, so if the network is trained on the task data um  tandem works pretty well. And uh actually we have uh, results are similar	0
Do you mean if it's trained  only  on -	0
On data from just that task, that language?	0
But actually we didn't train network on  uh both types of data I mean	1
uh  phonetically ba- phonetically balanced uh data and task data.	0
We only did  either  task task data or  uh broad  data.	1
So how I mean -	0
clearly it's gonna be  good  then but the question is how much  worse is it	0
if you have  broad  data?	0
From what I saw from the earlier results, uh I guess last week,	0
if you   trained  on one language and  tested  on another, say, that	0
the results were were relatively  poor.	0
But but the question is if you  train  on one language	0
but you have a  broad  coverage	0
and then test in another,	0
does that  is that  improve  things	0
If we use the same language?	0
If you train on T_I-digits  and test on  Italian  digits,  you do poorly,	0
I don't have the  numbers  in front of me, so I'm just  imagining.	0
Yeah but I did not uh do that. We -	0
So, you didn't train on  TIMIT and test on  on Italian digits, say?	0
No, we did four four kind of of testing, actually.	0
The first testing is  with task data -	1
So, with nets trained on task data.	0
So for Italian on the Italian speech  @@ .	0
The second test is trained on a single language	1
um with broad  database,  but the same language as the t- task data.	1
But for Italian we choose Spanish which  we assume is close to Italian.	1
The third test is by using, um	1
W- which in It has three languages. That's including the w-	1
the one that it's -	1
digits.  I mean it's -	0
is  not  digits, it's the broad	1
And the fourth test is uh  excluding from these three languages the language  that is  the task language.	1
Oh, O_K, yeah, so, that  is  what I wanted to know.	0
I just wasn't  saying  it very well, I guess.	0
So um  for uh T_I-digits for ins- example  uh when we go from T_I-digits training to  TIMIT training  uh we lose  uh around ten percent, uh.	1
The error rate increase u- of of -	1
So this is not so bad. And then when we jump to the multilingual data it's uh it become worse and, well	1
Around uh, let's say,  twenty perc- twenty percent further.  So.  Yeah.	0
Twenty to to thirty percent further. Yeah.	1
And so, remind me, the  multilingual  stuff is  just  the broad data. Right?	0
It's not the digits. So it's the combination of  two things there.	0
It's  removing the  task specific  training and  it's adding other languages.	0
But the first step is al- already removing the task s- specific from from -	0
So. And we lose -	0
So they were sort of  building   here? O_K?	0
Uh  So, basically when it's  trained  on the the multilingual broad data	0
um or number so, the the  ratio of our error rates uh with the  baseline error rate is around  uh one point one.	0
And it's something like one point  three  of of the	0
I- i- if you compare everything to the first case at the baseline,	0
you get something like one point one	0
for the for the using the same language but a different task, and something like one point three	0
Uh same language we are at uh for at English at O_ point eight.	0
I I I'm sorry. I I I meant something different by baseline	0
Tas- task data we are u-	0
So let me let me -	0
O_K, fine. Let's let's use the conventional meaning of baseline. I I -	0
By baseline here I meant	0
uh using the task specific data.	0
uh, because that's what you were just doing with this ten percent.	0
So I was just I just trying to understand  that.  So if we call	0
a factor of w- just  one,	0
just normalized to  one,  the word error rate	0
that you have  for using T_I-digits as as	0
training  and T_I-digits as  test,	0
uh different  words,  I'm sure, but -	0
but uh, uh the same  task and so on.	0
If we call that "one",  then what you're saying is	0
that the word error rate  for the same language but using  uh  different  training data than you're testing on, say TIMIT and so forth,	0
Yeah, it's around one point one. Yeah.	0
three languages  including  the English,	0
it's something like one point  three.	0
That's  what you were just  saying,  I think.	0
Uh,  more  actually. If I -	0
So, it's an  additional  thirty percent.	0
What would you say?  Around one point four yeah.	0
And if you  exclude   English,	0
from this combination, what's  that?	0
If we  exclude   English,   um  there is  not much difference with the  data  with  English.	0
Do you see? Because -	0
No, that that's important. So what what it's saying here is just that "yes, there is a reduction	0
when you don't have  um	0
Wait a minute, th- th- the -	0
No, actually  it's  interesting.  So it's -	0
So when you go to a different  task,  there's actually not so  different. It's when you went to these -	0
So what's the difference between two and three?	0
Between the one point one case and the one point four case? I'm confused.	0
Yeah. The only difference it's is that it's multilingual -	0
Cuz in both in both  both  of those cases, you don't have the same  task.	0
So is is the training data for the for this one point four case -	0
does it  include  the training data for the one point one case?	0
Yeah, a fraction of it.	0
A part of it, yeah.	0
How m- how much bigger is it?	0
It's two times, actually? Yeah.	0
No, the  multilingual  databases are two times the  broad English  data.	0
We just wanted to keep this, w- well, not too  huge.  So.	0
but it  includes  the but it  includes  the broad English data.	0
I think so.  Do you  -	0
And the broad English data is what you got this one point one  with. So that's TIMIT basically right?	0
So you have band-limited TIMIT,  gave you uh	0
almost  as good as a result as using T_I- digits	0
when you add in more training data but keep the neural net the same size,	0
it  um performs worse on the T_I-digits.	0
O_K, now all of this is -	0
This is  noisy   T_I-digits, I assume?	0
We we we may just need to uh -	0
So I mean it's interesting that h- going to a different -	0
different  task  didn't seem to  hurt  us that much, and going to a different  language	0
It doesn't seem to matter -	0
The difference between  three  and  four  is not particularly great, so that means that	0
whether you have the  language  in or  not  is not such a big deal.	0
we  may  need to have more	0
of uh things that are similar to a target language or I mean.	0
You have the  same  number of parameters in the  neural  net, you haven't increased the size of the neural net,	0
and maybe there's just -	0
complexity to it to represent	0
the variab- increased variability in the -	0
So  these  are results with	0
that you're describing now, that	0
they are pretty similar for the different features or -	0
Uh, let me check. Uh.	0
So. This was for the P_L_P,	1
Um. The Yeah. For the P_L_P with J_RASTA the -	1
This is quite the same  tendency,	1
with a slight increase of the error rate,	1
uh if we go to to TIMIT.	1
And then it's it gets worse with the multilingual.	1
Yeah. There there is a difference actually with b- between P_L_P and J_RASTA is that	1
J_RASTA  seems to  perform better with the highly mismatched  condition	1
but  slightly   slightly worse  for the well matched condition.	1
I have a suggestion, actually, even though it'll delay us slightly, would would you mind	0
running into the other room and making	0
copies of this?  Cuz we're all sort of -	0
If we c- if we could look at it, while we're talking, I think  it 'd be uh -	0
Uh, I'll I'll sing a song or dance or something while you  do it, too.	0
So um Go ahead. Ah, while you're gone I'll ask s- some of my questions.	0
this way and just slightly to the left, yeah.	0
What was Was this number  forty or It was roughly the same as this one,  he said?  When you had the  two  language versus the  three  language?	0
That's what he was  saying.	0
That's where he removed English, right?	0
It sometimes, actually, depends on what features you're using.	0
But but i- it sounds like -	0
I mean.  That's  interesting because	0
it it  seems  like what it's saying is  not  so much that you got  hurt	0
uh didn't have so much representation of  English,	0
because in the  other  case you don't get hurt  any   more,   at least when	0
it seemed like uh it it might simply be a case that you  have  something that is just much more  diverse,	0
but you have the same number of parameters  representing  it.	0
Mm-hmm.  I wonder were um all three of these nets  using the same output? This  multi-language    uh labeling?	0
He was using uh sixty-four phonemes from  SAMPA.	0
From  this  you would say, "well, it doesn't really  matter  if we put Finnish	0
into  the training of the neural net,	0
you know, Finnish in the test data." Right?	0
Well, it's it sounds -	0
I mean, we have to be  careful,  cuz we haven't gotten a  good  result yet.	0
And comparing different  bad  results can be  tricky.	0
But I I I -	0
I think it  does  suggest that it's not so much uh	0
uh cross   language  as cross  type  of  speech.	0
But we  did  Oh yeah, the other thing I was  asking  him, though, is that I  think  that in the case -	0
Yeah, you you  do  have to be careful because of com- compounded results. I think we got some earlier results	0
in which you  trained  on one language and  tested  on  another  and you didn't have	0
three,  but you just had  one   language. So you trained on	0
one type of digits and  tested  on  another.  Didn-	0
Wasn't there something of that? Where you,	0
say, trained on Spanish and tested on on T_I-digits, or the other way around?	0
I thought there was  something  like that,	0
that he showed me  last week.	0
We'll have to wait till we get -	0
Yeah, that would be interesting.	0
This  may  have been what I was asking before, Stephane, but -	0
but, um, wasn't there  something  that you did,	0
where you  trained   on  one  language and  tested  on  another?	0
I mean no no  mixture  but just -	0
I'll get it for you.	0
We've never just trained on one lang-	0
Training on a  single  language, you mean, and  testing  on the  other  one?	0
So the only  task that's similar to this is the training on  two  languages, and	0
But we've  done  a bunch of things where we just trained on one  language.  Right?	0
I mean, you haven't you haven't done  all  your tests on multiple  languages.	0
Either thi- this is test with  uh the  same  language  but from the  broad  data, or it's test with  uh  different  languages	0
also  from the broad data,  excluding  the -	0
The  early  experiment that -	0
So, it's it's three or three and four.	0
Did you do different languages from digits?	0
on one language and using the net	0
to recognize on the other?	0
See, I  thought  you  showed  me something like that last  week.	0
You had a you had a little -	0
No, I don't  think  so.	0
So, I mean wha- what's the This this chart this table that we're looking at  is um,	0
show- is all  testing  for  T_I -digits, or ?	0
Bigger is worse.  This is error rate, I think.	0
So you have uh basically two  uh parts. The upper part is for T_I-digits	0
and it's divided in three  rows  of four four rows each.	0
And the first four rows is well-matched, then the s- the second group of four rows is mismatched, and	0
And then the lower part is for Italian and it's the same -	0
So, so the upper part is  training   T_I-digits?	0
It's it's the H_T_K results, I mean. So it's	0
with different kind of features	0
and what appears in the	0
uh left column is  the networks that are used for doing this.	0
What was is that i-	0
What was it that you had	0
done  last week when you showed Do you remember?	0
Wh- when you showed me  the your table last week?	0
It- It was part of these results.	0
So where is the baseline  for the T_I-digits  located in here?	0
You mean the H_T_K Aurora baseline?	0
It's uh the one hundred number.	0
It's, well, all these numbers are the ratio	0
with respect to the baseline.	0
So this is word word error rate, so a  high  number is  bad.	0
Yeah, this is  a word error rate ratio.	0
seventy point two means that	0
we reduced the error rate uh by thirty thirty percent. So.	0
so if we take uh	0
uh with on-line  normalization and  delta-del- so that's this thing you have circled here	0
and "multi-English" refers to what?	0
Then you have  uh M_F,  M_S and M_E which are for French, Spanish and English.	0
Actually I  I uh forgot to say that  the multilingual net are trained	0
on  uh  features without the s- derivatives	0
uh but with  increased frame numbers. Mmm.	0
And we can we can see on the first line of the table that it it -	0
it's  slightly   slightly worse when we don't use delta but it's not -	0
So, I'm sorry. I missed that. What's M_F, M_S and M_E?	0
So. Multi-French, Multi-Spanish, and Multi-English.	0
Uh O_K. So, it's  uh   broader  vocabulary.	0
O_K so I  think  what I'm -	0
what I saw in your smaller chart that I was thinking of was -	0
there were  some  numbers I saw, I think, that  included  these multiple languages	0
I I think that was all it was. You had some very limited results that at that point	0
which showed  having in these these other languages. In fact it might have been just this last category,	0
where where English was  removed.	0
So that was cross language	0
and the and the result was quite  poor.	0
we  hadn't  seen yet was that if you added  in  the English, it's  still  poor.	0
Um now, what's the noise condition	1
um  of the training data -	1
Well, I think this is what you were explaining. The  noise  condition is the same -	1
It's the same uh Aurora noises	0
uh, in all these cases	0
So there's not a  statistical sta- a strong st-	1
No these are the s- s- s- same noises, yeah.	1
uh the training and test	1
and yet we're seeing  some  kind of effect -	1
At least at least for the first -	1
So there's  some  kind of a a an effect from having these uh this broader coverage	0
Now I  guess  what we should try doing with this is try	0
testing these on u- this same sort of thing on -	0
you probably  must  have this	0
lined  up to  do.  To try the same t-	0
with the  exact  same  training,  do testing on	0
Um, oh I well,  wait  a minute. You  have  this  here,  for the  Italian.   That's  right.  O_K, so,	0
Yeah, so for the Italian the results are  uh  stranger um	1
So what appears is that perhaps Spanish is	1
not very close to Italian	1
when using the the network trained only on Spanish it's -	1
Well, I mean, let's see.	0
Is there any difference in -	0
So it's in  the uh -	0
when you  train  on English	0
and  uh  and and  test  on -	0
No, you  don't  have training on English testing -	0
There there is  another  difference, is that the noise the noises are different. Well,	1
For for the Italian part I mean the	1
networks are trained with noise from  Aurora T_I- digits,  mmm.	1
And the noise is different  in th-	0
And perhaps the noise are	1
quite different from the noises  in the speech that  Italian .	1
Do we have any um	0
uh in  any other language that um	0
have the  same  noise as in  the Aurora?	0
Can I ask something real quick?	0
In in the  upper  part -	0
it  looks  like the  very   best  number is sixty point nine?	0
and that's in the uh -	0
the third  section in the upper part under P_L_P J_RASTA,	0
sort of the middle column?	0
I- is  that   a  noisy  condition?	0
So that's  matched  training? Is  that  what that  is?	0
It's no, the third part, so it's uh  highly mismatched.	0
So. Training and  test noise are different.	0
So why do you get your  best   number	0
Wouldn't you get your  best  number in the  clean  case?	0
Well, it's relative to the	0
Ah, O_K so these are not -	0
And then so, in the in the um -	0
in the   non-mismatched   clean  case,	0
your best one was under M_F_C_C?	0
Yeah.  But it's not a  clean  case. It's  a noisy case but	0
uh training and test noises are the same.	0
Oh! So this upper third?	0
So it's always noisy basically,  and,  well, the -	0
So uh, I think this will take some  looking at, thinking about. But,	0
what is  currently  running, that's -	0
just filling in the holes here or or ?	0
Uh, no we don't plan to fill the holes but	1
actually there is something important,	1
is that  um we made a lot of assumption concerning the on-line normalization	1
uh the  approach that we were using	1
leading to very good results	1
when we  used the straight features to H_T_K.	1
if you look at the at the left of the table,	0
with eighty-six, one hundred, and forty-three and seventy-five,	0
these are the results we obtained for Italian	0
uh with  straight  mmm, P_L_P features	0
And the, mmm what's  in the table, just  at the left of the P_L_P twelve  on-line normalization column,	0
so, the numbers seventy-nine, fifty-four and  uh forty-two	0
are the results obtained by uh Pratibha with  uh his on-line normalization uh  her  on-line normalization approach.	0
Where is that? seventy-nine, fifty	0
Uh, it's just sort of sitting right on the uh the column line.	0
So these are the results of  O_G_I with  on-line normalization and straight features to H_T_K.	0
And the previous result, eighty-six and so on,	0
are with our  features straight to H_T_K. So	1
what we see that is there is that um	1
uh the way we were doing this was not correct, but  still	1
the networks  are very good.	0
When we use the networks	1
our number are better that	1
So, do you know what was  wrong  with the on-line normalization, or ?	0
Yeah. There were diff- there were different things and	1
basically,  the first thing is the mmm,	1
alpha uh  value. So, the recursion  uh  part.	1
I used point five percent,  which was the default value in the -	1
And Pratibha used  five  percent.	1
So it adapts more  quickly	0
Um, but, yeah. I assume that this was not important because	1
uh previous results from from Dan and show that basically	1
the  both both values g- give the same same  uh results.	1
It was true on uh  T_I-digits but it's not true on Italian.	1
Uh, second thing is the initialization of the  stuff. Actually,	1
uh what we were doing is to start the recursion from the beginning of the  utterance.	1
And using initial values that are the global mean and variances  measured across the  whole  database.	1
And Pratibha did something different is that he uh she initialed the um values of the mean and variance	1
by computing  this on the  twenty-five first frames of each utterance.	1
Mmm. There were other minor differences, the fact that	1
she used fifteen  dissities  instead s- instead of thirteen,	0
and that she used C_zero instead of log energy.	0
Uh, but the main differences concerns the recursion.	0
Uh, I changed the code	1
uh and now we have a baseline that's similar to the O_G_I baseline.	1
We It it's  slightly    uh different because	0
I don't exactly initialize the same way she does.	0
mmm, I don't wait to a fifteen twenty-five twenty-five frames	0
before computing a mean and the variance	0
to e- to to start the recursion.	0
I I use the on-line scheme	0
and only start the re- recursion after the twenty-five  twenty-fifth frame.	0
uh I retrained  the networks with  these well, the the the networks are retaining with these new  features.	1
So basically what I expect is that	0
these numbers will a little bit go down but	0
perhaps not not so much	0
because  I think the neural networks learn perhaps	0
even if the features are not  normalized. It it will learn how to normalize and -	0
O_K, but I think that	1
given the pressure of time we probably want to draw -	1
because of  that    especially,  we wanna draw some  conclusions  from this, do some  reductions	1
in what we're  looking  at,	0
and make some  strong  decisions for what we're gonna do  testing  on before next  week.	1
So do you are you w-	0
did you have something going on, on the side, with uh multi-band  or on on this, or ?	0
No, I we plan to start this uh so, act- actually we have discussed uh	1
more as a as a research and -	1
and  we were thinking perhaps that	1
uh  the way we use the tandem is not -	1
Uh, well, there is basically perhaps a flaw in the in the the stuff because	0
we  trained the networks -	1
If we trained the networks on the on	1
a language and a t- or a specific  task,	1
um, what we ask is to the network is to put the bound- the decision boundaries somewhere in the space.	1
And uh  mmm and ask the network to put one,	1
at one side of the for for a particular phoneme at one side of the boundary decision boundary and one for another phoneme at the other side.	1
And  so there is kind of reduction of the information there that's not correct because if we change task	1
and if the phonemes are not in the same context in the new task,	1
obviously the  decision boundaries are not -	1
should not be at the same  place.	1
But the way the feature gives -	1
The the way the network gives the features is that it reduce completely the -	1
it removes completely the information -	1
a lot of information from the the features	1
placing the decision boundaries at  optimal places for	1
one kind of  data  but	1
this is not the case for another kind of data.	0
It's  a  trade-off,  right?  Any-  anyway  go  ahead.	0
Yeah. So uh what we were thinking about is perhaps	1
to solve this problem is increase the number of  outputs of the neural networks.	1
um phonemes within context and,	0
well, basically context dependent phonemes.	1
Maybe. I mean, I I think	0
you could make  the same argument,	0
it'd be just as legitimate,	0
Yeah but, we know that -	0
th- things get  better  with context  dependent    versions.	0
Ye- yeah but here it's something different. We want to have features uh well,	0
Yeah,  but it's  still  true	0
you're you're coming up with something to represent,	0
you're coming up with a set of variables	0
things that vary w- over context.	0
Uh, and you're  putting it all  together,	0
ignoring  the differences in context.	0
it's true for a tandem system.	0
So, for that reason, when you in -	0
in in a  hybrid  system,	0
when you incorporate  context  one way or another,	0
you  do  get better  scores.	0
O_K?  But I it's it's a big  deal	0
I I'm I'm sort of -	0
And  once  you the other thing is that  once  you represent start representing more and more  context	1
to a particular task in  language.	1
the  acoustics   associated  with  uh	0
a particular context, for instance you may have some kinds of contexts that will  never  occur	1
in one language and will occur  frequently  in the  other,  so the qu- the issue of getting enough  training	1
for a particular kind of  context  becomes harder.	1
We already actually don't have a huge amount of training data	1
I mean,  the the way we we do it now is that we have a neural network and	1
the net- network is trained almost to give binary decisions.	1
binary decisions about  phonemes.  Nnn -	0
But I mean it it it  does  give a  distribution.	0
and  it  is  true that if there's two phones that are very  similar,	0
i- it may prefer one but it will	0
give a reasonably high value to the other, too.	0
So basically it's almost binary decisions and	0
um the idea of using more  classes is	0
to  get something that's  less binary decisions.	0
Oh no, but it would  still  be even  more  of a binary decision.	1
It it'd be even  more  of one.	0
Because then you would say	0
that in that this phone in  this  context is a  one,	0
but the  same  phone in a slightly  different  context is a  zero.	0
That would be even even  more  distinct of a binary decision.	1
I  actually would have thought you'd wanna go the  other  way and have  fewer  classes.	1
Uh, I mean for instance,	0
the the thing I was arguing for  before,  but	0
again which I don't think we have time to  try,	0
is something in which you would modify the code so you could train to have several outputs on and use articulatory features	0
cuz then that would that would go -	0
that would be much  broader  and cover many different  situations.	0
But if you go to  very  very  fine  categories, it's  very   binary.	0
Mmm.  Yeah, but I think -	0
Yeah, perhaps you're right, but you have more classes so  you you have more information in your features. So,	0
Um  You have more information in the	0
But still the information is relevant because it's it's information that helps to discriminate,	0
