Uh, the reason was, like, we had this choice of using spectral subtraction, Wiener filtering, and there was one more thing which I- which I'm trying, is this sub space approach. So,	0
Stephane is working on spectral subtraction.	0
So I picked up -	0
So you're sort of trying  @@  them  all.	0
Y- Yeah,  @@  we just wanted to have a few noise production compensation techniques and then pick some from that pick one.	0
I m- I mean yeah, I mean, there's Car- Carmen's working on another, on the vector Taylor series. So they were just kind of trying to cover a bunch of different things	0
VA- Yeah, V_A_D. w- Yeah.	0
Ah, O_K. That makes sense.	0
with this task and see, you know, what are what are the issues for each of them. Um.	0
So so one of one of the things that I tried, like I said, was to remove those zeros in the fri- filter by doing some smoothing of the filter.	0
Like, you estimate the edge of square and then you do a f- smoothing across the frequency so that those zeros get, like, flattened out.	0
And that doesn't seems to be improving by trying it on the first time. So what I did was like I p- did this and then you I plugged in the one more -	0
the  same  thing but with the smoothed filter the  second  time. And that seems to be working.	0
So that's where I got like fifty-six point five percent improvement on SpeechDat-Car with that.	0
So the other thing what I tried was I used still the ten frames of noise estimate but I used this channel zero VAD to  drop  the frames.	0
So I'm not still not estimating. And that has taken the performance to like sixty-seven percent in SpeechDat-Car, which is -	0
which which like sort of  shows  that by using a proper VAD you can just	0
So that's sort of like, you know, best-case performance?	0
Yeah, so far I've seen sixty-seven I mean, no, I  haven't  seen s- like sixty-seven percent.	0
And, uh, using the channel zero VAD to estimate the noise also seems to be improving but I don't have the results for  all  the cases with that.	0
So I used channel zero VAD to estimate noise  as a lesser 2x  frame, which is like,	0
everywhere I use the channel zero V_A_D. And that seems to be the  best  combination, uh, rather than using a few frames to estimate and then drop a channel.	0
So I'm I'm still a little confused. Is that channel zero information going to be accessible during this test.	0
no. This is just to test whether we can really improve by using a better VAD.	0
So, I mean So this is like the noise compensation f- is fixed but you make a better decision on the endpoints.	0
That's, like seems to be -	0
so I mean, which which means, like,	0
by using this technique what we improve just the VAD we can just take the performance by another ten percent or better.	0
So, that that was just the, uh, reason for doing that experiment.	0
Yeah, but this all these things, I have to still try it on the T_I-digits, which is like I'm just running. And there seems to be not improving a -	0
a  lot  on the T_I-digits, so I'm like investigating that,  why  it's not.	0
So, uh so the other the  other  thing is like I've been I'm doing all this stuff on the power spectrum.	0
Tried this stuff on the mel as well mel and the magnitude, and mel magnitude, and all those things. But it seems to be the power spectrum seems to be getting the best result.	0
So, one of one of reasons I thought like doing the averaging, after the filtering using the mel filter bank, that seems to be maybe  helping  rather than trying it  on  the mel filter ba- filtered outputs.	0
So just th- Yeah, th- that's that's the only thing that I could think of why why it's giving improvement on the mel.	0
And, yep. So that's it.	0
Uh, how about the subspace stuff?	0
Subspace,  I'm I'm like that's still in a little bit in the back burner because I've been	0
p- putting a lot effort on this to make it work, on tuning things and other stuff. So	0
going parallely but not much of improvement. I'm just have some skeletons ready, need some more  time for  it.	0
Do you wanna go, Stephane?	1
Uh, yeah. So,  I've been, uh, working still on the spectral subtraction.	1
So to r- to remind you   a little bit of of what I did before, is just  to apply some spectral subtraction with an overestimation factor also to get,	1
um, an estimate of the noise, uh, spectrum,	0
and subtract this  estimation   of the noise spectrum from the, uh, signal spectrum,	0
but subtracting  more  when the S_N_R is is, uh,  low,	0
which is a technique that it's	0
So you overestimate the noise spectrum. You multiply the noise spectrum by a factor,	0
uh, which depends on the S_N_R. So, above twenty D_B,	0
it's  one,  so you just subtract the noise.	0
Generally Well, I use, actually, a linear, uh, function of the S_N_R,	0
which is bounded to, like, two or three,	0
when the S_N_R is below zero D_B.	0
Um, doing just this, uh, either on the F_F_T bins or on the mel bands, um,	1
t- doesn't yield any improvement	1
Um, uh, what are you doing with negative, uh, powers?	0
Yeah. So there is also a threshold, of course, because after subtraction you can have negative energies, and -	0
So what I I just do is to put,	0
uh to to  add  to put the threshold first and then to add	0
a small amount of noise,	0
which right now is speech-shaped.	0
Yeah, so it's a- it has the overall overall energy, uh pow- it has the overall power spectrum of speech.	0
So with a bump around one kilohertz.	0
So when y- when you talk about there being something less than  zero  after subtracting the noise, is that at a particular	0
Yeah. There can be frequency bins with negative values.	0
And so when you say you're adding something that has the overall  shape  of  speech,	0
is that in a  in  a particular frequency bin?	0
Or you're adding something across  all  the frequencies when you get these negatives?	0
For each frequencies I a- I'm adding some, uh, noise,	0
but the a- the amount of the amount of noise I add is not the same for all the frequency bins.	0
Ah! O_K. I gotcha. Right.	0
Uh. Right now I don't think if it makes sense to add something that's speech- shaped,  because then you have silence portion that have some spectra similar to the sp- the overall speech spectra. But -	0
So this is something I can still work on, but -	0
So what does that mean? I'm trying to understand what it means when you do the spectral subtraction and you get	0
a  negative.  It means that	0
at that particular  frequency  range you subtracted	0
more  energy than there was actually -	0
So so yeah, you have an an estimation of the noise spectrum,	0
but sometimes, of course, it's as the noise is not perfectly stationary, sometimes this estimation can be, uh, too  small,	0
so you don't subtract  enough.  But sometimes it can be too  large  also.	0
If if the noise, uh, energy in this particular frequency band drops for some reason.	0
So in in an ideal word i- world  if the noise	0
the worst that i- you would get would be a  zero.	0
I mean, the  lowest  you would get would be a  zero,  cuz i-	0
if there was no other energy there you're  just  subtracting  exactly  the noise.	0
Yep, there's all there's all sorts of, uh, deviations from the ideal here. I mean, for instance, you're you're  talking  about the signal and noise, um,  at  a particular  point.	0
And even if something is sort of stationary in ster- terms of statistics, there's no guarantee	0
that any particular instantiation or  piece  of it is exactly a particular  number  or  bounded  by a particular  range.  So,	0
you're figuring out from  some  chunk of of of the signal what you think the  noise  is.	0
Then you're subtracting  that  from  another  chunk,	0
and there's absolutely no reason to think that you'd  know  that it wouldn't, uh, be  negative  in some places.	0
Uh, on the other hand that just means that in  some  sense you've made a mistake because	0
you certainly have stra- subtracted a bigger  number  than is due to the  noise.	0
Um  Also,  we speak the whole where all this stuff comes from is from an assumption that signal and noise are  uncorrelated.	0
And that certainly makes sense in s- in in a  statistical  interpretation, that, you know, over, um, all possible realizations that they're uncorrelated or	0
assuming, uh, ergodicity that i- that i- um, across time, uh, it's uncorrelated.	0
But if you just look at a quarter  second,	0
uh, and you cross-multiply the two things, uh, you could very well, uh, end up with something that sums to something that's not  zero.  So in fact, the two	0
signals  could  have some  relation  to one another. And so there's all sorts of deviations from ideal in this. And and given all that, you could definitely end up with something that's  negative.	0
But if down the road you're making  use  of something as if it is a  power  spectrum,	0
then it can be  bad  to have something negative.	0
Now, the  other  thing I  wonder  about actually is, what if you  left  it negative?	0
What  happens?  I mean, because -	0
Um, are you  taking  the  log   before  you add them up to the  mel?	0
Right. So the thing is, I wonder how if you put your thresholds after that, I wonder how often	0
you would end up with, uh with negative values.	0
But you end up reducing some neighboring frequency bins  @@  in the average, right?	0
When you add the negative to the positive value which is the true estimate.	0
But nonetheless, uh, you know, these are it's another f- kind of smoothing, right? that you're doing.	0
Right. So, you've done your best shot at figuring out what the noise should be, and now i- then you've subtracted it off.	0
And then after that, instead of instead of, uh, uh, leaving it as  is  and adding things adding up some  neighbors,  you  artificially  push it  up.	0
Which is, you know, it's there's no particular reason that  that's  the right thing to do  either,  right?	0
So, um, uh, i- in fact,	0
what you'd be doing is saying, "well, we're d- we're we're going to definitely  diminish  the effect of this frequency in	0
this little frequency bin in the in the overall mel summation". It's just a thought. I d- I don't know if it would be -	0
Sort of the  opposite  of that would be if if you find out you're going to get a negative number,	0
you don't do the subtraction for that	0
That would be almost the  opposite,  right?	0
Instead of leaving it negative, you  don't  do it.	0
If your if your subtraction's going to result in a negative number, you you don't do subtraction	0
Yeah, but that means that in a situation where you thought that that the bin was almost entirely noise, you  left  it.	0
Uh. Yeah. Well, yeah that's that's the opposite, yeah.	0
Yeah, I'm just saying that's like the opposite. Yeah.	0
And, yeah, some people also if it's a negative value they, uh, re-compute it using inter- interpolation from the edges and bins. Well, there are different things that you can do.	0
People can also, uh, reflect it back up and essentially do a full wave rectification instead of a -	0
instead of half wave. But it was just a thought that that it might be something to try.	0
Yep. Well, actually I tried,  something else based on this, um,	1
is to to put some smoothing, um, because it seems to to help or it seems to help the Wiener filtering and, mmm -	1
So what I did is, uh, some kind of nonlinear smoothing.  Actually I have a recursion that computes -	1
Yeah, let me go back a little bit. Actually, when you do spectral subtraction you can,	0
uh, find this this equivalent in the s- in the spectral domain. You can uh compute, y- you can say that d- your spectral subtraction is a filter, um, and the gain of this filter is the, um,	0
signal energy minus what you  subtract,   divided by the signal energy.	0
And this is a gain that varies over time, and, you know, of course, uh, depending on the s- on the noise spectrum and on the speech spectrum. And -	0
what happen actually is that	0
during low S_N_R values, the gain is close to zero but it varies a lot.	0
Mmm, and this this is the cause of musical noise and all these -	0
the  the fact you we go below zero one frame and then you can have an energy that's above zero. And -	0
So the smoothing is I did a smoothing actually on this gain, uh, trajectory.	0
But it's the smoothing is nonlinear in the sense that I tried to not smooth if the gain is high, because in this case we know that,	0
uh, the estimate of the gain is correct because we we are not close to to to zero,	0
um, and to do more smoothing if the gain is low.	0
Yeah. So, well, basically that's this idea,  and	0
it seems to give pretty good results,	0
uh, although I've just just tested on Italian and Finnish.	1
And on Italian it seems my result seems to be a little bit better than the Wiener filtering, right?	1
Mm-hmm. Yeah, the one you showed yesterday. Right?	0
Uh, I don't know if you have these improvement- the detailed improvements for Italian, Finnish, and Spanish there or you have just  have your own .	0
No, I don't have, for each, I I just just have the final number here.	0
So these numbers he was giving before with the four point three, and the ten point one, and so forth, those were  Italian,  right?	0
Yeah, yeah, yeah. So so, no, I actually didn't give you the number which is the final one, which is, after two stages of Wiener filtering.	0
Uh uh, no, we've -	0
I mean, that was I just well, like the overall improvement is like fifty-six point five.	0
So, I mean, his number is still better than what I got in the two stages of Wiener filtering.	0
On Italian. But on Finnish it's a little bit worse, apparently. Um -	0
But do you have numbers in terms of word error rates on on Italian? So just so you have some sense of reference?	0
Yeah. Uh, so, it's, uh, three point, uh, eight.	0
Oh, O_K. Yeah, right, O_K.	0
And then, uh, d- uh, nine point, uh, one.	0
And finally, uh, sixteen point five.	0
And this is, um, spectral subtraction plus what?	0
Plus plus nonlinear smoothing. Well, it's the system it's exactly the sys- the same system as Sunil tried, but -	0
On-line normalization and L_D_A? Yeah.	0
Yeah. But instead of double stage Wiener filtering, it's it's this  smoothed   spectral subtraction. Um, yeah.	0
What is it the, um,	0
for Do they use spectral subtraction, or Wiener filtering, or ?	0
They use spectral subtraction, right.	0
It it's Wiener  filtering,   am I right?	0
Oh, it's it's Wiener filtering. Sorry.	0
Well, it's some kind of Wiener filtering -	0
Yeah, filtering. Yeah, it's not exactly Wiener filtering but some variant of Wiener filtering.	0
Yeah, plus, uh, I guess they have some sort of cepstral normalization, as well.	0
They have like yeah, th- the just noise compensation technique is a variant of Wiener filtering, plus they do some -	0
some smoothing techniques on the final filter. The th- they actually do the filtering in the time domain.	0
So they would take this H_F squared back, taking inverse Fourier transform.	0
And they convolve the time domain signal with that.	0
And they do some smoothing on that final filter, impulse response.	0
But they also have two two different smoothing  @@ . One in the time domain and one in the frequency domain by just taking the first, um, coefficients of the impulse response.	0
I mean, I'm I'm  @@ .  But .	0
So, basically it's similar. I mean, what you did, it's similar because you have also two two kind of smoothing. One in the time domain, and one in the frequency domain, yeah.	0
It's similar in the smoothing and -	0
Does the smoothing in the time domain help -	0
Well, do you get this musical noise stuff with Wiener filtering or is that only with, uh, spectral subtraction?	0
No, you get it with	0
Does the smoothing in the time domain help with that?	0
Oh, no, you still end up with zeros in the s- spectrum. Sometimes.	0
I mean, it's not clear that these musical noises hurt us in recognition. We don't know if they do. I mean, they they  sound  bad.	0
But we're not listening to it, usually.	0
Uh, actually the the smoothing that I did do here reduced the musical noise. Well, it -	0
Mm-hmm. Yeah, yeah,  the -	0
Well, I cannot you cannot hear beca- well, actually what I d- did not say is that this is not in the F_F_T bins. This is in the mel frequency bands.	0
So, it could be seen as a f- a a smoothing in the frequency domain because I used, in ad- mel bands in addition and then the other phase of smoothing in the time domain.	0
But, when you look at the spectrogram, if you don't have an- any smoothing, you clearly see, like -	0
in silence portions, and at the beginning and end of speech, you see spots of high energy randomly distributed over the the spectrogram.	0
Which is musical noise, yeah, if if it -	0
If you listen to it uh, if you do this in the F_F_T bins, then you have spots of energy randomly distributing. And if you f- if you re-synthesize these spot sounds as,	0
Well, none of these systems, by the way, have I mean, y- you both are are working with, um, our system that does not have the neural net, right?	1
So one would hope, presumably, that the neural net part of it would would improve things further as as they did before.	1
Yeah, although if if we, um, look at the result from the proposals,	0
one of the reason, uh, the n- system with the neural net was,	0
um, more than well, around five percent better, is that it was much better on	0
highly mismatched condition. I'm thinking, for instance, on the T_I-digits trained on clean speech and tested on noisy speech.	0
Uh, for this case, the system with the neural net was much better. But not much on the in the other cases. And	0
if we have no, uh, spectral subtraction or Wiener filtering, um, i- the system is Uh, we thought the neural neural network is much better than before,	0
even in these cases of high mismatch. So, maybe the neural net will help  less  but, um -	0
Could you train a  neural  net to do spectral subtraction?	0
Yeah, it could do a nonlinear spectral subtraction but I don't know if it I mean, you have to figure out what your targets are.	0
Yeah, I was thinking if you had a	0
clean  version of the signal and and a  noisy  version,	0
and your  targets were the	0
M_F_- uh, you know, whatever, frequency bins -	0
Yeah, well, that's not so much spectral  subtraction  then, but but but it's but at  any  rate, yeah, people, uh -	0
y- yeah, in fact, we had visitors here who did that I think when you were here ba- way back when.	0
Uh, people d- done lots of experimentation over the years with training neural nets. And it's not a bad thing to do. It's another approach.	0
M- I mean, it's it, um The objection everyone always raises, which has some truth to it is that, um,	0
it's good for mapping from a particular noise to clean but then you get a  different  noise.	0
And the experiments we saw that  visitors  did  here  showed that it there was at least some,	0
to the degradation when you switched to different noises. It  did  seem to help. So that you're right, that's another -	0
How did it compare on I mean, for for  good  cases where it it -	0
uh, stuff that it  was  trained on? Did it do pretty well?	0
Oh, yeah, it did very well.	0
Um, but to some extent that's	0
kind  of what we're  doing.  I mean, we're not doing  exactly  that, we're not	0
trying to generate good examples but by trying to do the best classifier you possibly can,	0
for these little phonetic categories,	0
You could say it's sort of built in.	0
It's Yeah, it's kind of built into that. And and that's why we  have  found that it it  does  help.	0
Um so, um, yeah, I mean, we'll just have to try it. But I I would I would I would  imagine  that it will help  some.	0
I mean, it we'll just have to see whether it helps more or less the same, but I would imagine it would help  some.	0
So in  any  event, all of this I was just confirming that all of this was with a simpler system. O_K?	0
Yeah, so this is th- the, um -	0
Well, actually, this was kind of the first try with this spectral subtraction plus smoothing, and I was kind of excited by the result.	0
Um, then I started to optimize the different parameters. And,	0
uh, the first thing I tried to optimize is the, um, time constant of the smoothing.	0
And it seems that the one that I chose	0
for the first experiment was	0
the optimal one,  so  uh,	0
It's  amazing  how often that happens.	0
Um, so this is the first thing. Um -	0
Yeah, another thing that I -	1
it's important to mention is, um, that this has a- this has some additional latency.	1
Because when I do the smoothing,	0
uh, it's a recursion that estimated the means, so of the g- of the gain curve. And	0
this is a filter that has some latency. And I noticed that it's better if we take into account this latency. So, instead o- of using	1
the current estimated mean to, uh, subtract the current frame, it's better to use an estimate that's some- somewhere in the future. Um -	0
And that's what causes the latency?	0
You mean, the m- the mean is computed o- based on some frames in the future  also?  Or or no?	0
It's the recursion, so it's it's the center recursion, right?	0
Um and the latency of this recursion is around fifty milliseconds.	0
I'm sorry, why why is that delay coming? Like, you estimate the mean?	0
Yeah, the mean estimation has some delay, right?	0
I mean, the the filter that that estimates the mean has a time constant.	0
It isn't O_K, so it's like it looks into the future also.	0
What if you just look into the past?	0
It's, uh, not as good.	0
It's not bad. Um, it helps a lot over the ba- the baseline but, mmm it -	0
How m- by how much?	0
It's around three percent, um, relative.	0
It's depending on how all this stuff comes out we may or may not be able to add any latency.	1
So, yeah, it depends. Uh, y- actually, it's it's l- it's three percent. Right.	0
Yeah, b- but I don't think we have to worry too much on that right now  while you kno- .	1
Um, s- Yeah, I mean, I think the only thing is that  I would worry about it a  little.	1
Because if we completely  ignore  latency,	1
and then we discover that we really have to do something about it, we're going to be find ourselves in a bind.	1
you know, maybe you could	0
make it twenty-five.  You know what I mean?	0
Yeah, just, you know, just be be a  little  conservative because we may end up with this crunch where all of a sudden we have to cut the latency in half or something.	0
Um. So, yeah, there are other things in the, um, algorithm that I didn't, uh,  @@  a lot yet, which -	0
Sorry. A quick question just about the  latency  thing. If if there's  another  part of the system that causes a latency of	0
is this an  additive  thing? Or c- or is yours  hidden  in that?	0
We can  O_K.  We  can  do something in  parallel   also,  in some like some cases like, if you wanted to do voice activity detection.	0
And we can do that in parallel with some other filtering you can do. So you can make a decision on that	0
voice activity detection and then you decide whether you want to filter or not. But by then you already  have  the sufficient samples to do the filtering.	0
So  So, sometimes you can do it  anyway .	0
I mean, couldn't, uh I -	0
Couldn't you just also I mean, i- if you know that the l- the largest latency in the system is	0
two hundred milliseconds,  don't you  couldn't you just buffer up that number of frames and then	0
everything uses that buffer? And that way	0
Well, in fact, everything  is  sent over in buffers cuz of isn't it the T_C_P	0
You mean, the the data, the super frame or something?	0
Yeah, but that  has  a variable latency because the last frame doesn't have any latency and first frame has a twenty framed latency. So  you  can't r-  rely  on that latency all the time.	0
Because I mean the transmission over over the air interface is like a buffer. Twenty frame twenty four frames.	0
So But the only thing is that the  first  frame in that twenty-four frame buffer has a twenty-four frame latency. And the  last  frame doesn't have  any  latency.	0
Because it just goes as Yeah.	0
Yeah, I wasn't thinking of  that  one in  particular  but more of, you know, if if there is some part of your system that has to buffer twenty frames,	0
uh, can't the other parts of the system draw out of that buffer and therefore not add to the latency?	0
Yeah. And and that's sort of one of the  all  of that sort of stuff is things that they're debating in their standards committee.	1
there is uh,  these parameters that I still have to to look at. Like, I played a little bit with this overestimation factor,	0
uh, but I still have to to look more at this, um, at the level of noise I add after.	0
Uh, I know that adding noise helped, um, the system just using spectral subtraction without smoothing,  but I don't know	0
right now if it's still important or not, and if the level I choose before is still the right one. Same thing for the shape of the the noise.	0
Maybe it would be better to add just white noise instead of speech shaped noise.	0
That'd be more like the J_RASTA thing in a sense. Yeah.	0
Uh, and another thing is to -	0
Yeah, for this I just use as noise estimate the mean, uh, spectrum of the first twenty frames of each utterance.	0
I don't remember for this experiment what did you use for these two stage -	0
I used ten just ten frames. Yeah, because I mean, the reason was like in T_I-digits I don't have a lot.  I had  twenty frames most of the time.	0
Um. But, so what's this result you told me about, the fact that if you use more than ten frames you can improve by t-	0
Well, that's that's using the channel zero.	0
If I use a channel zero VAD to estimate the noise.	0
Oh, O_K. But this is ten frames plus plus	0
Uh, no, these results with two stage Wiener filtering is ten frames but possibly  more.  I mean, if channel one V_A_D gives you Yeah.	0
O_K. Yeah, but in this experiment I did I didn't use any V_A_D. I just used the twenty first frame to estimate the noise. And -	0
So I expected it to be a little bit better,  if, uh, I use more more frames.	0
