and  we know that navigational tasks are gonna be a  core  domain of the new system,	1
it all - all of a sudden it does much  better.	1
tell the person, as I s- showed you on this map,	0
n- you know, produce either you know, a red line that goes to the Vista point or a red line that goes to the Tango point or red line that goes to the door,	0
So not only can you show that you know something sensible but ultimately, if you  produce  a system like this, it	1
takes the person where it wants to  go.	1
always to the geometric  center  of a building, which is what they do now.	1
And we even had to take  out  a bit.	0
Nancy, you  missed  that part.	0
We had to take out a bit of the  road	0
work. So that it  doesn't  take you to the wall	0
every time.  So. Um -	0
So this was actually an actual problem that we encountered,	0
which nobody have - has -	0
because  car  navigation systems don't really  care.	0
You know, they get you to the  beginning  of the street,  some  now do the house number.	0
But even  that  is problematic. If you go d-	0
If you wanna drive to the S_A_P in Waldorf,	0
I'm sure the same is true of Microsoft,	0
it takes you to the -	0
the  address,  whatever, street number blah-blah-blah,	0
you are  miles  away from the entrance.	0
Because the s-  postal  address is  maybe  a mailbox somewhere.	0
Nuh?   but the entrance where you actually wanna go is somewhere completely different.	0
So unless you're a mail person you really don't wanna go there.	0
Probably not then, cuz y- you probably can't drop the mail there anyway.	0
Probably neither - e- not even that.	0
The Powder-Tower is made of red limestone.	0
Do you wanna see a picture?	0
Have to reboot for that though.	0
So,  you  two, who'll be working on this, li- are - are you gl- will you be doing - Well, I mean are you supposed to just do it by	0
thinking  about the situation? Can you use the sample data?	0
Is it like - Yeah, I mean, ho- is there more than -	0
Of  course  they use the sample data.	0
Is there a lot s- of sample data that	0
is beyond what you - what you have there?	0
There - there's more than I showed, but um, um, I think this is sort of um, in part  my  job to look at that and - and to see whether	0
there  are  features in there that can be extracted, and to come up with some	0
you know, empirically based on - on a real experiment or on - on - on  reality  but sort of on your intuition of you know, "Aha!	0
This is maybe a sign for that, and this is maybe a sign for this."	0
So, yeah. Later this week we should sort of get together, and sort of	0
start thinking about  that,  hopefully.	0
O_K. We can  end  the meeting and call Adam, and then we wanna s- look at some filthy pictures of Heidelberg.	0
We can do that as well.	0
Well they had - they used the ammunition - They stored the ammunition in that tower.	0
And that's why, when it was  hit  by uh, a cannon ball, it exploded.	0
That's  why they call it the Powder-Tower.	0
I  first  thought it had something to do with the material that it - w- that's why I  asked.	0
