I guess - could you back to the slide, the  previous  one? So, is it that it's, um -	0
These are all factors that uh, a-	0
These are the ones that you said that we are going to  ignore  now? or that we want to	0
take into account? You were saying	0
Take the - the linguistic factors  too.	0
But - but you  don't  worry about - h-	0
Oh, how to  extract  these features. O_K.	0
So, f- let's find out which ones we  need  first,	0
And - and it's clear from the data, um, like, sorta the correct answer in each case.	1
O_K. That's - that's the thing I'm curious ab-	0
Let's go back to th-	0
Let's go back to the - the - the slide of data.	0
Like do we know from the data wh- which -	0
But, um, since we are  designing	1
a - a - a - an, compared to this, even  bigger  data collection effort,	1
um, we will  definitely  take care to put it  in  there,	1
shape, way, form over the other,	0
sort of empirically validated data.	0
Um, from  this,  we can  sometimes,  you know - an- and  that's  - that - but that - isn't that what we need for a belief-net anyhow? is sort of -	0
s- sometimes when people want to just  see  it, they phrase it  more  like this?	0
But it doesn't exclude anybody from phrasing it totally  differently,  even if they  still  -  you know?	0
But then  other  factors may come into play that change the outcome of their belief-net.	0
So, um, this is exactly  what  - Because y- you can  never  be sure. And I'm sure even i- the most, sort of, deliberate data collection experiment will never give you data that say, "Well, if it's phrased like that,	1
the intention is this." You know, because then, uh, you -	1
u- u- I mean, the only way you could get that is if you were to give th- the x- subjects a task.	0
Right?  Where you have - where  your, uh, current	0
Yeah!  That's  what we're  doing.  But - but we will  still  get the phrasing all over the place. I'm sure that, you know -	0
So that's what you want? O_K.	0
The - No, that's fine. I guess, it's just  knowing  the intention from	0
From that task, yeah. So,	1
uh, I think you all know this, but we  are  going to actually  use  this little room	1
probably within a month or something. So,	1
any - lo- any of  you  guys' worry, except that	0
we may want to push  that  effort to get information we need.	0
is to figure out how to  solve  these problems.	0
If it turns out that we need data of a certain  sort,  then	0
the sort of data collection branch	0
can be, uh, asked to  do  that.	0
And  one  of the reasons why we're recording the meeting for these guys is cuz we want  their  help	0
when we d- we start doing uh, recording of  subjects.	0
So, yeah - y- you're absolutely  right,  though. No, you - you will  not  have,	0
and there it is, and, uh -	0
But you know, y- y-	0
And I think the  other  concern that has come up before, too, is if it's -	0
I don't know if this was collected -	0
what situation this data was collected in. Was it - is it the one that you showed in your talk? Like people -	0
But  O_K. So was this, like, someone actually mobile, like -	0
N- no, no- not - i- it  was  mobile but not - not with a w- a  real  wizard system. So there were never answers.	0
O_K. O_K. But, is it -	0
I guess I don't know - The situation of - of collecting th- the data of, like - Here you could imagine them being - walking around the city.	0
as like  one  situation. And then you have all sorts of other	0
c- situational context factors that would influence	0
w- how to interpret, like you said, the scope and things like that.	0
If they're doing it in a - you know, "I'm sitting here with a map and asking questions",	0
I - I would  imagine  that the data would be really different.	0
Um, so it's just -	0
It was never th- th- the goal of  that  data collection to - to serve for sat- for such a purpose. So that's why for example the tasks were not	1
differentiated by intentionality, there was n- there was no  label,  you know, intention A_, intention B_, intention C_. Or task A_, B_, C_.	1
I'm sure we can produce  some  if we need it, um, that -	1
that will help us along those lines. But,	1
you know, you gotta leave something for  other  people to model.	0
So, to - Finding out what, you know,	0
situational con- what the contextual factors of the situation really are, you know is an interesting s-	0
u- u- Sort of  I'm,  at the moment, curious and I'm - I'm - s- w- want to approach it from the end where we can s- sort of start with this toy system that we can play around with,	1
so that we get a clearer notion of what input we need	1
what suffices and what doesn't.	1
And  then  we can start worrying about where to get this input, what -	1
what do we need, you know -	0
Ultimately  once we  are   all  experts in changing that  parser,  for example, maybe, there's just a couple three things we need to  do  and then we get more whatever, part of speech and more construction-type-like	0
It's a m- pragmatic approach, uh, at the moment.	0
How exactly does the data collection work? Do they have a map,	1
and then you give  them   a scenario of some sort?	0
Imagine you're the - the subject. You're gonna be in here, and somebody - And - and you see, uh,	1
either th- the three-D_ model,	1
or uh, a QuickTime animation of standing u- in a square in Heidelberg.	1
So you actually see that.	0
um, first thing is you have to read a text about Heidelberg.	0
So, just off a textbook, uh, tourist guide, to familiarize, uh, yourself with that sort of odd-sounding German street names, like   Fischergasse   and so forth.	1
So that's part one. Part two is, you're told	1
that this  huge   new, wonderful computer system exists,  that  can y- tell you  everything  you want to know,	1
and it understands you completely.	0
And so you're gonna pick up that phone, dial a number, and you get a certain amount of tasks that you have to solve.	1
First you have to know - find out  how  to get to that place,	1
maybe with the intention of buying stamps in there.	0
Maybe - So, the  next  task is to get to a certain place and take a picture for your grandchild.	0
The  third  one is to	0
get information on the history of an object.	0
And then the g- system breaks down.	1
a- At the  third?  Right then?	0
Or after the fourth. Some find -  @@   Forget that for now.	1
And then, a human operator comes on,	1
and - and exp- apologizes that the system has crashed, but, you know, urges you to continue, you know?	1
now with a human operator.	0
And so, you have basically the same tasks again, just with different objects,	1
and you go through it again, and that was it.	0
Oh, and one - one little bit -	0
w- And uh, the computer you are - you are being told the computer system knows exactly where you are, via G_P_S.	0
When the  human  operator comes on, um,	0
that person does  not  know. So the G_P_S is crashed as  well.	0
So the person first has to ask you "Where are you?".	0
And so you have to do some -	0
s- tell the person sort of  where  you are, depending on what you  see  there.	0
Um, this is a - a - a - a - a bit that I d- I don't think we - Did we discuss that bit?	0
Uh, I just sort of squeezed that in now.	0
But it's something, uh, that would provide some very interesting data for some people I know.	0
So, in the display you can -	0
Oh, you said that you cou- you might have a display that shows, like, the -	0
Yeah. a- Additionally, y- you have a - a - a sort of a map type display.	0
a w- your perspective? sort of? And so, as you -	0
Oh, two-D_. O_K. So as you move through it that's- they just track it on the -	0
I don't know. I but y- I don't think you really move,	0
I mean that would be an - an - an enormous technical effort,	0
We  can  show it walks  to , you know. We can have movies of walking, you walking through - through Heidelberg, and u- ultimately  arriving  there.	0
Maybe we wanna  do  that.  Yeah.	0
Uh, I was just trying to figure out how - how ambitious the system is.	0
The map was sort of intended to -	0
You want to go to that place. You know, and it's sort of  there.  And you see the label of the name -	0
So we get those names, pronunciation stuff, and so forth, and we can change that.	0
So your tasks don't require you to -	0
I mean, uh - yo- you're told - So when your task is, I don't know, "Go buy stamps" or something like that?	0
So, do you have to  respond?  or does your -	0
Uh,  what are you ste- what are you supposed to be telling the system? Like, w-	0
what you're  doing  now? or -	0
Well, we'll see what people do.	0
There's no - O_K, so it's just like, "Let's figure out what they would say	1
Yeah, and - and we will record both sides. I mean, we will record the Wi- the Wizard -	0
I mean, in  both  cases it's gonna be a human, in the	0
computer, and in the operator case.	0
And we will re- there  will  be some dialogue, you know?	0
So, you first have to do this, and that, and - and -	0
see wh- what they say. We can ins- instruct the, uh, wizard in how expressive and talkative he should be.	0
maybe the - maybe what you're suggesting - Is what you're suggesting that it might be too poor, the data, if we sort of limit it to this ping pong one t-	0
uh, task results in a question and then there's an answer and that's the end of the task? You wanna m- have it more - more steps, sort of?	0
Yeah, I - I don't know how much direction is given to the subject	0
their interaction - I mean, th- they're unfamiliar w- with interacting with the system. All they know is it's this great system that could do	0
s- stuff. Right? So -	0
Oh yeah, but - to  some  extent this is a different discussion.	0
Uh, we - we have to have this discussion of th- the experiment, and the data collection, and all that sorta stuff	1
and we do have, um, a student who	0
is a candidate for wizard.	0
Uh, she's gonna get in touch with me. It's a student of Eve's.	0
F_E_Y, Fey? Spelled F_E_Y. Do you - do you -	0
Oh, Fey Parrill. Yeah. Uh-huh.	0
She   started taking the class last year and then didn't - um, you know, didn't continue. I g- She's a g-	0
Is she an undergradua- She  is  a graduate, O_K.	0
Yeah, I m- I know her very, very briefly. I know she was inter- you know, interested in	0
aspect and  stuff like that .	0
So, anyway, she's looking for some more part time work w- while she's  waiting  actually for graduate school.	0
And she'll be in touch. So we  may  have	0
uh, to  do  this, and she's got you know,  some  background in - in	0
all this stuff. And is a linguist st- and, so  So.	0
That's - So, Nancy, we'll have an- At some point we'll have another discussion on	0
exactly wha- t- t- you know, how that's gonna go.	0
Jane, but also, uh, Liz	0
have offered to help us do this,	0
uh, data collection and design and stuff.	0
So, when we  get  to that we'll have some people doing it that know what they're doing.	0
I guess the reason I was asking  about  the sort of the de- the details of this kind of thing is that, um,	1
it's one thing to collect data for, I don't know, speech recognition or various other tasks that have pretty c- clear	1
correct answers, but with  intention	1
um, obviously, as you point out, there's a lot of di- other factors and -	1
I'm  not really sure, um,	1
how - how - e- the question of how to make it a t- appropriate toy	1
Um, it's ju- it's just hard. So, I mean, obviously it's a -	1
Yeah, uh, actually I guess that was my question. Is the intention implicit in the scenario that's given?	0
It  is,  if they have these tasks that they're supposed to -	0
Yeah, I just wasn't sure to what level of detail the task was.	0
to - to give - Yeah, uh -	0
Mm-hmm. n-  No  one is, at the moment.	0
So, we- that's part of what we'll have to figure out.	1
The problem that I was tr- gonna try to focus on today was,	1
let's suppose by magic you could collect dialogues in which, one way or the other,	1
you  were  able to, uh, figure out both the intention, and set the context, and	1
know what language was used. So let's suppose that we can get that kind of data.	1
The issue is, can we	1
find a way to, basically,  featurize  it so that we get some discrete number of features so that,	1
uh, when we know the values to all those features, or as many as possible, we can w- come up with the best estimate of which of the,	1
in this case three little intentions,	1
w- What are the t- three intentions? Is it to go there, to see it, and -	0
To come as close as possible to it.	0
Th- the terminology we're using is to -	0
Now those - It seems to me those are cl- you c- you have no trouble with those being distinct.	0
"Take a picture of it"	0
you - you might  well  want to be a  really  rather different place than	0
And, for an object that's at all  big,	0
uh, sort of getting to the nearest  part  of it	0
uh, could be quite different than either of  those.	0
O_K, so now I understand the referent of Tango mode.	0
See, I would have thought it was more of a waltz.	0
I didn't get that before.	0
Yeah, like,  how  close are you gonna be? Like,  Tango's really close.	0
Yeah, cuz a tango - Yeah.	0
So, like, the question is  how  what features can -	0
like, do you wanna try to extract from, say, the parse or whatever?	0
Like, the presence of a word or the presence of a certain uh, stem, or -	0
Is there a construction, or the kind of object, or	1
w- uh, anything else that's in the si- It's either in the - in the s- the discourse itself or in the context.	1
So if it turns out that, whatever it is, you want to know whether the person's uh, a  tourist  or not,	1
O_K? that becomes a  feature.	1
Now, how you  determine  that	1
is another  issue.  But fo- for the  current  problem,	1
it would just be, "O_K, if you can be sure that it's a tourist, versus a businessman, versus a  native, "	0
uh, that would give you	0
a  lot  of  discriminatory   power and then just have a little section in your belief-net that said, "pppt!"	1
Though sin- f- in the  short  run, you'd  set  them,	1
and see ho- how it worked, and then in the longer run,	1
you would figure out how you could  derive  them.	1
From previous discourse or w- any- anything else you  knew.	1
So, how should - What's the uh, plan? Like, how should we go about figuring out these -	0
O_K. So, first of all is, uh, do e- either of you guys,	1
you got a favorite belief-net that you've, you know, played with? JavaBayes or something?	1
O_K. Well, anyway. f-  Get  one.	0
O_K? So - y- so one of th- one of the things we wanna do is actually,	1
uh, presumably one that's got good interactive abilities, cuz a  lot  of what we're gonna be d-	0
You know, we don't need the one that'll solve massive,	1
uh, belief-nets quickly. d- w-	1
These are not gonna get big in - in the foreseeable future.	0
But we  do  want one	1
in which it's easy to interact with and, uh, modify.	1
Because i- that's - A  lot  of what it's gonna be, is,	0
playing with this. And  probably  one in which it's easy to have,	1
um, what amounts to transcript files. So that if - if we have all these  cases  -	1
O_K? So we make up cases that have these features,	0
O_K, and then you'd like to be able to say, "O_K, here's a bunch of cases" -	0
There're  even  ones tha- that you can do  learning	0
O_K? So you have all their cases and - and their results and you have a - algorithms to go through and run around trying to set the - the probabilities for you.	0
probably that's not worth it.	0
I mean, my guess is we aren't gonna have enough data that's good enough to make	0
the - these data fitting ones	0
worth it, but I don't know.	0
So I would say you guy- the first task for you two guys is to um, pick a package.	0
O_K, and you wanna it s- You know, the  standard  things you want it stable, you want it - yeah,  @@ .	1
And, as soon as we  have  one, we can start	1
But it - what I like about it is it's very  concrete.	1
O_K? We - we have a - we  know  what the outcomes are gonna be, and we have some - some data that's loose, we can use our own intuition,	1
and see how  hard  it is,	0
and,  importantly,  what intermediate nodes we think we  need.	0
So it - if it turns out that just, thinking about the problem, you come up with things you really need to -	1
You know,  this  is the kind of thing that is, you know, an intermediate little piece in your belief-net.	1
And it - and it may serve as a platform for	0
a person, maybe me, or whoever, who is interested in doing some linguistic analysis.	0
I mean, w- we have the For- FrameNet group here,  and  we can see what they have found out about those concepts already,	0
that are contained in the data,	0
you know, to come up with a nice little set of features and um,	0
maybe even means of s- uh, extracting them.	0
And - and that altogether could also be - uh, become a nice paper that's going to be published somewhere, if we sit down and  write  it.	0
When you said JavaBayes belief-net you were talking about ones that run on coffee? or that are in the program  language   Java?	0
No, th- It turns out that there is a,	0
The new end of Java libraries. O_K, and it turns out one called JavaBayes. Which is	0
one that fair - people around here use a fair amount.	0
I have no idea whether that's -	0
The obvious  advantage  of that is that you can then,	0
relatively easily, get all the  other  Java packages for  GUIs   or whatever else you might want to do. So that i- that's I think why	0
a lot of people doing research  use  that.	0
But  it   may  not  be - I have  no  idea whether that's the best choice an- and	1
there're plenty of people around, students in the department who, you know, live and  breathe  Bayes-nets. So, uh,	1
tool kit that um, Kevin Murphy has developed,	0
which might be useful too. And it's available Matlab code.	0
So, yeah, Kevin would be a good person to start with.	0
Nancy  knows him well. I don't know I don't know whether you guys have met Kevin yet or not, but, uh -	0
But since we all probably are pretty sure that, um, the -	0
this th- th- the dialogue history is - is um, producing X_M_L documents. M_-three-L_ of course is X_M_L.	1
And the ontology that um, uh the student is - is constructing for me back in - in E_M_L is in OIL and that's also in X_M_L.	1
And so that's where a lot of knowledge about bakeries, about hotels, about castles and stuff is gonna come from.	1
Um, so, if it has that I_O capability and if it's a Java package, it will definitely be able - We can couple.	0
So, yeah, we're sort of  committed to X_M_L as the kind of,	1
But that's, you know, not a big deal.	0
So, in terms of - of - interchanging in and  out  of any module  we  build,	0
And if you're going off to queries to the ontology, for example, you'll have to deal with  its  interface.	0
But that's - that's fine an- and um,	0
all of these things have been built	0
much  bigger projects than this in mind. So they - they	0
have worked very hard. It's kind of blackboards and multi-wave blackboards and ways of interchanging and registering your a- And so forth.	0
that  I don't think is  even  worth us  worrying  about just yet.	0
I mean if we can get the  core  of the thing to  work,	0
in a way that we're  comfortable  with,	0
then we ca- we can get in and out of it with, uh, X_M_L,	0
I  believe. I don't - I don't see -	0
Yeah, I like, for example, the - what you said about the	0
getting input from - from just files about where you h- where you have the data, have specified the features and so forth.	0
That's, of course,  easy  also to do with, you know, X_M_L.	0
Uh, you could have an X_ - yeah, you could make and X_M_L format for that. Sure.	0
you know, feature value X_M_L format	0
is  probably as good a way as any.	0
So it's als- Yeah, I guess it's also worth,	0
um, while you're poking around, poke around for X_M_L packages that	0
Doesn't - does SmartKom system have such packages?	0
The - the lib- M_-three-L_ library does that.	0
And the question is, d- you c- you - you'll have to l-	0
That should be - ay- We should be able to look at that -	0
No, u- u- y- um- the -	0
What I - What sort of came to  my  mind i- is - was the notion of an idea that	0
if - if there are l- nets that can actually lear- try to set their own, um,	0
probability factors based on - on - on - on input -	0
which is in file format,	0
um, get  really  w- wild on this, we may actually want to use some - some corpora that  other  people made and, for example, if - if they are in - in  MATE,	1
then we get X_M_ L  documents with discourse annotations, t- you know, t- from the discourse act down to the phonetic level.	1
Um,  Michael   has a project where - you know, recognizing discourse acts and he does it all in MATE, and so	0
they're actually annotating data and data and data.	0
if we  think  it's  worth  it one of these days,	0
not - not with this first prototype but maybe with a  second,  and we have the possibility of - of taking input that's generated  elsewhere  and  learn  from that,	0
It'd be nice, but - but I - I - I do- I  don't  wanna count on it.	1
I mean, you can't - you can't run your project based on the speculation that -	0
No, no, uh, just for -	0
that the data will come, and you don't have to actually design the nets.	0
Nuh. Just a back door that -	0
I - I think we should devote m-	0
Could  happen. Yeah. So in terms of - of the, um -	1
the - what the SmartKom gives us for M_-three-L_ packages, it could be that they're fine, or it could be eeh.  You don't -	1
You know, you don't really  like  it.	0
So we're not - we're not abs- we're not  required  to use	1
their packages. We  are  required at the end to give them stuff in their  format,  but hey.	1
It doesn't control what you do in- you know,  internally.	0
What's the time frame for this?	1
Yeah bu- w- I'd like that this - y- yeah, this  week,  to ha- to n- to	1
have y- guys, uh, you know, pick	1
the - y- you know, belief-net package and tell us what it is, and give us a pointer so we can play with it or something.	1
And, then as soon as we  have  it,	1
I think we should start	1
populate  it for this  problem.	1
Make a first cut at, you know, what's going on,	0
easiest  way to do that	0
some on-line way. I mean, you can f- figure out whether you wanna make it a web site or - You know, how-	0
Uh - I - I - I - um, O_K, I - t-	0
Yeah. I was actually more  joking.  With the two or three days. So this was - was a usual jo-	0
Um, it will take as long as y- y- yo- you guys  need  for that. But um,	0
maybe it might be interesting if - if the two of you can agree on who's gonna be the speaker  next  Monday, to  tell  us something about the net you  picked,  and what it does, and how it does that.	0
Well, y- Well, or  both  of them speak.  We  don't care.	0
Yeah, or you can split it up.	0
So that will be sort of the assignment for next week, is to -	0
to -  for  slides and whatever net you picked and what it can do and - and how far you've gotten. Pppt!	0
Well, I'd like to also,	1
though, uh, ha- have a first cut at what the	1
Even  if it's  really  crude.	1
here a- here are -	0
So we're supposed to  @@  about features and whatnot, and -	0
And, as I said, what I'd  like  to do is,	0
I mean, what would be  really  great is  you  bring it in - If - if - if we could,	0
uh, in the meeting, say, you know, "Here's the package, here's the current one we have,"	0
uh, you know, "What other ideas do you have?"	0
and then we can think about this idea of making up the data file.	0
uh, you know, get a - t- a p- tentative format for it, let's say X_M_L, that says, l- you know, "These are	0
the various  scenarios  we've experienced."	0
We can just add to that and there'll be this -	0
this file of them and when you	0
think you've got a better  belief-net,	0
You just run it against this, um -	0
So we'll be like, hand, uh,	1
Oh, yeah, unt- until we know more.	1
And  what's the relation  to  this with -	0
Changing  the table so that the system works in English?	0
O_K. So this is -	0
Whi- while  you  were doing  this,	0
I received two lovely emails. The - the full N_T and the full Linux version are	0
and I started to unpack the Linux one -	0
Uh, the N_T one worked fine.   and I started unta- pack the Linux one, it told me that I can't really unpack it because it  contains   a future date.	0
So this is the time difference between Germany. I had to wait until one o'clock this afternoon before I was able to unpack it.	0
Then it will be  my  job to get this whole thing running both on Swede and on  this  machine.	0
And so that we have it.	0
Hopefully that - hoping that my urgent message will now come through to Ralph and Tilman that it will send some more documentation along,	0
we - I control p-	1
Maybe that's what  I  will do next Monday is show the state and show the system and show	1
Yeah. So the answer, Johno, is that these are,	0
Uh, what one  hopes  is that	1
when  we understand how the analyzer  works,  we can both	1
worry about converting it to  English  and worry about how it could ex- extract the parameters we need for the  belief-net.	1
I guess my question was more about time frame. So we're gonna do belief-nets this week, and then -	0
Oh, yeah. I don't know. n-  None  of this is i- n-	1
has got a real tight  time-line,  in the sense that over the next month there's a - there's a deliverable.	1
O_K. S- so uh, it's opportu- in that sense it's opportunistic.	0
If - if - you know, if we don't get any information for these guys f- for several  weeks  then we aren't gonna sit around,	0
trying to do the problem or guess what  they  -	0
You know, just pppt!  go on and do other things.	0
Yeah, but uh - but the uh -	1
This point is really - I think very, very valid that ultimately we hope that -	1
that both will merge into a harmonious and, um, wonderful,	1
we can  not  only do the bare necessities, I_E, changing the table so it does exactly in English what it does in German,	1
but also that we can sort of have the system where we can say, "O_K, this is what it  usually  does,	1
and now we add  this  little thing to it",	1
you know? whatever, Johno's and Bhaskara's great belief-net,	1
and we plug it  in,	1
and then for these certain tasks,	1
