Right.  And  there's some happy medium and we don't know what that  is  yet	0
until we get feedback from people, but	0
what  if  it's O_K to just handle it	0
sort of a  person  in  charge  of the  philosophy  behind the changes,	0
and some people with permissions,	0
maybe by  request,  to make changes, That we don't just give people permissions if they're not gonna make changes. Because  I've  overwritten a -	0
a file by  mistake,  not  wanting  to have done that cuz I didn't think I had permission, when I  did.	0
seeing if that is enough to -	0
to handle the transcript changes.	0
letting everybody go in and make  changes,  cuz it's real easy when you're	0
trying to, I don't know, run alignments and there's a word you wanna fix, to go in and do that and then mess up  other  things,	0
you know, the overall philosophy behind the - the conventions.	0
And als- it also-  Mm-hmm.	0
Then - There is also the possibility - Remember, in C_V_S, when we talk about making changes,	0
You can back everything out.	0
there's sort of two types that can be made.  To your  local,	0
And so people can make  changes  to their  local  and if they screw those up,	0
that's, you know, in their - that's only on them. It's w- it's the checking  in  part that r- we really care about, and	1
that  we can control with, you know, who can check things in and stuff. So we can - I think we can  do  this.	1
Or just, yeah, start by make it a really tight control and then as people really need the control you can	0
Yeah. They can still check it out -	1
ascertain whether or not to -	0
Yeah, cuz they can still check out full copies and make whatever changes they want to their local copies.	1
And it won't affect the - the g- the global, official, ones at all.	1
Right, but what I want to  avoid  is ending up with two corpora.	1
And so if you make it too hard for them to check back in, they'll check it out once,	0
they'll make all the changes, they'll never tell  us  about the changes,	0
and we'll get two different corpora.	0
I think we're  already  gonna - I mean there's already	0
some  chance that different annotations, different	0
control  that by  knowing  you're making two corpora or  knowing  that you're adding	0
um, annotations on one version and you don't have the latest corrections maybe at that  point.  And then you finish the project and you realize that there were	0
corrections  made on your  originals  and then	0
you have to  merge  them.	0
the  thing  that makes it ea- O_K to  do  that, is	0
knowing where the synch time boundaries are.	0
Cuz you can automatically pretty much  merge  things if you've only got twenty words or so in an utterance. It's when you get the whole  meeting	0
and the  synch  times ch-	0
have changed, or you can't correspond to a previous version with synch times, that you get in trouble.	0
Was there anything else on your list?	0
Shall we do some digits?	0
Now, wait, are - are we doing them simultaneously or one at a time?  Alright.	0
I wasn't  planning  on doing it simultaneously.	0
Lee , you liked that l- huh?	0
