Yeah, we could certainly do that.	0
uh, Morgan, just to -	1
uh, since you weren't at the meeting  last  week, uh, apparently a bunch of the E_D_U fe- folks really hate this style mike.	1
Um, I wouldn't - well, it -	0
they didn't say "hate" but they -	1
they c- they come on time to their meetings in order to not be  left  the last person who has to sit by those	1
Can I - I c- I -	0
I mean, that's - that's -  that's  a fairly strong indication of dislike.	0
I  actually really like  them   though.	0
Which one is these? The uh -	0
There were a few people - you, and like, three or four people who  really  like them.	0
And e- and th- all the others	0
So what I was  thinking  is, we could  get  a few more of the  Sony  ones and just unplug  them   and plug  them   in. And the only thing is that	1
when you fill out the  digit  forms, you have to be sure to indicate which mike was actually used.	1
So, I mean, that's easy to do. Um -	0
moves us  away  from this uniform, all the mikes are the  same,  which some people had said was a benefit.	0
The  other  thing,  too,  is th- y-  you  said that the acoustic pra- q- quality of the one that you're  wearing,  the  fancy  one, is actually somewhat  better  than	1
So I- I don't know if it's a noticeable  difference,  but it is -	1
I mean, I p- I personally really  prefer  that model, so I think you know we've got this problem of people having different -	1
You know, there are  so  many things about this that are non-uniform that I think having -	0
having  some  modicum of uniformity is a good thing, but you're just not going to - I mean we've -	0
For instance, jus- just the fact that people sit in different positions, different times, the - exactly where they put it with respect to their mouth is different each time.	0
I - I just don't - I mean, I think we - we're - we're getting rid of  major  differences like we're not using the lapel anymore, an- and so forth. But	1
the other stuff is just gonna - some variability we're gonna have to accept.	0
It's - I - I understand, that's fine with me. I - I g-  would  say that um, I find this model easier to  adjust,  that's one of the reasons I don't like  these,  cuz I keep m-	0
you know, bending it, and then it's n- and I never really know -	0
Yeah, see I - I happen to like the old one better.	0
What about just a different  headband  thing?	0
And some people do, but -	0
Or even if we could attach two headband - Like, I don't  mind  those, but it -	0
We have lots o- of choices of microphones. So -	0
I mean, can we keep the  microphones,  and just	0
somehow attach a more comfortable	0
That's  my  problem  with this one. The -	0
the  ear  thing comes out to  here.  It doesn't even  fit  over my  ear.	0
And for some of the others, it's - their ears were shaped in a way that	0
I mean, so we can go microphone shopping, and get - get more microphones. It's just - w-	0
Then they have to be rewired though, don't they?	0
I'm just not sure what we should do.	0
You know. I mean, here's another argument against worrying too much about uniformity. We have something like forty-five hours of data collected.	1
And, uh, we're also gonna be integrating in this corpus stuff that's - that's being done at U_W,	1
uh, with entirely different microphones. So I - I think,	1
getting away from the lapel,	0
having close-mounted mikes, having people adjust them as they're most - as - as - as comfortable as they can -	0
I think that's sort of the big deal.	0
I  agree with that, and so  my  feeling is,	1
we should get mikes that people like.	1
And so I-  my  feeling is, going out and buying a few more  mikes  is  fine.	1
So should I just go  do  that?	0
And then also, should we go ahead and get another  wireless  system?	0
You know, for whatever it's gonna be, uh -	0
You mean, another  transmitter?  Or - or -	0
Uh, no, actually, get - we need another box. Because each - each box in the back room can only take six.	0
Oh, to get r- to get rid of the wired things. Yes, absolutely.	1
Uh, because - cuz we've had - With the exception of forgetting to change the batteries from time to time, uh, we've really had no tr-  no  trouble with this at all, right? And -	0
So I'll just go d- I'll do that.	0
and the wired stuff is just gonna continue to degrade as, you know, and	0
nobody will remember how to -	0
Another one just bit the dust.	0
yeah, nobody will remember how to repair a Jimbox or a Jimlet or a - you know, it's -	0
I  think  there's a problem with this one.	0
O_K. Then I will just go do that, and send the bill to -	0
I have a quick question about microphones, um -	1
this crazy idea that, um, i-	0
will just walk around with	0
the microphones that they use for their cell phones?	1
You know, these little boom ones,	1
like, and really go to meetings with close talking mikes. If they're their own personal microphone.	1
And so I'm wondering if	1
we can get a couple of tho- I don't know how good  quality  they are, but it would be really interesting to see if they're good  enough.	1
Do you mean the kind that hang from the ear, sort of thing, or the -	0
The k- kind that guys that like to look like they're really cool at  airports  wear.	0
Yeah, but I don't know  that  one. So what's that mean?	0
This - it's - it's a cell phone jack.	0
You cannot miss it. They're the guys going around - they're probably talking to nobody, but	0
Is this - just this little -	0
Oh they - they have little headsets? Or what do they -	0
Yes. They wear the heads-	0
E- Well,  there  you go. Yes. That's - that - it looks sort of like  that.	0
Oh you've - you've  got  one.	0
Except that one's even bigger than most of the ones I've seen. Most of the ones are just a little boom.	0
So where - where does - how do you  wear  that? What does that -	0
You - you put it over the corner of your ear.	0
Yeah, over the corner of the ear -	0
I can't - I'm having competing microphone -  headphone  problems here.	0
There's  another  kind which s- goes  in  your ear and it hangs down. There's a little b-   bulb	0
Yep. It just ha- just hangs down there. Yeah.	0
Yeah,  that  I've seen. Yeah.	0
that hangs - has the mike on it.	0
O_K, so whatever people sort of	0
wear to use l- Yeah, something like tha- with their cell phones,	0
it'd be really great, I think, if we can argue t- that -	0
the acoustics on this are really s- m-  better  than when I talk into it directly.	1
Yeah. The - the biggest issue is the stupid cable	1
Why would it be cool?	0
The connector that Sony has, that, uh -	1
So it's - they're not compatible?	0
and so you can't just plug something in. You need to get it wired.	1
Oh, I'm sorry. You're talking about that as a possible thing to plug into the Sonys. No?	0
um, just as an example for,	0
Works with  this.  I don't know.	0
you know, the future, of the fact that maybe people  will  wear those microphones, or  some  people might,	0
Well, some people will, yeah.	0
Not a - I'm not saying there's not a far-field microphone,	0
If we have a choi- I've always wondered how well they would work.	0
It  is  an interesting idea. If we could build an  adaptor  that went from - cuz I think  mine  looks like this  too.  If we had  this  style plug that went to  that,	1
then we'd just have adaptors and people would plug  them    in.	1
You could use - they could use their own.	0
Oh, right. So they could use the -	0
I wonder if you  could  do an adaptor. I don't know if you can or not.	0
Anyway, it's just an idea. Um -	0
An adaptor might be a better idea than do- redoing the wiring all the time.	0
Well, I mean, another s-	0
An- another side to that is that, um, in  principle,  uh, if it	0
all comes together, supposedly we're gonna get two	0
Uh, little later on in the year.	1
And so, we're gonna wanna be thinking in terms of some	1
so we have, you know, some kind of little something,	0
and, uh, we have a wireless connection, this board, that's doing the computation for the f- the, uh -	0
And so, you know, we wanna be able to show off to somebody,	0
you know, we have a base station somewhere, and	0
I don't understand. So - so there's a mike that plugs in -	0
You're saying there's a mike that plugs in to the  I_RAM  board? or -	0
No, no, what I'm saying is that we're gonna have to put together  some  kind of a	0
little superstructure, d-  some  sort of demo box that it - that doesn't	0
do a whole lot, but it somehow connects  to  -	0
uh, remotely  to  this I_RAM board which will be doing the real computation.	0
In other words, we're - we're not gonna attempt to build, uh, it -	0
do the real work of building a portable device that's little, that	0
is doing all the computation we wanna do for the recognition and the far-field mike, uh,	0
compensation and all that stuff. So we're gonna do all that on this powerful board,	0
and, uh, have some wireless connection to it. And then the question is what is -	0
what does it look like, does it look like	0
something that you - you	0
hold like  this,  or do we make a big deal out of it that you hold it arm - at arm's length th- so that you can see some  display,	0
do we  have  one of these - You know. I don't know.	0
So, it th- these are all possibilities.	0
I mean, what  I  was envisioning was a P_D_A with a cellular link in it.	0
You know, with one of the r-	0
Just do - capture the audio on the P_D_A and send the audio over the	0
Yeah. So, is- is  Bluetooth  the sort of thing that'd be, uh -	0
Uh, Bluetooth is shorter range, but you could use Bluetooth.	0
Wh- whatever the network guys already have hooked up for this floor. I don't remember what it's called.	0
another issue on file reorganization is, uh,	1
making data available to people outside ICSI.	1
So, specifically, the U_ W  folks have been	0
wanting to get  access  to it. So I think the right thing to do for that, is figure out how to do C_V_S without	0
uh, compromising security. Some pass- S_S_H tunneled	0
Well, I- I was -	0
and then give them access.	0
I was reading through some of the C_V_S documentation and you  can  just  substitute  C_V_S for your R_S_ H  command.	0
Yes, except that the command has to  not  take a  password.	0
Because it- it's non-interactive. And so the only way to  do  that is with, uh -	0
S_hosts , which is insecure.	0
So we  still  have to sort of  look  at it a little bit. I mean, I'm  sure  it's been  solved,  and I just haven't found the solution yet.	0
But I am sure that people have done it because it's gonna be a problem a lot of people have.	0
Who - Well, we're s- talking about a fairly limited group, are - are - is it a small enough group that they would - could just have accounts? Does that solve anything?	0
not  really,  because then we have the coordination issue.	0
I mean, so  one  thing they could do - I mean, I guess that's true.  They could simply log in to ICSI	0
Well they're gonna have to have accounts -	0
If they use S_S_H they have to have an account anyways.	0
Yeah, except they could share one.	0
Well, but that's not -	0
the S_S_H accounts, and the	0
user accounts don't have to be similar.	0
I mean, there are lots of ways of doing it, but w- but	0
if we can't figure out a remote way of doing it, just letting them log in to ICSI	0
So the intention was to put everything except the audio files themselves under revision control.	1
And the audio files, it's not worth doing cuz they're too big. You're never gonna be copying them around	1
and making working copies of them.	1
And then the other issue Jane and I spoke of   briefly  is just general permission issues.	1
That right now, lots of people create the files and then we have group "Meeting Recorder".	1
But that means anyone in the Meeting Recorder  group  can overwrite the files.	1
And so that's a pretty coarse level of  granularity. So we  might  wanna think about doing a Meeting Recorder user -  owner	1
for those files, and then doing group slightly differently. But -	1
Can you just do, like, S_U_X or something to modify -	0
I think what we have now -	0
I mean, if you just have one user that -	0
Another option is to m-	0
make it owned by a not real user, and then  root  will be able to do it.	0
But  root  is pretty tightly controlled here.	0
So th- I don't think that's a good solution.	0
Would - w- would it be possi- There are scripts that uh, run,	0
and - and when it's finished compressing, would it be possible for the script to change the permissions on the file to be more strict?	0
Yes,  but if you do that, then someone who isn't the owner can't	0
But after the meeting's done, would they want to?	0
Yeah, as I said, it's just a question of,	0
uh, do you wanna have to track down root	0
if you have to make any change.	0
But it doesn't have to be root. It could be some other user that we all can S_U_X  to.	0
You have security issues with that.	0
That's what we do with doctor-speech though, right?	0
No, with doctor-speech, it's just a group.	0
So - there're lots of different owners of i- i- of the files, but the group is always doctor-speech.	0
But there is a  user  doctor-speech.	0
I mean, I - I S_U_X to doctor-speech w- when I need to make a -	0
that's what I meant, it - just some	0
a directory on, uh, one of the -	0
user like "meeting-root" or something.	0
I mean, I'm not  too  worried, because the group's pretty small.	0
Also it seems like once it's been stored that night, it's - it's possible to recover from backups,	0
so that the main risk is avoiding it being accidentally deleted during the day that it was recorded.	0
Well, and just - You, then, also just have the general problem of permission on the other files,	0
that, do you want people checking out a transcript file	0
when they find an error,	0
and  correcting  it, or do they wa- do you want it to go through  you?	0
And I'd prefer it to go through me.	1
O_K,   but that means that you're gonna have to be  available  for people,  all  the time, who say "there's an error here",	1
rather than just - them just going in and correcting it.	1
Well I p- At  this  point -  Yeah.	0
Well, with C_V_S, though, you don't actually have to  do  it that way.	0
You have a  choice.  Either you  let  people do it themselves, or you don't.	0
What I'm saying is that it can  be  the case that people can do it themselves  and  it can be reviewed.	1
I mean, it's not like it's one or the other. We can do both.	0
Right, so you could get email.	1
Send email to Jane that someone has done a	1
I - I wanna  also  say that, you know, this is a -	0
uh, uh, My - my  view  on this is that once it's in a final  version  and I'm working  toward  all these being final  versions,	1
it can go into this next ro- this next realm. But it - it's sort of counter-productive to have	1
changes  made which I would be  making  if I'd just gotten that far in the  file.  You know, it's - it's, um.	1
Well, so, you don't have to  release  it	0
to the  world  until you're  ready  to.	0
So the question is s- w-	0
And then after  that,  then this would probably work.	0
So you would keep it in a separate file structure until you were ready to put it in the repository.	1
Or just keep the lock on it.	0
Is C_V_S, like - Yeah, just keep the  lock  on.	0
I mean, just check it out - check it out and don't let anyone check it out -	0
No, it does not - the  C_V_S   doesn't work that way.	0
Oh, it doesn't. Oh, O_K.	0
There's no - there's no lock when you check something out, not like R_C_S.	0
In other words,  everybody  can check out  anything.	0
The C_ stands for "concurrent".	0
So why not use R_C_S at that point? Just at that stage?	0
The nice thing about C_V_S is - is, you can be on a different machine.	0
But at that point -	0
we only  want,  probably, Jane to be in control  anyway,  and she - I mean, it's just an i-	0
wants to have access to these  files.  That's the whole  point.	1
But not to  modify  them, right? Just to  read  them.	1
Well, if they k- en- if they record a meeting, and they create a "key" file, and they find an error in their "key" file,	1
they shouldn't have to tell  us  about that	1
so that they can create -	1
correct an error in one of  their   files.	1
Well, the " key " file is -	0
So that's why I wanna do it -	0
I don't  know,  uh - I mean -	0
ke- " key " file's different.	0
Well, "key" file has the extra attributes that if you notice that there are lots of spikes on channel so-and-so, it's useful as a repository for putting that there.	1
And also if you notice that  there was an extra speaker, and didn't get mentioned in the "key" file, but they were only there for a second, but it's t- useful to mention that they were there.	1
So I th- I think that the "key" file is usefu- for notations related to the meeting,	1
But, I mean, the meetings are gonna be the same  way.  So U_W records a meeting, we transcribe it.	1
but it's  different  from the  transcript.	0
A few months later they listen to it and they say "Ope!  They got that acronym wrong."	0
Then they should send that through - Well -	0
It's sort of not really a question about  permissions,  but more of  procedure.   Either  those  all  go through  Jane,  or through  someone,	0
or they  all   don't.  But it's sort of -	0
And if they all  do,  then there isn't a  problem,  right? Cuz once they give us the data, it's	1
ours,  and if they wanna make changes - I mean, ours to sort of	1
And if they wanna make  changes,  they can   do  that.	1
The - the p- the  point  here is that it would be  nice  t- for there to be  one  repository.	1
And if  we  don't  let  them modify their own  data,	1
they're not gonna  store  their data in our  repository.	1
Or if we make it  inconvenient  for them to change their data.	1
So then if they do have acc-	0
I - I'm just looking at it the other way  around.	0
O_K, so what if they have -	0
What if they have  accounts  here,	0
So - so let's say we k-	0
at that point, where you can l- really lock a file.	0
I mean, I'm worried. If you can't lock a  file,  this - this to me sounds very  scary.	0
And if they have accounts here and they're  modifying  it - If they're ac-	0
if they're so closely linked that they're actually	0
modifying  transcripts and "key" files,	0
then they  could  do it	0
by, you know, secure-shelling into ICSI,	0
under R_C_S, at that point.	0
Ye- well, I don't see a real difference between R_C_S and any  other  system.	0
I mean, it's just mechanisms. The nice thing about C_V_S is that	0
you can have multiple people modifying and if the changes don't  overlap  each other,	0
they can just  do  it.	0
So the problem with  R_C_S  is that if two people	0
want to modify a file at the same  time  they  can't,	0
because the granularity of locking is at the file level.	0
What- what does C_V_S do if they - if they  do  overlap?	0
Uh, there're lots of different policies for dealing with it. So -	0
But typically a person has to,	0
you know, which changes actually get - go through.	0
Yeah, to decide which one is - Yeah.	0
So, maybe there  is  a way in C_V_S to  effectively	0
lock  something if you  don't  want people to make any changes?	0
At the  repository  level, there  certainly  is. You can mark a file as - as "you can't check this out".	0
So then you could use C_V_S	0
and, you know, just f- have remote access, but then it's up to whoever	0
is, sort of,  responsible  for that level of  transcription  to decide	0
how  and  when  to put these locks, or -	0
Well, it's - it's just like source code, right?	0
So that, when you're developing it and it's really  rough,  you don't put it in the  repository.	0
You wait to the point when you're ready to  release  it, and then you put it in the  repository  and if other people wanna -	0
The - Maybe the model - It's a little bit different in C_V_S. When you check something out, you actually create your own directory with copies of everything in it, and that's what you  work  on.	0
So, until you're ready to check it in,	0
nobody sees anything you've done. And then when you check it in, it puts, sort of, you know - every change that you've done is - goes into the central -	0
So if that's at an-	0
I guess it depends on Jane's - Uh, you know, if that's - if that model  works  for the  transcripts,  then	1
that's  fine.  But if that pr-	1
someone to come in and modify while  you're  modifying, and they turn out to be changes that,	1
you know, would have been better to  wait  until your  version  came out, then	1
that's really up to  you,  not up to the  software,  so.	1
I also think, um, that the type of change ch- ch- varies an- I think it's a very good point. Because what if	1
the - uh, what if  one  set of changes  one  person was making was	1
with reference to some  typographical  convention.	1
And the  other  person n- unkn- n-	1
quite unknowingly, was changing it the other way  around.	1
Then you could end up with a  real   mess,  in terms of, like, consistency of conventions across a file, there  is  an argument to be made for having a single editor editing at that level.	1
Well yeah, there would - there would have to be somebody to enforce the consistency. Yeah.	0
But I like b- I like what Liz is saying about -	0
That's right. And I also like - I l- also like Liz's uh, k- um,	0
phraseology of "at this level of" - I don't remember how you put it,  but this - "at this level of transcription" or whatever. I mean it's like there are different layers of whatever and different  types  of conventions,	0
and if it were an  acronym,  then I would - I think that it would make sense f- for them to	0
have  input   into   that  level of things, but I wouldn't want them to be changing -	0
Imagine that we reverse this and  they  were keeping the repository and  we  were d- collecting meetings and  sending  them to them.	1
If I found an error,	1
and I sent them email and said "here's this error", and I didn't get a  response  for a couple weeks,	1
I would stop sending them the - my data and I would start collecting it here and we would end up with two corpora.	1
And I  don't  want that to  happen.  So we have to make it  convenient  for them to make changes that they wanna  make.	1
Well, I see now, we're k- back into the same situation as when we were,	0
uh, talking about a- allowing people to edit	0
the transcripts before they  become public.	0
So there's a question of how easy or how hard to modify, and how that	1
impacts the amount of changing that's done.	1
And I - I think that it's, um,	0
I - I have received some suggestions for change, which I've  made.	0
And um, I think with an  acronym,  that's a clear case where it would be an  easy  change to incorporate.	1
But it  would   worry  me to have people, um,	1
having free reign to change these things, because of the need to have consistent conventions. And  people who	1
are only just  visiting  the data might not have a sense of the larger system.	1
Yeah, that's what  I  would be worried about  too.	0
Well, I think - yeah, I think there are probably ways that you can say that, you know, only certain users are allowed to change	1
Uh, so we can probably restrict it to be -	0
You know, f-  casual  users who are just  browsing  can just r- get it read-only, can't check in to the archive.	0
Whereas we could say "other people", you know, "these people are allowed to actually submit changes".	1
I - I think  one  thing that's probably everybody would  agree  on is that	1
there will never be a point where	1
you know, we can say that for  sure  there's no problems with any of the transcripts. I mean there's,	1
uh - f- You know,  something's  going to get overlooked at some point, or somebody's gonna wanna make a change  somehow.  So we need to	0
um, handling changes in the  future.	0
I agr- I agree but I have to also add  one   other  thing which i- before I forget it,  which is	0
Adam's  point about when you were reviewing the I_B_M transcripts.	0
u- This was mentioned at the beginning of the meeting.	0
You said that there were  some  places where  it  wasn't  what y- was written  already,  but you could  see  how they might have thought that's what it  said.	0
So there - it's  not  just a right and  wrong  thing.  Sometimes  there tru- there are  absolutely  stretches where there  is  no - no - k- if you were at the meeting and you could  ask  the person,	0
maybe,  m- you know, they could - they could've  told  you, but five minutes  later  they might not have been able to tell you,	0
even if they were  listening  to it.	0
So, sometimes it isn't right and wrong, sometimes it's multiple interpretations, and -	0
Now - But of course, this  does  raise the  possibility  of  allowing,	0
um, an extra annotation for, you know, alternative interpretations of a stretch.	0
But I just wanted to say it isn't simply right or wrong.	0
Yeah, that's a good point.	0
Or overlooked or not overlooked.	0
Sometimes they're truly ambiguous, and	0
um, uh, um, nice to have a  notation  for that, but. Yeah.	0
I mean, I like that idea because even a casual user can always send  email	0
to whoever's in charge, and say,	0
you know, "we'd like these changes" and,	0
you know, hopefully we'll give them a response. And if they really do it a  lot,  and they say	0
I just - I don't s-	0
I don't see that this is e-	0
"we're a casual user but we want a chance to change the  transcripts " then we can	0
face that if it  happens,  but	0
Can you write "unread" on that?	0
I don't really see the people at U_W that I  know  of right  now  making huge amoun- investing huge amounts of time in changing transcripts. But I could be wrong.	0
Probably not  transcripts,  but it would be nice to have  one  mechanism for  all  the files.	0
And they're  certainly  gonna wanna change  tools.	0
And so - you know, it's the same as source code. You - you release source code at some point.	0
And, either  you  have to do everything or you  share  responsibility.	0
Yeah I mean a lot of the open source pro-	0
projects face this same problem.	0
You know, p-  anybody  can check out the code,	0
but  not  everybody can check it in.  Yeah.	0
